case,speaker,content,is_fraud
案例-48,张伟,你稍等一下，我这边帮你看一下充值情况。,True
案例-48,郭丽,我看到了，有返现了500元，而且我再试试提现，真的只扣了2元，这也太好了吧！,False
案例-48,张伟,哈哈，是吧？其实这也是公司给的福利，主要是回馈长期用户的。你觉得好的话，可以多充点，攒点本金后再提现，这样能省不少手续费呢。,True
案例-48,郭丽,好的，我决定再多充点试试。,False
案例-48,郭丽,我已经陆续充值了14万元，现在打算一次性提现，这样能省不少手续费。,False
案例-48,郭丽,怎么回事，我怎么登不上这个公众号了？张伟，能帮我看看吗？,False
案例-48,郭丽,我的天！张伟你怎么也联系不上了？我这是被骗了吗？,False
案例-49,李雪,嗨，麻先生，你好呀！很高兴在这个平台上认识你。,False
案例-49,麻某,李小姐，你好！我也很高兴认识你。你平时都喜欢做些什么啊？,False
案例-49,李雪,我平时喜欢看看书，偶尔也会做些理财投资，这样不仅能增值，还能学到很多东西。,False
案例-49,麻某,哇，听起来很不错呢！你最近在做哪方面的投资呢？,False
案例-49,李雪,其实最近我发现了一款很不错的APP，叫做‘方圆出海’，可以在上面倒卖商品，赚了不少。你有没有兴趣一起试试？,True
案例-49,麻某,听起来挺有意思的，可以详细说说吗？,False
案例-49,李雪,当然可以啦。这款‘方圆出海’APP是一个很正规的平台，你只需要在上面充值，然后购买一些商品，再以高价卖出去，就能赚取差价。这确实是一个不错的赚钱方法呢！,True
案例-49,麻某,那具体要怎么操作呢？需要充值多少？,False
案例-49,李雪,不需要很多，刚开始你可以充一点试试，几千块就行。操作也很简单，我可以指导你怎么做，你看过来，这个页面就是充值的地方。,True
案例-49,麻某,好的，我先看看。,False
案例-49,民警,麻先生，请等一下，我们是上海金山的民警。我们了解到你最近在接触‘方圆出海’这个APP，这其实是一种非常常见的‘杀猪盘’诈骗手法。千万别充值，这样你会有很大的经济损失。,False
案例-49,麻某,啊，真的吗？太感谢你们了，幸亏有你们提醒，不然我还真准备充值了。,False
案例-49,李雪,麻先生，你怎么可以相信他们呢？这个APP是安全的，你看我在这里赚了这么多。如果你不相信可以再了解一下。,True
案例-49,民警,麻先生，请不要再听这个‘李雪’说了，她就是骗子！请千万不要再上当了。,False
案例-49,麻某,好的，我明白了。谢谢你们的提醒，我不会再上当了。,False
案例-50,刘涛,你好，美眉，看到你的资料感觉我们很有缘。平时你喜欢做什么呀？,False
案例-50,李华,你好，刘先生。我平时喜欢阅读和旅游，你呢？,False
案例-50,刘涛,我也喜欢旅游，尤其喜欢探险类的旅行。对了，现在工作有点忙，不过每天还是会抽出时间锻炼身体。,False
案例-50,李华,哇，你真的很热爱生活啊！平时工作这么忙还坚持锻炼，真是值得学习。,False
案例-50,刘涛,其实，我觉得生活和工作都需要一个平衡。我最近发现了一个很不错的投资项目，能让我有更多时间享受生活。不知道你是否有兴趣了解一下？,True
案例-50,李华,投资项目？听起来很不错，我以前没有接触过这方面的，你能告诉我更多细节吗？,False
案例-50,刘涛,当然可以，这个项目是一个新型的理财平台，主要做的是股票和基金投资。我已经投了不少，收益相当不错。如果你有兴趣，我可以带着你一起做。,True
案例-50,李华,真的这么好吗？那安全吗？我之前听说过一些骗人的投资平台，有点担心。,False
案例-50,刘涛,理解，很正常。这个平台是我朋友推荐的，他在金融行业工作，已经在这里赚了很多钱。我自己用了几个月了，都是真实有效的。你可以先投点小钱试试，觉得好再加大投入。,True
案例-50,李华,既然你这么说了，那我就试试吧。,False
案例-50,刘涛,好的，我会帮助你注册账号，然后指导你怎么操作。相信我们一定会一起赚很多钱的。,True
案例-50,李华,太好了，谢谢你，刘先生。有你这样细心的人帮助，我就放心了。,False
案例-51,詹鹏,嗨，您好，我是詹鹏，在这个平台上看到您的资料觉得很有缘分。,True
案例-51,李华,你好，詹先生，你的资料看起来也很不错，我们可以多聊聊。,False
案例-51,詹鹏,非常荣幸。其实我在澳门有一家投资公司，平时比较忙，但您真的很特别，我们可以通过微信继续聊吗？,True
案例-51,李华,当然可以，这是我的微信号：123456。,False
案例-51,詹鹏,我已经添加您为好友了。其实，我一直觉得遇到您是缘分，我对您的感觉也很特别。,True
案例-51,李华,谢谢，我也觉得我们挺聊得来的。,False
案例-51,詹鹏,我最近在研究一个很有前景的投资项目，您有没有兴趣了解一下？,True
案例-51,李华,哦？什么项目？,False
案例-51,詹鹏,是这样的，我发现一个博彩网站，叫‘澳门皇冠娱乐城’，我通过朋友得知它有一些系统漏洞，可以稳定赚钱。,True
案例-51,李华,听起来有点意思，可是这些平台可靠吗？,False
案例-51,詹鹏,这个平台我已经试过了，真的可以提现，而且非常便利。我已经赚了不少钱，如果您有兴趣我可以教您怎么操作。,True
案例-51,李华,真的可以赚钱吗？会不会有风险？,False
案例-51,詹鹏,完全没有问题的！我用自己的一部分存款已经赚了两倍了，系统漏洞很稳定。我可以帮您注册，我们一起赚钱。,True
案例-51,李华,那好吧，我可以试试看。需要多少钱启动？,False
案例-51,詹鹏,您先可以转5000元到这个银行卡号，我会帮您操作第一次投注。等您看到效果，再考虑加大投入。,True
案例-51,李华,好的，我马上转账。,False
案例-51,詹鹏,已经收到，稍等，我会马上帮您操作。等我消息。,True
案例-51,詹鹏,太好了，第一次下注已经赢了2000元！您可以尝试提现看一下。,True
案例-51,李华,真的提现成功了！谢谢您，詹先生，好像真的可以赚钱。,False
案例-51,詹鹏,我就说吧，这里确实可以赚钱。其实，如果您有更多资金投入，回报会更高！,True
案例-51,李华,好吧，我决定再转一些钱试试。,False
案例-51,詹鹏,好主意，我会继续帮您操作，保证您的资金安全。,True
案例-52,董伟,你好，我是董伟。请问你是小倩吗？,False
案例-52,何倩,是的，我是小倩。很高兴认识你，伟哥。,False
案例-52,董伟,我也是。你的照片很漂亮，我很喜欢。,False
案例-52,何倩,谢谢，你也很帅哦。你是什么工作的？,False
案例-52,董伟,我在一家外企工作，刚好今天下班比较早。,False
案例-52,何倩,那你工作应该很忙吧，有时候是不是会加班很晚？,False
案例-52,董伟,恩，是的，经常要加班。不过和你聊天很开心，能缓解很多压力。,False
案例-52,何倩,我也很开心。伟哥，我们聊了这么多，我觉得咱们很合适。,False
案例-52,董伟,是啊，我也是这样觉得。我们正式交往吧。,False
案例-52,何倩,好啊，伟哥，你对我真是太好了。,False
案例-52,何倩,伟哥，我的衣服破了，想买些新衣服。你能借我一点钱吗？,True
案例-52,董伟,额，买衣服需要多少钱呢？,False
案例-52,何倩,也不是很多，大概几千块钱吧。,True
案例-52,董伟,好的，我稍后用支付宝转给你。,False
案例-52,何倩,伟哥，我爸爸生病了，需要钱治疗，你能再借我点钱吗？,True
案例-52,董伟,啊，这么严重？需要多少钱？,False
案例-52,何倩,医生说要20万，我真的很着急，伟哥，求你帮帮我。,True
案例-52,董伟,好吧，我尽量凑一下钱。,False
案例-52,董伟,小倩，我们什么时候见面呢，我真的很想见你。,False
案例-52,何倩,最近我家事情很多，等我这边事情解决了就去找你，好吗？,True
案例-52,董伟,好吧，我等你。,False
案例-52,何倩,伟哥，我房子要装修，需要点钱周转，你能帮我吗？,True
案例-52,董伟,嗯，需要多少呢？,False
案例-52,何倩,大概20万吧，这是最后一次，我一定会还你的。,True
案例-52,董伟,好吧，我再帮你一次。,False
案例-52,董伟,小倩，最近发生什么事了吗？你怎么不理我了。,False
案例-52,何倩,对不起伟哥，我不想继续了，我们分手吧。,True
案例-52,董伟,什么？分手？为什么？,False
案例-52,何倩,对不起，我有我的难处，希望你能理解。,True
案例-53,陈浩,您好，我是浩信投资的理财顾问陈浩，我们公司最近推出了一款全新的投资理财App，收益非常不错，您有兴趣了解一下吗？,True
案例-53,张丽,您好，陈顾问，我对理财感兴趣，请问这款App的收益情况怎么样？,False
案例-53,陈浩,这款App名叫‘金牛理财’，它的操作非常简单，收益稳定，我们的许多客户都已经获得了可观的回报。只需要您下载注册，就能开始投资。,True
案例-53,张丽,听起来不错，请问下载链接在哪里，我需要提供些什么资料？,False
案例-53,陈浩,您可以通过这个链接下载‘金牛理财’App，下载后只需要用手机号码注册，然后绑定您的银行账户即可，我们会有专人全程指导，确保您的资金安全。,True
案例-53,张丽,好的，我下载好了，请问接下来怎么操作？,False
案例-53,陈浩,接下来您只需要选择一个您感兴趣的理财产品，投入资金就可以开始您的投资旅程了。我们会在后台实时监控，确保您的投资安全并提供最快捷的反馈。,True
案例-53,张丽,非常感谢您的帮助，我已经投资了一些钱，如何查看收益呢？,False
案例-53,陈浩,您可以在App内的‘我的账户’页面查看您的收益情况。如果有任何问题或者需要咨询，可以随时联系我。,True
案例-53,张丽,好的，谢谢您。我看收益有点慢，这样正常吗？,False
案例-53,陈浩,是的，张女士，短期收益可能会有波动，但长期来看，收益是非常可观和稳定的。您可以选择追加投资，这样收益会更快更明显。,True
案例-54,陈贤,你好，我叫陈贤，是一名退役军人，马上要回到我们这个地区工作。最近在相亲网站上看到了你的信息，觉得你很特别，所以想和你交个朋友。,False
案例-54,蒙丽,你好，陈先生，我是蒙丽。很高兴认识你！退役军人很了不起啊，你的工作很辛苦吧。,False
案例-54,陈贤,是的，但我觉得为国家服务很荣幸。其实我很喜欢与你聊天，感觉你很温柔善解人意。我们能不能变得更亲近一些呢？,False
案例-54,蒙丽,谢谢你对我的夸奖！我也觉得我们有很多共同话题，希望我们能一直这样聊下去。,False
案例-54,陈贤,既然你这么信任我，我也想和你分享一下我的投资项目。最近我发现一个投资药材生意的机会，回报很高而且风险低，不知道你有没有兴趣了解一下？,True
案例-54,蒙丽,哦，这听起来挺不错的。你做这个投资很久了吗？,False
案例-54,陈贤,是的，我已经做了一段时间了，效果非常好。在这个项目中投资的钱可以很快见到效益，而且没有什么风险。其实我觉得像我们这种关系，不妨一起做，赚到钱了也能一起享受。,True
案例-54,蒙丽,真的那么好吗？我有些心动了，但是我对投资并不是特别了解，这个项目靠谱么？,False
案例-54,陈贤,你尽管放心，我已经研究了很久，这个项目非常稳妥。我可以带你一起做，你就不用担心任何问题。只需按我说的做就行，前期只需要投入一些资金，很快就会有回报。,True
案例-54,蒙丽,那好吧，我相信你要不然我试试看，先投资一部分钱。到底怎么操作呢？,False
案例-54,陈贤,非常简单，你只需要把资金转到这个账号：xxxxxx。我会帮你处理所有的事情，等赚到钱你就可以取出来了，让我们一起发财吧。,True
案例-54,蒙丽,好，我现在就按你说的操作，期待我们的成功！,False
案例-55,张伟,李丽，你好！很高兴在网上认识你，这是我的名片，我在一家投资公司工作，平时喜欢研究一些理财产品。,False
案例-55,李丽,你好，张伟。挺厉害的啊！我对投资也有点兴趣，但不是很懂。,False
案例-55,张伟,没关系，我可以教你啊。其实最近我们公司推出了一个新的投资平台，叫‘华润金融’，收益非常稳定，你有听说过吗？,True
案例-55,李丽,没有听说过呢，这个平台可靠吗？,False
案例-55,张伟,当然可靠了，这是我们公司最引以为豪的项目，我自己也在这个平台上投资了不少，收益非常不错。其实你可以试着投资一点点，看看效果如何。,True
案例-55,李丽,那听起来还不错，我该怎么操作呢？,False
案例-55,张伟,你只需要下载这个APP，然后注册一个账号，之后按照提示充值就可以开始投资了。我可以一步一步帮你操作，确保你不会弄错。,True
案例-55,李丽,好的，谢谢你，那我先试试少量的投资看看效果。,False
案例-55,张伟,没问题，你放心大胆地试，投入的越多，收益也会越大。,True
案例-55,李丽,张伟，我已经投了一些钱进去，好像收益还不错。,False
案例-55,张伟,嗯，看吧，我就说这个平台特别好。你可以再多投入一些，收益可能会更高，这样我们未来在一起也有更多的经济保障。,True
案例-55,李丽,听你这么说，那我就再追加一些投入，争取更大的收益。,False
案例-55,张伟,是啊，不用担心，我都在这里面投了很多钱，一直收益很好。,True
案例-55,李丽,怎么最近我发现提现不了呢？,False
案例-55,张伟,应该是平台在维护，你再等等看看，或者试着联系客服。,True
案例-55,李丽,张伟，平台一直不能提现，我觉得有点不对劲。,False
案例-55,张伟,不要急，可能是短期的技术问题，我再帮你问问看。,True
案例-55,李丽,我去找了客服，但根本联系不上，我觉得自己好像被骗了。,False
案例-56,张强,你好，我是张强，刚在一个投资论坛上看到你发布的问题，我觉得我们可以交流一下。我有些投资经验，可以分享给你。,True
案例-56,李丽,你好，张强，我是李丽。谢谢你联系我。我最近确实对投资感兴趣，不知道有什么好的建议吗？,False
案例-56,张强,李丽，其实我自己也不是什么大投资人，不过我最近参加了一个稳定增值的投资项目，收益很不错。你愿意了解一下吗？,True
案例-56,李丽,听起来不错呀！能具体讲讲是什么项目吗？,False
案例-56,张强,这个项目不是公开的，需要有介绍人才能参与。我可以介绍你进去。项目名字叫‘安泰投资’，每天都有收益，而且资金可以随时提现，很安全。,True
案例-56,李丽,这种项目靠谱吗？我有点担心资金安全问题。,False
案例-56,张强,当然靠谱，我自己也投了几万进去，现在每个月都有固定回报。我还可以带你看我们的投资群，那里有很多人，都在里面赚钱。,True
案例-56,李丽,好吧，那我可以先了解一下情况吗？,False
案例-56,张强,当然可以，我先把群链接发给你，你加入之后看看大家怎么说。如果有问题随时问我。,True
案例-56,李丽,谢谢你，张强。感觉你真的很热心。,False
案例-57,张俊,你好，我是在一个投资交流群里看到你的，我们之前有过一些投资讨论，你还记得吗？,False
案例-57,翁丽,啊，真的？我好像不太记得了。,False
案例-57,张俊,没关系的，其实我注意到你对投资还是挺感兴趣的，所以特地想推荐一个高收益的投资平台给你，反正你可以了解了解，没准对你有帮助。,True
案例-57,翁丽,高收益的投资平台？听起来挺不错的，可以具体说说吗？,False
案例-57,张俊,当然可以，这个平台叫做‘财富之路’，它的背景很正规，收益也很稳定，年化收益率可以达到20%以上。你只需要注册账号并进行一些简单的操作，就可以开始投资了。,True
案例-57,翁丽,年化收益率20%以上？那听起来确实很诱人。怎么注册账号呢？,False
案例-57,张俊,你可以通过这个链接进行注册，注册时填写必要的信息就行了。我还可以给你推荐几只收益稳定的基金，帮助你更快上手。,True
案例-57,翁丽,好，我来试试看。,False
案例-57,张俊,太好了！注册之后记得告诉我账号名称，我可以帮你检查一下是否成功。别担心，平台非常安全，我们都在这上面投资。,True
案例-57,翁丽,我注册好了，账号名称是olivia_wong。,False
案例-57,张俊,好的，我看了一下，一切正常。你现在可以先充值一小笔资金试试水，如果有任何问题随时告诉我，我随时在线帮你解决。,True
案例-57,翁丽,好，我刚刚充值了一千元，接下来该怎么操作？,False
案例-57,张俊,很好！你可以先购买一些我们推荐的基金，看下收益情况，后续如果感觉不错，可以逐步加大投资。,True
案例-57,翁丽,明白了，谢谢你的推荐和帮助，我会关注收益情况的。,False
案例-57,张俊,不客气，希望你能在这个平台上获得丰厚的回报。如果有问题，随时聊。,True
案例-58,王丽,你好，我叫王丽，很高兴认识你。你呢？,False
案例-58,张伟,你好，我叫张伟，也很高兴认识你。你是做什么工作的呢？,False
案例-58,王丽,我现在在一家文化媒体公司上班，主要负责一些活动策划。你呢？,False
案例-58,张伟,我在一家IT公司做工程师，日常工作比较忙。听起来你的工作挺有趣的。,False
案例-58,王丽,是呀，我的工作还算轻松。对了，我现在有些烦恼，我们公司可能要裁员了，我正在考虑以后应该做什么工作。,True
案例-58,张伟,真是糟糕啊，你有没有考虑过其他行业？比如什么样的工作会比较适合你？,False
案例-58,王丽,嗯，我最近在考虑要么去酒吧兼职，要么试试看当主播。不知道你觉得哪个比较好呢？,True
案例-58,张伟,我觉得当主播不错啊，听说现在直播行业蛮挣钱的。而且你那么有才，肯定会有很多粉丝的。,False
案例-58,王丽,谢谢你的建议！我也觉得当主播好像更有发展。那我就去试试看吧，如果你有空的话，可以来看我的直播哦,True
案例-58,张伟,好的，我一定会去支持你的。到时候发个链接给我吧。,False
案例-58,王丽,好的，我今晚八点就开始直播，到时候等你哦。,True
案例-58,张伟,一定一定，我会去支持你的。加油！,False
案例-58,王丽,谢谢你的支持，你真是个好人！话说回来，主播赚的钱是靠打赏的，如果你有条件的话，可以多多支持我哦。,True
案例-58,张伟,没问题，只要能帮到你，我一定会尽力。,False
案例-58,王丽（实为男性骗子）,感谢你，到时候见哦。,True
案例-59,李俊,你好，我在小红书上看到你发布的美甲照片，真的很漂亮，和你的肤色特别搭。,False
案例-59,张丽,谢谢你的夸奖，我只是随手分享到小红书上的。,False
案例-59,李俊,不客气，我看你还打了理财和相亲的标签，平时对投资理财有兴趣吗？,True
案例-59,张丽,是啊，我最近刚开始学习理财，不过不太懂，经常亏钱。,False
案例-59,李俊,别灰心，我正好从事金融行业，有多年投资经验。如果你不介意，我可以给你一些建议。,True
案例-59,张丽,真的吗？那太好了！非常感谢。,False
案例-59,李俊,当然，完全没问题。我们可以先从小额投资开始，我会教你如何在低风险的情况下获得高收益。,True
案例-59,张丽,听起来不错，我愿意试试看。,False
案例-59,李俊,好的，那我这边有个非常安全的平台，是我自己在用的。如果你感兴趣，我可以帮你注册一个账户。,True
案例-59,张丽,好啊，那麻烦你了。,False
案例-59,李俊,不用客气。你的账户已经注册好了，这是你的用户名和密码。你先充值一些资金试试，我们先从小额投资开始。,True
案例-59,张丽,好的，我先充值1万元试一试。,False
案例-59,李俊,很好，你可以看到你的投资已经开始赚钱了。如果你有更多的资金，可以获得更高的收益。,True
案例-59,张丽,真的赚了！我再多投一些，看能不能赚更多。,False
案例-59,李俊,完全可以，越多的资金投入，回报也会更高。你放心，这个平台非常安全，我自己的资金也都在这里操作。,True
案例-59,张丽,明白了，我会多投一些。谢谢你的帮助，这段时间你真是给了我很大的支持。,False
案例-59,李俊,不用谢，我也喜欢和你聊天，觉得我们很合拍。投资也是我们共同的兴趣，我希望我们能有更多的交流。,True
案例-59,张丽,是啊，我也这么觉得。希望我们一起投资都能顺利。,False
案例-59,李俊,一定会的。不过还有一点，需要你注意，只有在特定的时间段投资才能最佳增值效果。我会告诉你具体什么时候操作。,True
案例-59,张丽,好的，我会密切关注你的消息。,False
案例-59,李俊,很好，那我们保持联络，有任何问题随时问我。,True
案例-59,张丽,谢谢，我一定会的。,False
案例-60,李伟,靓女，交个朋友呗~,True
案例-60,赵小美,你好啊，怎么称呼你呀？,False
案例-60,李伟,我叫李伟，在一家金融公司上班。你呢？,False
案例-60,赵小美,我叫赵小美，在一家广告公司工作。很高兴认识你！,False
案例-60,李伟,小美，你喜欢投资理财吗？最近我发现一款投资软件，收益特别好。,True
案例-60,赵小美,是吗？那具体是怎么操作的呢？,False
案例-60,李伟,很简单，我给你发个链接，你下载一个投资软件，然后我教你怎么操作。你可以试着投一点，看看收益如何。,True
案例-60,赵小美,好吧，那你发过来吧。,False
案例-60,李伟,链接我发你了，下载好后告诉我，我一步一步教你。,True
案例-60,赵小美,我下载好了，现在要怎么做？,False
案例-60,李伟,很好，现在你注册一个账号，然后先充值一小部分试试看，平台上有很多人都在赚钱，我保证你不会亏的。,True
案例-60,赵小美,好的，我已经充值了，现在该做什么？,False
案例-60,李伟,很好，现在你按照提示投资一些项目，很快你就会看到收益的。我之前也赚了不少，大家都说这个平台很靠谱。,True
案例-60,赵小美,好的，我跟着你说的做了，真的可以看到一些收益。,False
案例-60,李伟,是吧！我就说很靠谱吧？你可以再多投一些，这样收益也会更高。别担心，我会一直帮你看着。,True
案例-60,赵小美,那我再投一些，希望能够赚更多。,False
案例-60,李伟,没问题，有什么不懂的随时问我。咱们一起赚钱。,True
案例-60,赵小美,李伟，我想把平台里的钱提现，为什么一直提现不了呢？,False
案例-60,李伟,别急，客服可能在维护系统，再试试。如果有问题，我帮你联系下客服。,True
案例-60,赵小美,还是提现不了，客服一直找各种理由推脱，不会是骗子吧？,False
案例-60,李伟,怎么可能呢，小美，肯定只是系统问题，再耐心等等。我再去催催客服。,True
案例-60,赵小美,李伟，我真的感觉不对劲，我要报警了。,False
案例-60,李伟,别冲动，报警解决不了问题，我一定会帮你把钱提出来的。相信我。,True
案例-61,杨可欣,你好，我叫杨可欣，很高兴认识你。,False
案例-61,李明,你好，我叫李明，我也很高兴认识你。,False
案例-61,杨可欣,李明，你平时喜欢做什么？有什么爱好吗？,False
案例-61,李明,我喜欢旅游和看书，你呢？,False
案例-61,杨可欣,我也喜欢旅游。这么说来我们还挺有共同话题的。,False
案例-61,杨可欣,你最近有什么旅行计划吗？,False
案例-61,李明,还没有特别的计划，你呢？,False
案例-61,杨可欣,我打算去海南度假，很想找个人一起去。,False
案例-61,杨可欣,对了，最近我有些投资项目正在进行，你有没有兴趣了解一下？,True
案例-61,李明,投资项目？可以说说看是什么项目吗？,False
案例-61,杨可欣,是一个稳定的理财平台，回报率很高而且很安全。我做了一段时间，效果很好，要不要我给你推荐一下？,True
案例-61,李明,听起来还不错，你能具体讲讲吗？,False
案例-61,杨可欣,当然可以，这是一个叫XX理财的投资平台，非常正规，我也是通过朋友介绍才知道的，要不你注册一个账号，我带你一起操作。,True
