case,speaker,content,is_fraud
案例-94,李倩,你好，我是李倩，很高兴认识你。,False
案例-94,张伟,我看到你的照片觉得你很美，而且你的个人资料也很吸引我。你平时都喜欢做些什么呢？,True
案例-94,李倩,谢谢夸奖，我平时喜欢看书、旅游，还有做些手工艺品。你呢？,False
案例-94,张伟,我也很喜欢旅游，每年都会去几个地方散心，而且我还喜欢投资理财，这样才能更好地规划未来。,True
案例-94,李倩,听起来很不错啊，我对理财也有些兴趣，可是总觉得有点复杂。,False
案例-94,张伟,其实理财并不复杂，只要找到好的平台。我最近就在用一个投资平台，回报率很高，很稳健。我可以带你一起试试。,True
案例-94,李倩,真的吗？那需要投入很多钱吗？,False
案例-94,张伟,不用的，刚开始你可以先投入小额的资金，比如几千块钱，看看效果。等看到收益后再加大投资也不迟。,True
案例-94,李倩,听起来还不错，我会考虑一下。,False
案例-94,张伟,好的，等你决定好随时告诉我，我会帮你注册账号和投第一笔款项，这样你可以更安心些。,True
案例-94,李倩,那就麻烦你了，我应该怎么操作呢？,False
案例-94,张伟,我会发你一个链接，你注册一下，把账户和密码发给我，我帮你操作。放心好了，全程透明，任何问题我都会随时向你汇报。,True
案例-94,李倩,好的，我现在注册一下。,False
案例-94,李倩,已经注册好了，这是账号和密码。,False
案例-94,张伟,收到了，我现在帮你投资，你可以随时登录账户查看收益。,True
案例-94,李倩,刚才登录看了一下，确实涨了不少收益！真的太好了！,False
案例-94,张伟,这就是这个平台的优势所在。你看，现在你信任这个平台了，可以再多投入一些资金，这样收益会更高。,True
案例-94,李倩,好，我把多余的钱都投进去，希望能有更好的收益。,False
案例-94,张伟,放心吧，这个平台不会让你失望的。,True
案例-94,李倩,我已经把钱投进去了，现在账户显示金额增加了很多，非常感谢你。,False
案例-94,张伟,没问题，这都是我应该做的。你可以继续跟进，一旦有新的投资机会我会及时告诉你。,True
案例-94,李倩,好的，我会随时留意的，再次谢谢你。,False
案例-94,张伟,别客气，我们是一条战线上的战友，为了我们的未来一起努力。,True
案例-94,李倩,是的，非常期待未来的美好生活。,False
案例-95,张伟,你好，我是张伟，在婚恋网站上看到你的资料，觉得你很有趣，咱们可以聊聊吗？,False
案例-95,李娜,你好，张伟。我是李娜，也很高兴认识你。你是做什么工作的呢？,False
案例-95,张伟,我是一名金融分析师，主要是做一些投资和理财方面的工作。你呢？,False
案例-95,李娜,我在一家公司的行政部门工作。金融分析师听起来很棒啊，应该很懂投资吧？,False
案例-95,张伟,还好吧，主要是工作需要。其实我自己也在做一些投资，效果还不错。如果你有兴趣，我可以给你一些建议哦。,False
案例-95,李娜,真的吗？那太好了，我对这些也很感兴趣，但一直没什么头绪。,False
案例-95,张伟,没问题，咱们可以慢慢来。最近我在一个平台体验了下注博彩，回报率非常高。如果你愿意，我可以带你一起看看。,True
案例-95,李娜,博彩？听起来有些风险啊。,False
案例-95,张伟,其实这些平台是经过我们专业人士分析的，风险比较低，而且收益很高。如果你愿意，我可以帮你一起操作，确保安全。,True
案例-95,李娜,嗯，那你说的这个平台叫什么名字？,False
案例-95,张伟,这个平台叫做XXXX（虚假网站名），你可以先注册一个账号，然后我教你怎么操作。,True
案例-95,李娜,好吧，我试试看。,False
案例-95,张伟,你可以先小额充值，了解下平台的运作。后续有问题随时问我。,True
案例-95,李娜,好的，我充值了1000块钱。,False
案例-95,张伟,很好，我们先进行一次小额投注，看看效果。通常这种情况下，运气稍好就能有很不错的回报。,True
案例-95,李娜,我投了，怎么知道是否中了呢？,False
案例-95,张伟,你可以在平台上看到结果，回报会直接到账。如果有问题，可以截图给我看看。,True
案例-95,李娜,真的中了！我的1000块钱变成了2000块！,False
案例-95,张伟,看吧，我就说没问题的。你可以再投一点，试试更多的机会。,True
案例-95,李娜,好的，我再投5000块钱。,False
案例-95,张伟,很好，如果有好的机会我会马上告诉你。记得随时关注平台的动态。,True
案例-95,李娜,怎么回事？这次钱好像没到账，而且平台也无法访问了。,False
案例-95,张伟,没关系，可能是平台维护。你先别急，我帮你联系下客服看看情况。,True
案例-95,李娜,好的，你尽快帮我处理一下，我担心这会不会有问题。,False
案例-95,张伟,放心吧，我一直都在，你的钱不会有问题的。最多几个小时就好了。,True
案例-95,李娜,好吧，那我等你的消息。,False
案例-96,王琳,你好，我是王琳儿，四川成都人，26岁，目前在新加坡一跨国公司做金融理财工作。你呢？,False
案例-96,王刚,你好，我叫王刚，35岁，住在重庆，从事IT工作。很高兴认识你。,False
案例-96,王琳,很高兴认识你！我平时工作比较忙，但希望能找到一位在国内工作的优质男士为伴。你有兴趣吗？,False
案例-96,王刚,当然有兴趣！你看起来很有魅力，也很有前途。,False
案例-96,王琳,谢谢夸奖！我们可以多聊聊，慢慢了解彼此。你喜欢什么类型的活动呢？,False
案例-96,王刚,我喜欢旅游和看电影，你呢？,False
案例-96,王琳,我也喜欢旅游，还喜欢在工作之余研究一些理财和投资的东西，因为我在金融公司工作嘛，对这些比较感兴趣。,False
案例-96,王琳,对了，我有个朋友在东南亚一些国家的博彩网站上投注，因为他知道一些漏洞，每次都能赚不少钱。而且在这些国家网络赌博是合法的。,True
案例-96,王刚,真的吗？听起来很有趣。不过这种事情靠谱吗？,False
案例-96,王琳,当然靠谱了，不然我也不会相信。他还教了我一些方法，我自己也在用，每次都能赚一些。不如你也试试？我可以教你。,True
案例-96,王刚,真的吗？那我可以先试试小额的投注吗？,False
案例-96,王琳,当然可以，我会一步步指导你的流程。放心，不会有问题的。,True
案例-96,王刚,好吧，我先投几百元试试。,False
案例-96,王琳,好的，我给你链接，你按照操作就行了。投注后把截图发给我，我帮你看看有没有问题。,True
案例-96,王刚,已经投注了，真的赚了一点呢！,False
案例-96,王琳,看吧，我没有骗你吧？如果投入更多，赚的也会更多。要不要试试增加投注？,True
案例-96,王刚,那我再试试几千元。,False
案例-96,王琳,好，放心大胆的投，我会一直在你身边支持你的。,True
案例-96,王刚,哇，又赚了一些！,False
案例-96,王琳,你看，机会难得，不如这次把积蓄都投进去，我们一起赚大钱！,True
案例-96,王刚,好吧，为了我们未来，我这次就投入8万元。,False
案例-96,王刚,怎么失联了？网站也打不开了，微信也被拉黑了！,False
案例-97,刘昊,你好，我叫刘昊，本来想加客户，结果输错号码误加了你，既然加错了，就当多一个朋友吧。,False
案例-97,张娜,你好，刘昊，没关系，多一个朋友也好。,False
案例-97,刘昊,我们以后可以多聊聊嘛，说不定以后还能合作做生意呢。,False
案例-97,张娜,好的，期待我们以后的交流。,False
案例-97,刘昊,你有没有兴趣了解一下投资？我最近通过一个投资软件赚了不少钱，真心觉得很不错。,True
案例-97,张娜,投资？我有点兴趣，不过不了解得太多。,False
案例-97,刘昊,没关系，我可以教你。这是一个手机软件，可以购买蜜蜡、和田玉、琥珀等物品，再选择涨或者跌，通过价格变动来赚钱。,True
案例-97,张娜,听起来有点复杂，有没有什么简单点的操作方法？,False
案例-97,刘昊,其实很简单，开始你可以先投入小额资金试试看，比如5000元。我第一次投5000元，买了一点琥珀，不到几天就赚了1000多。,True
案例-97,张娜,真的可以吗？那我试试吧。,False
案例-97,刘昊,我还可以介绍一位指导老师给你，他很专业，跟着他的指导你可以赚更多的钱。,True
案例-97,张娜,那好吧，你帮我介绍一下。,False
案例-97,指导老师-张,你好，我是分析总监张，现在的市场很好，如果你现在充值到30万，很快就可以赚到更多的钱。,True
案例-97,张娜,可是一下充值30万有点多了，我有点担心。,False
案例-97,刘昊,我已经充值了不止30万了，你不用担心，有我在，一定会帮你赚钱的。,True
案例-97,张娜,好的，那我就试试看吧。,False
案例-97,指导老师-张,近日市场会有一个‘大行情’，建议你充值到100万元，这样可以抓住这次机会，一举大赚。,True
案例-97,张娜,那我再想想办法，凑齐这100万。,False
案例-97,刘昊,放心吧，我也在加大投资，我们一起肯定能赚钱。,True
案例-97,张娜,好的，我已经充值到了100万，希望我们都能赶上这个‘大行情’。,False
案例-97,张娜,怎么回事？怎么我的账户只剩下4万了？不是说有‘大行情’吗？,False
案例-97,刘昊,我也亏损了200万，这类投资确实有风险，但我相信只要我们继续投资，一定能把亏损的钱赚回来的。,True
案例-97,张娜,可是我已经亏损了将近100万，不知道能不能赚回来。,False
案例-97,指导老师-张,再充值一些吧，我们一定能赚回来的。,True
案例-97,张娜,结果还是全部亏空了，你们是怎么回事？,False
案例-97,张娜,这怎么回事？你们怎么都不回我消息了？,False
案例-98,张强,李哥，最近好吗？要不要一起找个时间出来喝一杯？,False
案例-98,李明,强哥，我最近有点忙。不过，有空了一定聚聚。,False
案例-98,张强,对了，李哥，我表哥在一个网络投资理财平台工作，最近他给我透露了几个内幕消息，说是小投入可以赚大钱，不知道你有没有兴趣一起试试？,True
案例-98,李明,真的吗？这听起来不错诶，具体怎么操作啊？,False
案例-98,张强,很简单的，你只需要在这个平台上注册一个账号，然后充值一点资金进去。我第一次只充了一万块，结果两天就赚了一千多呢！,True
案例-98,李明,哇，真的这么好赚？要不你教教我，我也想试试。,False
案例-98,张强,没问题，我这就给你发个链接，你按操作步骤进行注册，然后转账一定的金额到你的账户里。我保证你很快就能看到收益。,True
案例-98,李明,好的，谢谢强哥，我这就去注册账号。,False
案例-98,张强,不客气，李哥，有什么问题随时问我。,True
案例-98,李明,我已经注册好了，充值了一万块钱进去。希望能有好收益。,False
案例-98,张强,放心吧，绝对没问题的。过几天看你的收益更新吧，如果有任何问题，记得找我。,True
案例-98,李明,好的，谢谢强哥。,False
案例-98,张强,李哥，看看你的账户，是不是已经有收益了？我建议再投入一些，这样收益会更高。,True
案例-98,李明,我看了一下，真的是赚了1000块。那我再充点资金吧，希望能赚更多。,False
案例-98,张强,好的，只要你多投入，收益肯定会更好。我们一起发财嘛。,True
案例-98,李明,我已经陆续充了100多万进去了，不过怎么现在不能提现了？,False
案例-98,张强,可能是平台出现了临时问题，你再等等看。如果还不行，我去问问我表哥。,True
案例-98,李明,好吧，希望能快点解决。,False
案例-98,张强,不用担心，肯定没问题的。,True
案例-98,李明,强哥，你怎么不回消息了？,False
案例-98,李明,强哥，你是不是拉黑我了？,False
案例-99,李宁,你好，我是李宁，刚刚在微信上看到你，我们可以交个朋友吗？,True
案例-99,刘敏,你好啊，我是刘敏，很高兴认识你。,False
案例-99,李宁,我也是，好久没遇到这么投缘的朋友了，你平时都有些什么兴趣爱好呢？,True
案例-99,刘敏,我平时喜欢看看书，养养花草，你呢？,False
案例-99,李宁,我平时爱好旅游和投资，最近在一个平台上赚了一些钱，挺有意思的。,True
案例-99,刘敏,哦？是什么平台啊？,False
案例-99,李宁,是一个投资平台，叫“某某投资”，这里的导师很厉害，能帮忙分析投资趋势，我认识一个导师，收益很不错。,True
案例-99,刘敏,听起来不错，但我对投资不太了解，有没有风险啊？,False
案例-99,李宁,别担心，我最开始也是不懂的，但在导师的指导下赚了不少。你知道吗，我最近用这个平台的收益买了一只限量版包包呢。,True
案例-99,刘敏,哇，听起来很诱人，真的能赚钱吗？,False
案例-99,李宁,当然，我每天都会在微信朋友圈发一些投资的心得和收益截图，你可以看看。要不你也试试？我可以介绍你给那个导师认识。,True
案例-99,刘敏,嗯，我可以先看看你朋友圈里的投资信息吗？,False
案例-99,李宁,当然可以，我马上把朋友圈开放给你看。你可以看看我的收益记录，真的很稳定。,True
案例-99,刘敏,看了你的朋友圈，收益的确很好，我想尝试一下。应该怎么开始呢？,False
案例-99,李宁,太好了！你先下载这个“某某投资”APP，我会把导师的推荐码给你，注册后导师会亲自指导你投资。,True
案例-99,刘敏,好的，我下载了，注册也完成了。然后呢？,False
案例-99,李宁,接下来你可以在平台上充值一点小资金，导师会根据你的情况给你定制投资策略，收益会很快的。,True
案例-99,刘敏,好的，我先充值了5000元。,False
案例-99,李宁,很好，导师已经看到你的充值了，他会开始帮你操作，放心，很快就会见效益的！,True
案例-99,刘敏,希望如此，谢谢你的帮助。,False
案例-100,刘亦菲,你好，小琳。我在交友软件上看到你的资料，感觉我们有很多共同点，想认识一下。,True
案例-100,小琳,你好，刘磊。很高兴认识你。,False
案例-100,刘亦菲,你对数字货币有了解吗？我最近通过数字货币投资赚了不少钱，觉得很有前途。,True
案例-100,小琳,我听说过，但还不是特别了解。你可以给我讲讲吗？,False
案例-100,刘亦菲,当然可以。投资数字货币的关键是选择合适的平台和时机。我手头有一个很好的投资平台，可以邀请你进来尝试。,True
案例-100,小琳,真的吗？那我该怎么操作呢？,False
案例-100,刘亦菲,我发给你两个链接，你下载这两个App，然后按照我给你的步骤进行注册和充值。,True
案例-100,小琳,好的，我现在就下载。,False
案例-100,刘亦菲,注册完了之后，你可以先少量投资，试试看效果如何。万一赚了，我会帮你操作更多的投资。,True
案例-100,小琳,好的，我试试。,False
案例-100,刘亦菲,太棒了！你看，初次投资就赚了好几百万的虚拟货币，可以提现部分利润，你试试看。,True
案例-100,小琳,哇，真的提现成功了。我刚刚提了20万。,False
案例-100,刘亦菲,恭喜啊！你看，这个平台真的很靠谱吧。你可以考虑再投资多一些，这样收益更可观。,True
案例-100,小琳,嗯，我觉得这个平台挺好的，我再追加一些投资。,False
案例-100,刘亦菲,好的，这次操作一定会有更好的收益，相信我。,True
案例-100,小琳,这次提币怎么失败了？我再试一次。,False
案例-100,刘亦菲,别急，有可能是系统维护的缘故。过段时间再试试。,True
案例-100,小琳,这段时间我一直在尝试，但还是失败了。我要考虑报警了。,False
案例-101,张浩,你好，我是张浩，在抖音上看到你的视频，觉得你很有魅力，愿意认识一下你吗？,False
案例-101,李婷,你好，很高兴认识你，我是李婷。你也是喜欢看抖音吗？,False
案例-101,张浩,是的，我经常在抖音上看一些励志成功的视频，感觉特别受鼓舞。对了，你平时都喜欢做些什么呢？,False
案例-101,李婷,我平时喜欢旅游和摄影，偶尔也喜欢在抖音上看看别人的生活分享。你呢？,False
案例-101,张浩,我喜欢研究一些投资理财，也在工作之余做一些小投资，收益还不错。你有没有兴趣了解一下？,True
案例-101,李婷,你的收益不错吗？能不能具体说说是怎么投资的？,False
案例-101,张浩,当然可以，其实我一直在用一款叫‘美团金融’的投资软件，最初是朋友推荐的，注册简单，收益稳定，你要不要试试？,True
案例-101,李婷,听起来挺不错的，这款软件安全吗？我之前有听过一些投资诈骗的新闻，有点担心。,False
案例-101,张浩,放心吧，这款软件是由很多用户推荐的，我已经用了一段时间了，收益都能及时提现，没有问题。要不我给你发个注册链接，你先看看？,True
案例-101,李婷,好的，你发给我吧，我看看怎么样。,False
案例-101,张浩,好的，链接发给你了，你注册之后可以先投一些小金额试试，大概几天就能看到收益。慢慢来，不急。,True
案例-101,李婷,谢谢你，我刚注册了，先投了几百元，看看收益怎么样。,False
案例-101,张浩,不客气，等你的收益出来了你就会放心了。投资是一个需要慢慢积累信任的过程。,True
案例-102,张伟,嗨，你好，我是张伟，最近刚搬到这个城市。很高兴在这个APP上见到你！,False
案例-102,李娟,你好，张伟，我是李娟。你刚搬来这个城市吗？适应得还好吗？,False
案例-102,张伟,还不错呢，这里风景很好，人也很友善。你呢，平时都喜欢做什么呀？,False
案例-102,李娟,我平时喜欢看书、旅行，还有美食。你呢，有什么兴趣爱好？,False
案例-102,张伟,我很喜欢投资理财，平时也会去一些高端餐厅尝美食。最近还在研究一个稳赚不赔的投资项目呢！,True
案例-102,李娟,哇，听起来很厉害。我对投资没什么了解，你可以多说说吗？,False
案例-102,张伟,当然可以啦！这个项目是我一个朋友介绍的，一个小众的平台，只要掌握了技巧就能稳赚不赔。等有时间我再详细给你讲解。,True
案例-102,李娟,好的，那我们找时间详细聊聊吧。,False
案例-102,张伟,李娟，你最近怎么样？我今天刚好有空，我们可以语音聊聊，我具体告诉你怎么操作这个投资项目。,True
案例-102,李娟,好的，今天晚上我有空。我们晚上聊吧。,False
案例-102,张伟,晚上好，李娟。其实这个平台特别简单，只需要注册一个账号，然后按照我给你的步骤操作就可以了。投入不需要太多，几千块就能看到效果。,True
案例-102,李娟,听起来还不错，有没有什么风险呢？我有点担心。,False
案例-102,张伟,放心吧，我已经操作了几个月了，每次都能赚到钱。况且，你可以先少投一点，试试水，反正稳赚不赔。,True
案例-102,李娟,好的，我试试看吧。谢谢你，张伟。,False
案例-102,张伟,不客气呀，祝你好运！有任何问题随时问我。,True
案例-102,李娟,张伟，我按你说的投了几千块钱，今天早上发现账户里多了几百块，真的有赚呢！,False
案例-102,张伟,看吧，我就说是稳赚不赔的。如果你再多投些，收益会更明显哦。,True
案例-102,李娟,真的吗？那我再投一些试试。,False
案例-102,张伟,没问题，有什么进展随时告诉我。,True
案例-102,李娟,张伟，我投了更多的钱，现在账户里多了几千块了。不知道还能不能继续投。,False
案例-102,张伟,当然可以，你可以多多投入，收益会更大。其实这种机会很少有，抓紧时间赚一笔。,True
案例-102,李娟,好的，我再加大投入一些。,False
案例-102,张伟,太棒了，李娟！你一定会成功的。,True
案例-102,李娟,张伟，我现在账户里有很多钱，但是提现的时候提示账户异常，无法提现。怎么办？,False
案例-102,张伟,别担心，可能是平台在维护。你再试试几次，如果不行的话，我帮你联系平台客服。,True
案例-103,李伟,你好，我是李伟，看到你的微信朋友圈感觉我们有很多共同兴趣，能加个好友吗？,False
案例-103,朱丽,你好，李伟，欢迎加好友。我的朋友圈是关于生活和工作的，你平时都做什么呢？,False
案例-103,李伟,我做互联网公司的，平时也喜欢看一些理财和投资的书籍。,False
案例-103,李伟,其实我叔叔是国内某大型互联网公司的高管，我有一些内部消息，能带着你赚点零花钱。,True
案例-103,朱丽,哦？听起来很不错啊，那具体是怎么操作的呢？,False
案例-103,李伟,我会发给你一个APP的二维码，这个APP还在推广阶段，利息特别高，等上市后就没有这个福利了。,True
案例-103,朱丽,真的吗？这听起来不错，不过我还是有点犹豫。,False
案例-103,李伟,你可以先投100元试试看，感觉一下效果。,True
案例-103,朱丽,好吧，我试试看吧。,False
案例-103,李伟,你看，这100元一天就赚了5元多，是不是感觉很不错？,True
案例-103,朱丽,确实还不错，看来是个靠谱的平台。,False
案例-103,李伟,那你可以考虑加大投资金额，会有更多收益哦。,True
案例-103,朱丽,那我试试投1000元看看效果。,False
案例-103,李伟,你看，这次又赚了60多元，是不是很划算？,True
案例-103,朱丽,真的，这次我打算再加大投资，试试5万元。,False
案例-103,李伟,好，不过提现可能需要排队，或者再追加投资15万元就可以直接提现了。,True
案例-103,朱丽,我真的很想提现，看来只能再投15万元了。,False
案例-103,李伟,现在还不能提现，你需要再充值5万元缴纳插队费。,True
案例-103,朱丽,这感觉有点不对劲，我去报警咨询看看。,False
案例-104,星空,你好，我是“星空”。白天吃你家的东西挺好吃的，想了解一下订餐。,False
案例-104,小顾,谢谢你的夸奖！为了以后订餐方便，我们加个好友吧？,False
案例-104,星空,当然可以，这样也更方便啦。,False
案例-104,星空,我在朋友圈发了很多关于投资的信息，你有兴趣了解吗？,True
案例-104,小顾,你说的投资是做什么的？怎么看你的客户每天都在赚钱呢？,False
案例-104,星空,这是炒外汇的，我有个内部平台，那里有漏洞，每人只能玩一次。所以可以赚大钱。,True
案例-104,小顾,真的吗？那我要怎么操作？,False
案例-104,星空,你先下载这个软件，然后注册一个帐户，之后我一步步教你。,True
案例-104,小顾,好的，我已经下载好了。,False
案例-104,星空,现在你可以先往帐户里打点钱，初期投资个8万吧，有问题我随时帮你解答。,True
案例-104,小顾,已经打进去了。,False
案例-104,星空,很好，明天看一下收益，祝你好运！,True
案例-104,小顾,哇，真的赚了！帐户里已经有9万了。,False
案例-104,星空,那当然，明天再投资吧，多投一些，赚得更多。,True
案例-104,小顾,好，我再投8万，这样一共16万了。,False
案例-104,小顾,天啊，帐户里变成72万了！,False
案例-104,星空,恭喜恭喜！再投一点，这个平台最多可以赚到82万呢。,True
案例-104,小顾,好，我投！,False
案例-104,小顾,都到82万了，我想提现，这钱怎么提不出来呢？总说银行卡信息不对。,False
案例-104,星空,你需要修改银行卡信息，这需要支付16万的操作费。,True
案例-104,小顾,已经投了46万了，还要再投？,False
案例-104,星空,放心吧，只要你支付了这笔费用，就可以顺利提现了。,True
案例-104,小顾,好的，我再试试。,False
案例-104,小顾,钱还是提不出来，星空，你在吗？,False
案例-104,系统提示,对方已将你拉黑,True
案例-104,小顾,完了，我被骗了！,False
案例-105,李明,嗨，你好！我在这婚恋交友网站上看到你的资料，对你很有兴趣。能聊聊吗？,False
案例-105,王玲,你好呀，很高兴认识你。你平时爱好什么呢？,False
案例-105,李明,我平时喜欢运动和阅读，尤其喜欢投资理财。最近有在研究一些不错的投资项目。,True
案例-105,王玲,投资听起来很有意思。我对理财不太懂，可以教我一些吗？,False
案例-105,李明,当然可以呀，我可以慢慢教你。不如加个微信，发一些具体的资料给你。,True
案例-105,王玲,好的，这是我的微信号XX，我们加微信聊吧。,False
