case,speaker,content,is_fraud
案例-27,张丽,好的，我明白了。我马上操作购买，请稍等。,False
案例-27,刘强,收到您的订单后，请截图发给我，稍后我们的财务会给您处理返款。,True
案例-27,张丽,这是订单截图，我已经完成购买，什么时候能收到返款呢？,False
案例-27,刘强,好的，我们已经收到您的订单，并已安排财务处理。为了表示我们对您信任的感谢，我们决定让您提升任务级别，做一个高额订单的任务，完成后返利和佣金会更多。,True
案例-27,张丽,高额订单？需要多少钱？具体怎么操作呢？,False
案例-27,刘强,这次的任务金额为2000元，您只需重复刚才的操作，在平台上下单购买指定商品即可。完成后我们会在两个小时内将本金和高额佣金一同返还给您。,True
案例-27,张丽,我有点担心，不会有什么问题吧？,False
案例-27,刘强,请您放心，我们是XX电商平台的正规客服，有任何问题我们都会负责到底，这是我们的退款协议，您可以再放心看看。,True
案例-27,张丽,那好吧，我试试看。,False
案例-28,王磊,大家好，我是王磊。我们这个微信群是为了帮助大家赚取一些额外收入的，只需要你们按照简单的步骤操作就可以了。,False
案例-28,彭强,王磊老师您好，请问具体是什么操作？,False
案例-28,王磊,很简单，我们是通过一个平台做刷单任务，平台为了拉新用户，会发放一些新人优惠券，我们只需要注册新用户并使用这些优惠券购买商品，就可以完成任务，之后你们会得到相应的报酬。,True
案例-28,彭强,那注册新用户需要用什么信息？会不会很复杂？,False
案例-28,王磊,不复杂，我们用一个叫‘信码通’的APP去购买虚拟电话号码，有了这些号码，你们就可以注册成新的用户，不需要用真实的信息。,True
案例-28,彭强,好的，明白了。我试试能不能操作。,False
案例-28,王磊,操作很简单，我会在群里发布具体的注册步骤，你可以按照那些步骤来就行。另外，完成任务之后，你们的商品直接交给我，我会帮你们处理掉。,True
案例-28,彭强,那每完成一单任务，我们大概能赚多少钱？,False
案例-28,王磊,每完成一单任务，可以赚到几块到几十块不等，具体看任务量。你只要多做任务，多赚点零花钱是没问题的。,True
案例-28,彭强,好的，我试试看。,False
案例-28,周明,请问有人尝试了吗？真的能赚到钱吗？,False
案例-28,彭强,周明，我试了一下，确实能领到优惠券，也下单购买了商品。等我拿到报酬再告诉你。,False
案例-28,王磊,是的，只要按照步骤操作，大家都会赚钱的。我们这个群是很正规的平台任务，大家放心参与。,True
案例-29,刘建国,高先生，您好！我是'兼职群'的管理员刘建国，看您有兴趣做一些副业来增加收入，对吗？,False
案例-29,高易,是的，我想在业余时间找一些兼职做，增加一些收入。,False
案例-29,刘建国,好的，我们这里有一些简单的任务，比如网购、点赞等，您完成任务后即可获得相应佣金，非常适合业余时间操作。这是我们企业微信的链接，您可以点击查看详细信息。,True
案例-29,高易,听起来不错，我看一下。,False
案例-29,刘建国,您看，这些任务都是非常简单的，完成后可以立即看到返现。您可以先试试不需要额外充值的任务，看看效果。,False
案例-29,高易,好，我试试。,False
案例-29,高易,我完成了几个任务，确实有些返现。,False
案例-29,刘建国,太好了！如果您想赚更多的钱，可以尝试一些高额返利的任务，比如充值2000元可以获得4000元的任务，还有充值10000元可以获得20000元的任务，返利都非常丰厚。,True
案例-29,高易,听起来不错，我试试看。,False
案例-29,高易,我充了2000元，怎么没有返现到我的账户？,False
案例-29,刘建国,哦，这可能是系统延迟，再稍等一下，返现马上就会到达您的账户。,True
案例-29,高易,好的。,False
案例-29,高易,已经过了很长时间，还没有收到返现，这到底怎么回事？,False
案例-29,刘建国,可能是您账户出现了问题，您再充值10000元，系统会自动把之前的返现一起发给您。,True
案例-29,高易,我再试试看。,False
案例-29,高易,我已经充值了18万元，至今没有看到返利，到底怎么回事？,False
案例-29,刘建国,抱歉，您的账户可能发生了系统错误，我们正在紧急处理，请耐心等待。,True
案例-29,高易,这到底什么情况？你们的客服怎么联系不上了？,False
案例-29,刘建国,请稍等，再耐心等待一下，我们会尽快解决您的问题。,True
案例-30,张丽,你好，我是某某公司的工作人员，我们正在招募网络兼职刷单人员，这是一份非常轻松的工作，只需要你在网上进行简单操作，每天就能赚取可观的收入。,True
案例-30,李华,真的吗？那具体需要做些什么呢？,False
案例-30,张丽,只需要在指定的平台上完成一些点赞、关注和分享的任务，每次任务完成后，将截图发给我，你就可以得到报酬了。,True
案例-30,李华,听起来不错，那我怎么开始呢？,False
案例-30,张丽,首先，你需要注册一个账号，并通过我们的二维码下载一个软件，这样我们才能更方便的派发任务给你。,True
案例-30,李华,好的，我这就去注册。,False
案例-30,张丽,完美，你现在已经完成了第一步。接下来，你需要先支付一部分押金，以便我们确认你有执行任务的诚意。押金完成后，会返还给你。,True
案例-30,李华,押金？可是为什么需要支付押金呢？,False
案例-30,张丽,这是公司规定，押金只是确保你遵守合约，完成任务后我们会全额返还的。这是为了避免有些人只注册不做事还要求报酬。,True
案例-30,李华,好吧，那支付押金后，我什么时候可以收回呢？,False
案例-30,张丽,只要你完成前三天的任务，我们就会在第四天的时候，全额返还押金并支付你的劳动报酬。所以，这完全是无风险的哦！,True
案例-31,王强,亲，您好，我们这里正在招聘兼职人员，操作简单，报酬丰厚，每天只需花两三个小时就能挣到100-300元哦，您有兴趣了解一下吗？,True
案例-31,李丽,这听起来不错，我确实有兴趣了解一下。,False
案例-31,王强,好的，非常感谢您的信任。我们的操作非常简单，就是在网上帮商家拍下指定商品。拍完付完款后，我们会立刻把货款和报酬一起返还给您。我们已经帮很多人赚到了钱哦。,True
案例-31,李丽,真的可以吗？但是我需要先垫付货款，能确保拿回我的钱吗？,False
案例-31,王强,当然可以，您看看这几位兼职人员的收入截图，这都是他们用兼职赚到的钱。您完全不用担心，而且我们还有专人培训您，保证您快速上手。,True
案例-31,李丽,好的，那我尝试一下吧。,False
案例-31,王强,太好了，您拍下这件商品并付款，我们会在您完成任务后立即返还货款和报酬。,True
案例-31,李丽,我已经拍下并付款，什么时候能返还给我？,False
案例-31,王强,非常快的，您稍等一下，我先帮您操作退款，并检查下款项非常快是否到账。,True
案例-31,王强,真抱歉，由于系统问题，您的订单显示还未完成，请您再完成一次相同的操作，我们就可以将之前的款项一并退给您。,True
案例-31,李丽,为什么还没有完成？我已经付款了，怎么会未完成呢？,False
案例-31,王强,可能是网络延迟或者操作不当导致的，不用担心，只要再拍一次一定能成功的。,True
案例-32,张客服,您好！我们是某刷单平台的新晋代理，看到您在抖音上活跃，因此邀请您参与我们的刷单赚钱项目。我们的APP下载体验费用仅需38元，一旦入会，每单任务酬劳可达9元到60元哦！,True
案例-32,廖某,好的，我下载并支付了38元入会费，现在我要开始刷单任务了。,False
案例-32,张客服,非常感谢您的支持！我们已经给您分配了刷单任务，每完成一单就可以获得相应的报酬，请按照指引进行操作。,False
案例-32,廖某,我已经按照任务要求完成了几单，果然每次都有收益，很高兴！,False
案例-32,张客服,看起来您操作得相当熟练！现在我们有更高收益的任务，只需垫付988元，完成后收益将更高哦！,True
案例-32,廖某,听起来不错，我已经垫付了988元，并完成了任务。,False
案例-32,张客服,非常抱歉，系统提示您做错了任务，导致提现失败。需要做补偿单，并支付五倍佣金，共6800元才可以提现。,True
案例-32,廖某,我已经支付了6800元，希望这次能够顺利提现。,False
案例-32,张客服,很抱歉，又出现了操作失误，这次需要您再缴纳26512元进行补单。,True
案例-32,廖某,希望这次能成功提现，我已经支付26512元完成补单。,False
案例-32,张客服,系统显示需要再支付30888元或者60888元才能成功提现。由于您进行了两单，我们降低要求，只需支付30888元。,True
案例-32,廖某,我已经支付了30888元，希望这次能成功。,False
案例-32,张客服,恭喜您，系统检测到爆单，您有机会赚取35888元的返利，但需要您选择是否参与这种奖励机会。,True
案例-32,廖某,我不再参与奖励任务，只想提现。,False
案例-32,张客服,我们公司主管总监会同您联系解决您的提现问题，请稍等。,True
案例-32,廖某,你好，我需要解决提现问题。,False
案例-32,李总监,抱歉，目前无法解决您的问题，祝您好运。,True
案例-33,张强,大家好，我们这里有个新的兼职任务，只需要关注抖音，就可以领取小额红包。,True
案例-33,刘华,这是真的吗？我可以试试吗？,False
案例-33,张强,当然可以，你只需关注这个抖音账号，并截图给我，我立刻发红包。,True
案例-33,刘华,我已经关注并截图发给你了。,False
案例-33,张强,好的，这里是你的红包，恭喜完成任务！如果你感兴趣，还有更有趣的任务，可以赚更多的钱哦。,True
案例-33,刘华,听起来不错，我想做更多任务。,False
案例-33,张强,那你先加入我们的小群，我们会有更多的任务发布给大家。,True
案例-33,张强,这里有个更赚钱的任务，你需要下载一个叫“富禧”的APP，完成里面的任务可以赚大钱。,True
案例-33,刘华,好的，我马上下载。,False
案例-33,刘华,我已经下载好了，接下来怎么做？,False
案例-33,张强,在APP里有很多任务，你可以先尝试一下买大小单双押注，赚点小钱。,True
案例-33,刘华,我完成了押注，现在要怎么办？,False
案例-33,张强,你继续在APP里面做任务，逐步投入，收益会更高哦！,True
案例-33,刘华,我已经投入了不少钱，为什么收益还是没有到账？,False
案例-33,张强,可能是你操作有误，建议你补单，看看能否解决问题。,True
案例-34,张某,您好，我是国付宝的客服经理，我们的兼职任务非常轻松，只需要动动手指就可以月入过万，您有兴趣了解一下吗？,True
案例-34,李女士,真的可以吗？要怎么做呢？,False
案例-34,张某,您先加入我们的‘财富共赢VIP二’微信群，下载一下我们国付宝的APP，这样您就可以开始做任务了。,True
案例-34,李女士,好的，我进群了，下载了APP接下来要做什么呢？,False
案例-34,张某,您可以看看群里其他伙伴的收益，还有后台交易记录，大家天天都在赚钱。完成任务后，您可以每天领取签到奖、活跃奖等多种奖励。,True
案例-34,李女士,真的好像大家都在赚钱，那我也试试吧。,False
案例-34,张某,太好了，您可以先做几个小任务，赚点小钱，习惯流程后可以尝试更大的任务哦～,True
案例-34,李女士,我做了一些小任务了，真的收到了一点佣金呢。,False
案例-34,张某,非常棒！现在您可以开始更高级的任务，充值一定金额到指定账户，收益会更多哦。,True
案例-34,李女士,好的，我充了5万元，做了几个任务，但为什么不能提现呢？,False
案例-34,张某,对不起，您还需要完成一个‘三联单’任务才能提现，这个任务会分多次进行，完成后就可以顺利提现了。,True
案例-34,李女士,我按照你们说的做了，但还是不能提现，真的没有办法了吗？,False
案例-34,张某,您信用分不足，需要继续充值完成更多任务来提升信用分，这样才能顺利提现。,True
案例-34,李女士,我真的没有钱了，这样一直充也不见得能提现。,False
案例-34,张某,您可以去找亲戚朋友借一点钱，这是最后一个任务了，完成了一定可以提现。,True
案例-34,李女士,我彻底没有钱了，我不做了，也不相信再投钱能提现。,False
案例-34,李女士,我被骗了19万余元，我要报警。,False
案例-34,警察,您好，我们是景泰县公安局网安大队。请放心，我们会尽全力帮您追回损失，您的报案非常重要。,False
案例-35,张伟,你好，我看到你们的兼职广告，我想了解一下具体情况。,False
案例-35,李明,你好，非常欢迎你来咨询。我们是专门为电商平台提升信誉度的团队，通过刷单可以快速赚取佣金。,True
案例-35,张伟,这听起来不错，具体怎么操作呢？,False
案例-35,李明,首先，你需要下载一个叫做'GA'的应用软件，这是我们专用的平台，然后我会指导你如何刷单，佣金非常高，平均一单可以赚几十块钱。,True
案例-35,张伟,好的，我已经下载了，接下来怎么做？,False
案例-35,李明,现在，你需要先完成几个小任务，每完成一个任务就会得到佣金，你可以试试看。,True
案例-35,张伟,好，我试了一下，佣金确实到账了，看起来很不错。,False
案例-35,李明,很好，现在我给你一个更高回报的任务，你需要先充值1000元完成任务，完成后可以得到10%的佣金，也就是100元。,True
案例-35,张伟,我已经充值并完成任务了，为什么我的佣金还没到账？,False
案例-35,李明,系统显示你的任务未完全完成，需要再充值2000元继续任务，完毕后可以一起提现。,True
案例-35,张伟,我又完成了新的任务，什么时候可以提现？,False
案例-35,李明,你还需要再完成一个5000元的任务，系统才会解冻所有资金，一起提现。,True
案例-35,张伟,我完成所有任务了，现在可以提现了吗？,False
案例-35,李明,抱歉，系统显示网络故障，需要你再充值3000元进行验证，这样才能提现。,True
案例-35,张伟,这不对劲，我没法再相信你们了。,False
案例-36,刘伟,您好！我是‘58同城’客服，您的简历我们收到了，请问您是否需要兼职？,True
案例-36,卞女士,哦，您好！我确实在找兼职，请问是什么类型的兼职呢？,False
案例-36,刘伟,我们目前有一个非常热门的刷单兼职项目，您只需要在指定平台上进行一些购买操作，就能获得丰厚的佣金。,True
案例-36,卞女士,听起来不错，具体怎么操作呢？,False
案例-36,刘伟,您只需添加我们的微信客服，然后按照指示进行操作即可。我们会为您提供详细的指导和支持，确保您能够顺利完成任务并获得佣金。,True
案例-36,卞女士,好，我添加了。下一步该怎么做？,False
案例-36,刘伟,您好，我是您的微信客服小李。您这边只需要按照我们提供的链接进行一些小额购买，每完成一次购买，我们会返还给您本金并支付佣金，开始吧，这是我们的刷单链接。,True
案例-36,卞女士,明白了，我已经按照你们的指示进行了第一笔刷单，请确认。,False
案例-36,刘伟,非常好，您做得很棒。请继续完成接下来的几笔刷单，佣金会在最后一次交易后统一返还。,True
案例-36,卞女士,怎么还没收到返还的本金和佣金？,False
案例-36,刘伟,由于您刚开始操作，系统需要一定时间进行审核，再完成几笔刷单任务吧，系统审核通过后我们会统一返还。,True
案例-36,卞女士,我已经完成多笔刷单了，还是没有收到返款，你们到底是怎么回事？,False
案例-36,刘伟,请再耐心等等，系统确实需要时间审核，如果您不放心，可以联系我们的客服热线进一步咨询。,True
案例-36,卞女士,感觉不太对，我会报警的！,False
案例-37,张先生,你好，我看到你的联系方式是通过微信群发的兼职信息获取的，我们这边有一个高返利的刷单兼职，时间自由操作简单，你有兴趣了解一下吗？,True
案例-37,李女士,您好，我对兼职有兴趣，请问具体是做什么的，需要什么条件吗？,False
案例-37,张先生,我们是通过点赞、关注等操作来提升短视频的热度，然后根据任务的完成情况发放佣金。新人刚开始很简单的，前几单可以轻松赚到几十元。,True
案例-37,李女士,听起来不错，我要怎么开始呢？,False
案例-37,张先生,你先加我们客服的微信号，他会给你进一步的指引，你添加后跟他说是我介绍的就行。,True
案例-37,李女士,好的，我已经添加了客服了，他让我加入一个任务群。,False
案例-37,客服,欢迎加入，我们的刷单任务很简单，你需要按要求给短视频点赞和关注，然后截图提交，每完成一次任务会有几元到十几元的佣金。请提供你的支付二维码，用于返还佣金。,True
案例-37,李女士,我已经完成了几单任务，佣金和本金都收到了。,False
案例-37,客服,恭喜你完成新手任务，现在我们有更高返利的任务，但需要支付一定的保证金或者垫付金，完成任务后将返还更多的佣金。,True
案例-37,李女士,那我现在要怎么操作呢？,False
案例-37,客服,你需要下载一个叫“博华资本”的App，注册并进行一些任务操作，支付36元保证金。之后我们会根据操作情况进行返利。,True
案例-37,李女士,我已经完成了几单任务了，请退款。,False
案例-37,客服,根据我们平台的规定，目前你的任务金额没有达到提现的标准，需要继续完成更多任务才能提现。,True
案例-37,李女士,这不是赌博吗？,False
案例-37,客服,这只是做任务的方式，不算赌博。你只需要继续完成任务，就可以提现高额佣金了。,True
案例-37,李女士,好的，我再试一次。,False
案例-37,李女士,为什么我还是不能提现？,False
案例-37,客服,你还需要完成更多的任务，并达到相应的金额要求才能提现。请继续按照规定操作。,True
案例-37,李女士,我被骗了113500元，已经无法联系到“客服”了。,False
案例-38,张明,你好，我是某兼职平台的客服张明，看到你有意向做兼职吗？我们这边有一个简单的刷单任务，只需要下载我们的APP，按提示操作就可以赚取佣金。,True
案例-38,刘芳,你好，我对兼职有兴趣，能详细说说吗？,False
案例-38,张明,当然可以。你只需要下载这两款APP，然后注册账号，就可以看到刷单任务。每完成一个任务都会有佣金返回哦。刚开始刷单金额不大，每单盈利也不错。,True
案例-38,刘芳,好的，那我试试看。,False
案例-38,刘芳,我已经下载了APP，并且注册了账号，接下来应该怎么做呢？,False
案例-38,张明,很好，接下来请你充值101元到指定的银行卡号，投标一次任务。,True
案例-38,刘芳,好的，我已经充值了101元。,False
案例-38,张明,非常好，你完成任务后系统会自动给你返还佣金，现在你可以看到账户里有121元了。,True
案例-38,刘芳,确实收到了121元，那我再尝试一次吧。,False
案例-38,张明,好的，按照同样的操作，再充一次试试看，你会发现赚的钱更多了。,True
案例-38,刘芳,这次我充了200元，系统显示返了260元。,False
案例-38,张明,很棒的操作！你已经掌握了技巧。现在你可以尝试更大的金额，收入会更多。,True
案例-38,刘芳,好的，那我再试试充500元。,False
案例-38,张明,太好了，你现在已经是高级刷单员了，可以频繁进行刷单操作，收益非常可观。请继续充值，我们会实时结算佣金的。,True
案例-38,刘芳,三天时间我一共充了12万元，但是却没有返回来，怎么回事？,False
案例-38,张明,哦，可能是系统故障，请稍等，我们会处理的。,True
案例-38,刘芳,不行，这都三天了，还是没有变化，我要报警了！,False
案例-39,订单员小张,您好，我是兼职平台的订单员小张，有兴趣通过手机刷单赚取丰厚佣金吗？,True
案例-39,林女士,您好，刷单真的能赚钱吗？需要怎么做？,False
案例-39,订单员小张,当然可以，只需要加我微信，我会拉你进群，指导你完成简单的刷单任务。,True
案例-39,林女士,好的，我加您微信了。,False
案例-39,订单员小张,感谢信任，我已经将您拉进群了，大家可以在群里互相学习和交流刷单经验。,True
案例-39,林女士,群里的大家真是很厉害，看上去收益很好。,False
案例-39,订单员小张,是的，刷单操作非常简单。您可以先试试小单，比如501元的，回报很快到账。,True
案例-39,林女士,好的，我试试这个501元的单子。,False
案例-39,订单员小张,已经记录您的刷单信息，请稍候。本金和佣金很快就会到账。,True
案例-39,林女士,我收到钱了，真的有收益啊！,False
案例-39,订单员小张,是的，这只是开始。您可以做大一点的单子，收益会更高。推荐您试试3001元的单子。,True
案例-39,林女士,好，我来刷这次的3001元单子。,False
案例-39,订单员小张,已经收到刷单申请，请稍等片刻，收益马上到账。,True
案例-39,林女士,真的是到账了，这次收益更高。接下来有更高金额的单子吗？,False
案例-39,订单员小张,您进步很快呢！现在有一个30001元的大单，完成后佣金可以达到6000元，您要试试吗？,True
案例-39,林女士,我试试这个大的，真的能赚到那么多吗？,False
案例-39,订单员小张,当然，把钱转过来就能开始操作。这单任务很快就能完成。,True
案例-39,林女士,我已经转了30001元，这是怎么操作呢？,False
案例-39,订单员小张,出了点问题，您的转账分成了两个部分，系统识别错误，需要再补一个30001元的单子，这样才能完成全部操作，顺利提现。,True
案例-39,林女士,我已经没有钱了，怎么办？,False
案例-39,订单员小张,您可以找朋友借一下，或者想其他办法筹集资金。只要补上这次，就可以马上提现了。,True
案例-39,林女士,我先找朋友看看。,False
案例-39,小李,林女士，你这看起来是个骗局，我先帮你报案吧。,False
案例-40,王强,各位朋友，想要轻松赚取高额佣金吗？我们公司现在招聘兼职，只需要在手机上完成简单的任务即可，每天都能轻松赚几百元哦。有兴趣的朋友可以扫描二维码下载我们的APP。,True
案例-40,小军,这个兼职看起来很不错，佣金很高，下载试试。,False
案例-40,王强,你好，欢迎加入我们公司的兼职团队。你可以先进行简单的任务，完成后即可获得佣金。如果有任何问题，随时联系客服。,True
案例-40,小军,任务已经完成了，请问我什么时候能收到佣金？,False
案例-40,王强,我们已经核实了你的任务，非常不错！现在你可以继续进行下一笔任务，完成后会有更高的佣金。我先给你发一部分奖励，剩下的等你完成更多任务时一并发放。,True
案例-40,小军,好的，那我继续做任务。,False
案例-40,王强,这次的任务需要你先向指定账户转账78960元，等完成任务后，我会把你的本金和高额佣金一起返还给你。,True
案例-40,小军,我已经转账了，现在可以给我返还本金和佣金了吗？,False
案例-40,王强,非常抱歉，系统检测到你的操作有误，你需要重新做一次任务并再充值一次，我们才能返还本金和佣金。,True
案例-40,小军,我明白了，这下我真是被骗了，得赶快报警。,False
案例-41,张强,您好，我们是某平台的招聘人员，目前正在招募寄拍模特，只需穿上免费寄送的衣服拍几张照片，就可以轻松赚取50至80元。,False
案例-41,吴女士,真的吗？听起来不错，我可以参与吗？,False
案例-41,张强,当然可以。首先，我们需要您下载寄拍之家App，并在App里添加一个指导老师，他会带您一步步地进行任务。,False
案例-41,吴女士,好的，我下载好了App，接下来该怎么办？,False
案例-41,张强,接下来，您需要在老师的指导下完成一些初步任务，这样您不仅有机会优先获得寄拍资格，还能从平台上提现返利。为了验证您的诚信和能力，初期需要您先垫付一些小额资金。,True
