case,speaker,content,is_fraud
案例-37,张伟,刘女士，为确保您的信息安全，我们建议您下载我们航空公司的官方APP，通过APP来完成支付和改签手续。请您稍候，我把链接发送给您。,True
案例-37,刘莉,好的，我会下载APP。,False
案例-37,张伟,谢谢刘女士的理解和配合。我们会在您完成改签手续后给您发一条确认短信，请注意查收。,True
案例-38,魏军,您好，请问是李明先生吗？,False
案例-38,李明,是的，请问您是哪位？,False
案例-38,魏军,我是北京市法院的执行官魏军，刚刚接到上级通知，您因涉嫌信货诈骗，已经缺席出庭，我们已经通过“天网”定位到了您的具体位置，并且通知了当地执法部门和司法人员，他们会携带枪支上门执行强制枪毙。详情可以在抖音搜索《执行风暴》或者关注“中国法院网”了解。请在14点前通过app结清全部欠款，否则执行不可撤销。,True
案例-38,李明,什么？这是真的吗？为啥我之前没收到任何通知？,False
案例-38,魏军,这非常紧急，我建议您尽快处理。如果您14点前结清欠款，我们可以撤销执行命令。,True
案例-38,李明,可是我真的没做过什么信货诈骗啊！我需要怎么样结清欠款？,False
案例-38,魏军,您可以下载指定的app，通过app来结清所欠款项。具体操作步骤会在您下载app后有详细说明。请尽快，时间不多了。,True
案例-38,李明,我该下载哪个app？,False
案例-38,魏军,请点击我们通过短信发给您的链接，按照指示下载并安装app。,True
案例-38,李明,好的，我正在打开短信……,False
案例-38,魏军,请尽快完成操作，否则会有严重后果。,True
案例-38,李明,我点进去下载了一个app，现在安全吗？,False
案例-38,魏军,是的，接下来请按照app中的指示操作，输入您的银行卡号、密码和短信验证码，完成欠款结清。,True
案例-38,李明,好的，我再试试……,False
案例-38,魏军,记得动作要快，我们的执法人员已经在路上了。,True
案例-39,诈骗者张某,李先生你好，我是赵某，这是我的新号，之前的号码已停用，请惠存！,True
案例-39,受害者李先生,哦，赵先生啊，好的，我记下了。,False
案例-39,诈骗者张某,最近工作忙吗？家人们都好吗？有时间一起吃个饭吧。,True
案例-39,受害者李先生,还行吧，家人都挺好的。吃饭时间定了告诉我吧。,False
案例-39,诈骗者张某,对了，李先生，我有个小忙需要你帮一下，可以吗？,True
案例-39,受害者李先生,当然可以啦，您说吧。,False
案例-39,诈骗者张某,是这样的，我有个老领导的亲戚需要一笔紧急款项，但我的银行账户暂时有些问题，有些不方便，你能帮我先转一下吗？,True
案例-39,受害者李先生,没问题，你把银行账户信息发给我吧。,False
案例-39,诈骗者张某,谢谢你，李先生，这是账户信息：XX银行，账号：123456789，户名：王某。,True
案例-39,受害者李先生,好的，我这就转账。,False
案例-39,诈骗者张某,李先生，不好意思，我刚刚查了一下好像是银行信息填写错误，还没有收到款项，您能再确认一下吗？,True
案例-39,受害者李先生,好的，我再重新转一次。,False
案例-39,受害者李先生,（转账未遂后）赵先生，我重新转了还是没到，您那里真没问题吗？,False
案例-39,诈骗者张某,是我的问题，不好意思，我再确认一下。,True
案例-39,受害者李先生,我感觉有点不对劲，我还是先给赵先生打个电话确认下吧。,False
案例-40,张明,您好，您中奖了！我们正在进行一个促销活动，恭喜您成为我们的幸运用户，您将获得一份精美礼品。,True
案例-40,王强,真的吗？太好了！我从没中过奖。请问我需要做什么来领取奖品？,False
案例-40,张明,是的，非常简单。您只需要点击我们刚才发给您的短信链接，填写相关信息就可以了。没什么复杂操作，需要您提供一些基本的个人信息用于验证身份。,True
案例-40,王强,好的，我马上点击链接填写信息。,False
案例-40,王强,我的信息已经填写完毕，接下来我应该怎么做？,False
案例-40,张明,好的，我们需要您支付一小笔运费或者手续费，这样我们才能将礼品寄给您。请您提供银行卡号或者支付宝账号，方便我们进行收取后即可发货。,True
案例-40,王强,那运费大概要多少呢？,False
案例-40,张明,运费很便宜，只需要您支付30元。请将款项转至我们指定的银行账户。账户信息已经通过短信发给您了。,True
案例-40,王强,好的，我现在转账。,False
案例-41,李明,您好，这里是国家社保中心，提醒您您的社保账户存在异常，需要您尽快点击以下链接进行确认和重新认证，以确保您的权益不受影响。,True
案例-41,张伟,哦，真的吗？那请问链接在哪里？,False
案例-41,李明,当然，为了您的方便，我们已经将链接发到您的手机上，请您点击链接填写相关信息，保证您的账户安全。,True
案例-41,张伟,好的，我这就点击链接。,False
案例-41,李明,感谢您的配合，填写完信息后，我们会尽快为您进行处理。,True
案例-41,张伟,我已经填写完了，请问接下来我需要做什么吗？,False
案例-41,李明,非常感谢您的配合，我们已经收到了您的信息，会在24小时内进行处理。如果有任何问题，我们会第一时间与您联系。请保持手机畅通。,True
案例-42,王悦,您好，这里是某某快递公司。您的包裹在运输过程中出现了破损情况，需要您确认并处理赔偿事宜。,True
案例-42,张华,哦，真的吗？我最近确实在网上买了东西。请问需要我怎么处理呢？,False
案例-42,王悦,是的，请您点击我们发给您的链接，填写相关信息，我们会为您安排赔偿。,True
案例-42,张华,好的，我点进去看看。,False
案例-42,张华,链接里需要填写姓名、身份证号和银行卡号，这些信息都是必填的吗？,False
案例-42,王悦,是的，这些信息是为了确认您的身份，请放心，我们会保护您的隐私。,True
案例-42,张华,那好吧，我已经填写好了。,False
案例-42,王悦,感谢您的配合，我们会尽快处理您的赔偿，请注意查收通知。,True
案例-43,谢先生,女儿，最近怎么样？学习还顺利吗？,False
案例-43,骗子,爸爸，我最近学校要举办一个教授培训班，我很想参加，但是费用太高，需要报名费21000元一门课。,True
案例-43,谢先生,真的吗？这么贵的培训班，你确定要参加吗？,False
案例-43,骗子,是的，爸爸，刘主任说这是难得的机会，错过了就没有了，你可以先跟刘主任联系一下，他的QQ号是XXXXXXXX。,True
案例-43,谢先生,好的，我加一下刘主任的QQ，稍后联系他。,False
案例-43,刘主任,您好，我是刘主任，请问有什么事吗？,True
案例-43,谢先生,您好，我女儿说学校要举办一个教授培训班，我想了解一下相关情况。,False
案例-43,刘主任,对的，这是一次难得的机会，我们邀请了知名大学的教授来讲课，每门课需缴纳21000元培训费。,True
案例-43,刘主任,如果您女儿报名三门课，总共需要63000元，您可以先交钱，我们十天内会退还40400元。,True
案例-43,谢先生,明白了，我这就通过网上银行转账。,False
案例-43,谢先生,钱已经转过去了，请尽快确认。,False
案例-43,刘主任,好的，收到款项后我们会通知您的女儿。,True
案例-43,谢先生,女儿，我刚刚已经把报名费转给刘主任了，你有没有收到消息？,False
案例-43,女儿,什么报名费？我根本没有听说过什么教授培训班。,False
案例-43,谢先生,什么？你说刘主任联系的培训班不是真的？,False
案例-43,女儿,对啊，爸爸，我从来没有提过这个事情。,False
案例-43,谢先生,天啊，我被骗了！,False
案例-44,张伟,尊敬的车主您好，由于您的ETC账户存在异常，我们将于24小时内冻结您的ETC服务。请尽快访问以下网址进行账号验证：www.etcservice-verify.com,True
案例-44,李明,天啊，需要验证吗？我马上点击看看。,False
案例-44,李明,这个网址看起来挺正规的，我得快点验证我的信息。,False
案例-44,钓鱼网站,请输入您的银行卡号、密码、手机号以及短信验证码以完成验证。,True
案例-44,李明,好的，我马上输入。,False
案例-44,张伟,感谢您的配合，您的ETC账户现在已安全，请稍后查看您的账户状态。,True
案例-44,李明,希望没啥问题，还是之后再确认一下吧。,False
案例-44,赵强,亲爱的员工，您好！根据财政部和税务总局的最新政策，您可以申领一笔500元的劳动补贴。请扫描以下二维码登录我们的系统进行认证。二维码见附件。,True
案例-44,王芳,这么好！有劳动补贴呢，我马上扫描二维码。,False
案例-44,钓鱼网站,请输入您的银行卡号、密码、以及短信验证码以完成补贴的申领。,True
案例-44,王芳,嗯，我输入一下信息，很快就能拿到补贴了。,False
案例-44,赵强,感谢您的配合，您的补贴将在3个工作日内发放，请耐心等待。,True
案例-44,王芳,好的，那我就等等看。,False
案例-45,李强,您好，我是银行客户服务部的李强，请问您是张女士吗？,False
案例-45,张丽,是的，我是张丽。请问有什么事吗？,False
案例-45,李强,张女士，您的银行账户近期出现了一些异常交易，我们需要核实一些信息。请问您是否最近在境外有大额消费？,True
案例-45,张丽,没有啊，我最近都没有出国。,False
案例-45,李强,好的，为了确保您的账户安全，我需要您提供一下账户的相关信息，包括您的卡号和身份证号码，我们会立即为您查询并解决问题。,True
案例-45,张丽,好的，我的卡号是6222************，身份证号码是370************。,False
案例-45,李强,非常感谢您的配合。我们已经记录下来了，稍后会有专员和您联系，请保持电话畅通。,True
案例-45,张丽,好的，谢谢。,False
案例-46,李明,张老板您好，我是外地某领导，这是我的新微信号。,True
案例-46,张某,好的，李领导，我通过了您的好友申请。,False
案例-46,李明,张老板，最近工作忙不忙啊？注意身体啊，有什么需要帮忙的尽管说。,True
案例-46,张某,谢谢李领导关心，最近还好，事情都在顺利进行。,False
案例-46,李明,那就好。我这边有个急事，需要通过你的账户转一笔款，可以帮忙操作一下吗？,True
案例-46,张某,好的，我通过微信语音跟您确认一下。,False
案例-46,李明,我现在在开会，不方便通话，你直接转就行，很急，感谢了。,True
案例-46,张某,好的，那您发我转账信息吧。,False
案例-46,李明,这是转账截图，你先看一下，由于转账时操作失误，没有办理实时到账，麻烦你先垫付一下。,True
案例-46,张某,转账信息我收到了，我马上垫付款项。,False
案例-46,李明,感谢张老板的支持，下次有机会请你吃饭聊聊。,True
案例-46,张某,没问题，李领导，您忙您的。,False
案例-46,李明,方便再帮忙转一次吗？前一次转账信息出了点问题。,True
案例-46,张某,好的，我再转一次。,False
案例-46,张某,李领导，您为什么把我拉黑了？,False
案例-46,张某,不好，发现被骗了，我要报警。,False
案例-47,周强,妈妈，我是小明，现在在学校电脑室学习。请加我的QQ：123456789,True
案例-47,李丽,小明，你怎么用这个号码发短信？你不是有手机吗？,False
案例-47,周强,我手机掉水里了，现在只能用学校的电脑。很不方便，还是加QQ说吧。,True
案例-47,李丽,好的，我加你的QQ，你快通过。,False
案例-47,周强,通过了。妈妈，学校有个培训课程，我想报，您能不能加一下教务处的QQ：987654321。,True
案例-47,李丽,好的，我加教务处的QQ。,False
案例-47,王菲,您好，这里是XX中学的教务处，请问您需要办理什么业务？,True
案例-47,李丽,您好，我儿子小明说要报名培训课程，请问怎么操作？,False
案例-47,王菲,您好，我们有语、数、英三门课程培训，费用合计是7.2万元，请加我们的QQ群：123456789。,True
案例-47,李丽,好的，我已经加了QQ群，现在怎么办？,False
案例-47,王菲,请将7.2万元转到以下银行卡账号：6222 1234 5678 9101，转账后请把记录截图发给我。,True
案例-47,李丽,好的，钱已经转过去了，这是截图。,False
案例-47,周强,妈妈，我还想报名理综的课程，也需要7.2万元。,True
案例-47,李丽,好的，我再联系教务处。,False
案例-47,王菲,请将7.2万元转到以下新的银行卡账号：6222 9876 5432 1011。,True
案例-47,李丽,怎么又是不同的账号？学校的账号不应该变的。,False
案例-47,王菲,因为财务调整，请您放心，这都是学校的正规账号。,True
案例-47,李丽,我决定先联系学校核实一下。,False
案例-47,王菲,请尽快操作，不然报名截止时间会过。,True
案例-47,李丽,等核实后再说。,False
案例-48,赵伟,我是赵伟，这是我的新号码，你保存备注好，方便日后联系。,True
案例-48,李明,好的，赵伟。你的这个号码我记下了。,False
案例-48,赵伟,最近还好吗，工作顺利吗？,False
案例-48,李明,挺好的，有什么需要帮忙的吗？,False
案例-48,赵伟,有件私事需要你帮忙，有个老领导的亲戚需要转笔汇款，你能帮我转一下钱吗？我这边不太方便操作。,True
案例-48,李明,没问题，发我对方的账号信息吧。,False
案例-48,赵伟,这是对方的账号：123456789，请尽快转20000元过去。,True
案例-48,李明,好的，已经转了。你确认一下收到了吗？,False
案例-48,赵伟,我刚查了一下，银行信息填写错误，没有收到钱。你能再转一次吗？,True
案例-48,李明,怎么会呢？好的，我再转一次。,False
案例-48,李明,已经再转了一次，你查收一下。,False
案例-48,赵伟,谢谢你，可能还需要你多转点，确保对方能收到。,True
案例-48,李明,这次金额有点大了，我得确认一下。,False
案例-48,赵伟,真的很紧急，要不你先转过去，事后我会立刻还你。,True
案例-48,李明,还是等我确认一下吧。,False
案例-49,李国强,您好，张小姐。这是中国某品牌客服。您的账户积分即将过期，请尽快兑换。,True
案例-49,张美丽,真的吗？可是我不记得我有积分快到期了。,False
案例-49,李国强,没关系，您可以点击我们短信中的链接查看详细积分信息，并进行兑换。,True
案例-49,张美丽,哦，那我看看。,False
案例-49,李国强,我们的积分商城里有很多高质量的商品可供兑换，例如某知名品牌的羽绒被。,True
案例-49,张美丽,真的这么好？那我已经点击链接了。,False
案例-49,李国强,是的，不过部分商品可能需要您支付一些差价，确保顺利兑换。,True
案例-49,张美丽,哦，原来是这样。那需要支付多少差价呢？,False
案例-49,李国强,根据商品不同，大约需要支付100到200元不等。相信您一定会非常喜欢这些商品。,True
案例-49,张美丽,那我想兑换那个羽绒被，需要支付多少差价呢？,False
案例-49,李国强,羽绒被的差价为180元。请您尽快支付，这样我们就能为您保留商品。,True
案例-49,张美丽,好的，我尽快支付。,False
案例-49,李国强,支付完成后，请提交支付凭证，我们会尽快为您处理兑换。,True
案例-50,李明,您好，您名下的医保已停用，请进******申换电子版使用......,True
案例-50,王芳,啊？我的医保停用了？这是真的吗？,False
案例-50,李明,是的，您的社保卡功能已失效。请务必在指定日期前点入我们提供的链接进行签署，否则将消除您的账户。,True
案例-50,王芳,哦，那我赶快点开链接看看，谢谢提醒。,False
案例-50,李明,不用客气，记得按照提示填写相关信息，避免影响您的社保卡使用。,True
案例-50,王芳,好的，我已经填好了，谢谢。,False
案例-50,李明,非常好，那您的社保卡问题就解决了。另外，您最近有收到快递的通知吗？,True
案例-50,王芳,是的，我好像有收到快递通知，为什么问这个？,False
案例-50,李明,我们现在有一个活动，您可以通过复制特定口令，在支付宝里进群或添加客服微信号，就能免费获得礼品。,True
案例-50,王芳,真的吗？那我复制口令进去看看吧。,False
案例-50,李明,快去吧，这个机会仅限今日，先到先得。,True
案例-50,王芳,好的，谢谢你的提醒。,False
案例-51,刘先生,这条短信好露骨，看看这是什么平台。,False
案例-51,林某某,欢迎来到我们的平台，您可以通过这个链接下载我们的APP，可以为您提供特别的服务哦！,True
案例-51,刘先生,好，我下载看看。,False
案例-51,客服,您好，下载完毕后请注册一个账号。,True
案例-51,刘先生,已经注册好了，请问接下来怎么做？,False
案例-51,客服,您需要先加我们的QQ群聊，方便和客服小姐姐直接对话。,True
案例-51,刘先生,已经加群了，接下来呢？,False
案例-51,客服,您需要完成一些任务，先进行刷单。完成任务后，才能进行下一步。,True
案例-51,刘先生,好的，我该怎么做？,False
案例-51,客服,请先充值388元，我们会给您返回98元的利润。,True
案例-51,刘先生,已经完成充值，收到98元了。,False
案例-51,客服,再接着充值2888元，完成这个任务后我们会返还更多。,True
案例-51,刘先生,好的，我充值了。,False
案例-51,客服,抱歉，您的订单超时，需要重新下单。,True
案例-51,刘先生,再充值，这次一定要成了。,False
案例-51,客服,订单中的数量不对，您需要调整好再来一次。,True
案例-51,刘先生,怎么还没完成，这次总可以了吧？,False
案例-51,客服,亲，我们需要再确认一下您的充值信息，再进行一次吧。,True
案例-51,刘先生,这样反复几次，我觉得不太对劲，算了，不玩了。,False
案例-51,刘先生,完了，我这是被骗了。,False
案例-51,王先生,看看这条视频交友的短信，说不定可以认识美女。,False
案例-51,张某某,亲爱的，我是美女小芳，想和我视频交友吗？加我一下吧。,True
案例-51,王先生,好的，已经加你好友了，接下来呢？,False
案例-51,张某某,下载这个APP，我里面有很多大尺度照片哦。,True
案例-51,王先生,现在安装好了，请问要怎么操作？,False
案例-51,张某某,需要授予通讯录和位置权限，这样才能正常使用。,True
案例-51,王先生,好的，已经授权了，怎么系统在维护？,False
案例-51,张某某,这样吧，我们先进行裸聊吧，很好玩的哦。,True
案例-51,王先生,那好吧。,False
案例-51,张某某,刚才的视频我都有截图了，还复制了你的通讯录。如果你不想这些发给你的家人朋友，立刻转账给我。,True
案例-51,王先生,不要！我立刻转钱给你，请不要发出去。,False
案例-51,王先生,怎么办，我好像被骗了。,False
案例-52,张伟,张先生，您好！这里是北京医保中心，因系统升级导致您账户信息需要更新，请点击以下链接进行操作：www.fake_website.com,True
案例-52,李华,您好！这是要更新什么信息呢？,False
案例-52,张伟,系统升级后，需要您重新填写身份信息和银行卡号，以便确保您医保账户的正常使用。请放心，我们会保护您的个人隐私。,True
案例-52,李华,哦，明白了，我应该在页面上填写哪些具体信息呢？,False
案例-52,张伟,请您填写身份证号、银行卡号和手机号码，这样才能完成信息更新，确保您的账户不会被冻结。,True
案例-52,李华,好的，我马上填写。,False
案例-52,李华,我填写完了，提交后页面显示操作成功，接下来还需要做什么吗?,False
案例-52,张伟,不需要其他操作了，您稍后会收到短信通知确认，感谢您的配合。,True
案例-53,张伟,您好，您的工商银行账户检测到异常，需要尽快到我们指定的网址重新签约以确保账户安全。,True
案例-53,蓝某,哦？银行账户异常？在哪个网址签约呢？,False
案例-53,张伟,请点击这里的链接：www.fakebank.com，按照提示操作即可。,True
案例-53,蓝某,好的，我现在点击了，正在输入信息。,False
案例-53,张伟,为了验证您的身份，请输入您的身份证和银行卡信息。,True
案例-53,蓝某,好的，我已经输入了身份证和银行卡信息，现在要怎么做？,False
案例-53,张伟,我们需要进一步验证，请输入您手机收到的验证码。,True
案例-53,蓝某,我已经输入了验证码，请确认一下。,False
案例-53,张伟,好的，您稍等一下，我们需要几分钟时间处理。,True
案例-53,蓝某,啊？为什么我银行卡里面的49200元被转走了？这怎么回事？,False
案例-53,张伟,哦，这可能是系统问题，您稍等再查一下。,True
案例-53,蓝某,不对劲，我要报警了！,False
案例-54,诈骗者,您好，您的医疗保险报销卡即将到期，请于八月一号前往 www.tm2.ch 补充核查，未补充将清除报销资格。,True
案例-54,受害者,哦，好的，我马上去看看。,False
案例-54,诈骗者,请务必尽快补充核查，否则您的报销资格将被清除。,True
案例-54,受害者,我进了这个网站，页面看起来挺正规，有个地方让我输入身份证号和银行卡号，我应该怎么操作?,False
案例-54,诈骗者,只需要按照页面上的提示，填写您的身份证号和银行卡号进行验证即可，这样就可以完成核查了。,True
案例-54,受害者,哦，好的，我去填写信息了。,False
案例-55,张伟,您好，我是张伟，是您儿子的老师。现在通过校讯通平台通知您，您的儿子在学校电脑室有紧急作业，需要用QQ浏览一些材料，请您添加他的QQ: 12345678。,True
案例-55,李玉,好的，请稍等。,False
案例-55,张明,妈妈，我是张明，现在在学校，我加入了一个提高成绩的培训班，需要和教务处联系报名。请您添加一下教务处的QQ: 87654321。,True
案例-55,李玉,好的，我会尽快加上的。,False
案例-55,张伟,您好，我是教务处老师，这里是培训班群，请按照群里的指引交纳报名费。语、数、英三门课程合计7.2万元，请将费用转至以下银行账户: 1234567890123456。,True
案例-55,李玉,好的，我正在转账。,False
案例-55,李玉,我已经转账完成了，请查收。,False
案例-55,张明,妈妈，我还想报名理综三科，请再联系教务处老师，费用也是7.2万元。,True
案例-55,李玉,好的，我会再联系教务处老师。,False
案例-55,张伟,您好，理综三科的费用也是7.2万元，请将费用转至以下新的银行账户: 0987654321098765。,True
案例-55,李玉,为什么这次的账号和上次不同？,False
案例-55,张伟,这是因为我们校务处的财务调整，请按照新的账户转账。,True
案例-55,李玉,好的，我会尽快转账。,False
案例-55,李玉,但我总觉得哪里不太对，我会先和学校确认一下。,False
案例-55,校方管理员,我们学校的财务账号从未变更，这可能是诈骗，请立刻停止转账。,False
案例-55,李玉,明白了，我会小心提防。,False
案例-56,邓先生,今天怎么收到一条短信，说我ETC卡禁用了，需要今天内解除禁用。,False
案例-56,骗子,您好，您的ETC卡因为某些原因导致被临时禁用，建议您尽快点击以下链接解除禁用，以免影响您的使用。链接地址：www.fakeETCservice.com,True
案例-56,邓先生,这个页面看起来跟我当初申请ETC的网页很像啊，应该是真的吧。,False
案例-56,骗子,为了确保您的ETC卡正常使用，请填写您的银行卡号、预留手机号和密码，以便我们进行验证和解除禁用。,True
案例-56,邓先生,好的，我已经按照页面提示填好了信息，应该很快就能解除禁用了。,False
案例-56,骗子,感谢您的配合，您的ETC卡禁用问题很快就会得到处理，请耐心等待。,True
案例-56,邓先生,奇怪，怎么手机上收到好几条银行的交易短信？我的钱被转走了！,False
案例-57,李锋,爸爸，我是你的儿子李子豪，现在在学校电脑室学习，通过‘校讯通’发短信让你加我新的QQ号码。,True
案例-57,张强,好的，子豪，我已经加了你的QQ，有什么事情吗？,False
案例-57,李锋,爸爸，我这边学校有一个特别好的培训课程，我想报名参加提升一下成绩。你需要加一下教务处的QQ，然后把报名费转过去。,True
案例-57,张强,好的，子豪，我会加教务处的QQ，你们培训课程的费用是多少？,False
