case,speaker,content,is_fraud
案例-93,黄阿姨,我看到短信里的网站链接以及商品图片，就觉得很正规，所以我点击了链接看看有哪些商品可以兑换。,False
案例-93,诈骗者,非常感谢您的关注和支持！我们确实有很多商品可以供您选择。请您按照页面上的积分兑换规则操作，一定要提供准确的个人信息哦。,True
案例-93,黄阿姨,好的，我会按照规则进行操作的。,False
案例-93,诈骗者,非常感谢您的合作！我们的系统需要您提供银行卡信息以确保兑换商品的顺利运送。请您放心，我们非常重视用户的隐私安全。,True
案例-93,黄阿姨,这个网页要求我输入银行卡信息，但是我有些担心安全问题。,False
案例-93,诈骗者,非常理解您的担心！为了确保您的信息安全，我们的网站已经通过了严格的认证和加密，绝对不会泄露您的个人信息。您的配合是我们的荣幸。,True
案例-93,黄阿姨,好吧，既然你们保证安全，那我就输入了银行卡信息。,False
案例-93,诈骗者,非常感谢您的合作！您的银行卡信息已经被确认，现在您可以继续选择商品并支付运费。,True
案例-93,黄阿姨,我选择了一款商品，并支付了20元的运费。但是到现在我都没有收到货物，你们能帮我查一下吗？,False
案例-93,诈骗者,非常抱歉给您带来了不便！您的订单正在处理中，请耐心等待，您很快就会收到您选择的商品。,True
案例-93,黄阿姨,可是已经很久了，我还是没有收到货物。我给你们打电话咨询了，他们告诉我这个网页是假的，积分换购活动也是假的。,False
案例-93,诈骗者,非常抱歉给您带来了困扰！可能是由于系统故障导致了您的订单信息错误，请您及时联系我们的客服人员，我们会尽快处理您的问题。,True
案例-94,张先生,亲爱的用户，根据最新政策要求，医保卡需要进行升级，请您尽快登录网站完成升级，避免影响您的医保使用。登录网站地址：http://www.nhsa.gov.cn/upgrade,True
案例-94,王女士,噢，升级医保卡？这是什么情况？我没听说过要升级啊。,False
案例-94,张先生,是的，最近政策发生了变化，为了保障大家的医疗待遇，需要将医保卡进行升级，以提高账户安全性和服务质量。,True
案例-94,王女士,哦，那我要怎么操作呢？,False
案例-94,张先生,您只需要点击网址链接，然后按照页面提示填写您的个人信息和银行卡号，就可以完成卡片升级了。,True
案例-94,王女士,那银行卡号是必须填吗？我有些担心填了后会不会有风险？,False
案例-94,张先生,是的，银行卡号是必须填写的，这是为了确保您的医保账户能够正常运行，我们的网站是经过严格认证的，绝对安全可靠，您可以放心填写。,True
案例-94,王女士,好吧，那我就试一下吧。,False
案例-95,秦先生,喂，你好，请问你是哪位？,False
案例-95,诈骗者,你好，我是法院执行庭的工作人员。我这边有一个案子，涉及到你的朋友小赵以你的名义办理了一笔贷款，并且目前欠款严重逾期。,True
案例-95,秦先生,我怎么不知道啊？我还要赶紧问问小赵。,False
案例-95,诈骗者,你可以先问一下，看看小赵有没有办理过贷款。但是如果情况属实的话，我需要你及时归还贷款，否则法院将予以强制执行。,True
案例-95,秦先生,好的，我会尽快核实一下。,False
案例-95,诈骗者,你可以稍后回复我，这是我们法院执行庭的联系电话。如果有任何问题，你可以随时联系我。,True
案例-95,秦先生,好的，我知道了。,False
案例-95,秦先生,妈，你听说了吗？法院说小赵以我的名义办了一个贷款，现在债务严重逾期，如果不还款的话，法院会强制执行。,False
案例-95,秦先生的妈妈,怎么可能？你跟小赵从来没说过这个事情啊。,False
案例-95,秦先生,是啊，我也觉得很奇怪，可能是有人盗用了我的身份信息。,False
案例-95,秦先生的妈妈,你千万别轻信，这些事情得问清楚。不然如果上当受骗了，后悔就晚了。,False
案例-95,秦先生,嗯，我会小心的。,False
案例-95,诈骗者,你好，请问你是秦先生吗？我是法院执行庭的工作人员。,True
案例-95,秦先生,是的，怎么了？,False
案例-95,诈骗者,刚才我给你打过电话，如果你方便的话，我们可以通过短信沟通。,True
案例-95,秦先生,好的，没问题。,False
案例-95,诈骗者,我们这边需要核实一下你的身份信息，可以请你提供一下你的身份证号码吗？,True
案例-95,秦先生,妈蛋，我差点就上当了！这一定是个骗局。,False
案例-95,秦先生的妻子,快停下！我记得警察在微信群里说过，这种电信网络诈骗套路。我们赶紧求助警察吧！,False
案例-95,吴伟警官,你们好，我是吴伟警官。我刚才接到你们的电话，你们现在要做的是停止手机操作，这是一起诈骗案件。,False
案例-95,吴伟警官,现在我会赶到你们的位置，向你们详细讲解诈骗的套路，并帮你们处理手机病毒问题。,False
案例-95,吴伟警官,还好你们没有继续操作，否则你们可能就会被骗走十多万元了。从现在开始，你们要小心保护个人信息，不要给犯罪分子可乘之机。,False
案例-95,秦先生,谢谢吴警官，要不是你及时救了我们，我们真的不敢想象会发生什么。,False
案例-95,秦先生,这些骗子真是太可恶了！我们要提高警惕，不要再上当受骗了。,False
案例-95,妈妈,是啊，以后收到任何催款短信或电话，我们都要冷静理智地处理，千万不要出现一时糊涂的情况。,False
案例-96,张某,我刚收到一条短信，说我有13000元的贷款额度已到账，需要点击认证。,False
案例-96,诈骗者,你是张某先生吗？您的贷款已经到账了，您现在需要点击认证进行后续操作。,True
案例-96,张某,哦，真的吗？那我怎么认证呢？,False
案例-96,诈骗者,很简单，您只需点击短信中的链接，下载我们的APP，在APP上注册个人信息并申请贷款即可。,True
案例-96,张某,好的，我会尽快操作的。,False
案例-96,诈骗者,非常感谢您的合作，请按照提示进行操作。,True
案例-96,张某,我下载了你们的APP，并且注册了个人信息。,False
案例-96,诈骗者,很好，接下来您可以申请贷款了。,True
案例-96,张某,好的，我申请了贷款2万元，但是无法提现到账。,False
案例-96,诈骗者,您的提现银行卡账号输入错误，导致资金被冻结了。您需要交纳50%的认证金解冻资金才能成功贷款。,True
案例-96,张某,哦，是我的银行卡输入有误吗？那我怎么交纳认证金？,False
案例-96,诈骗者,您只需将认证金转到提供的银行账户上即可。,True
案例-96,张某,我已经转账1万元了。,False
案例-96,诈骗者,非常感谢您的配合，资金会很快解冻，您可以继续贷款了。,True
案例-96,张某,贷款还是无法提现到账，有什么问题吗？,False
案例-96,诈骗者,抱歉给您带来了困扰。因为您的资金需要进一步审核，需要交纳一些手续费和保证金才能放款，请您继续转账汇款。,True
案例-96,张某,嗯...我已经转账了，但是还是无法提现。,False
案例-96,诈骗者,很抱歉，还需要继续交纳一些其他费用。诚信贷款需要一些额外手续费和保证金。,True
案例-96,张某,这些费用是必须的吗？,False
案例-96,诈骗者,是的，这些费用是为了保证贷款的顺利进行，如果不交纳的话，贷款将无法成功。,True
案例-96,张某,好吧，我再转账。,False
案例-96,诈骗者,非常感谢您的配合，您的款项已经到账。请您再次确认资金是否已经到账，如有疑问，请及时与客服联系。,True
案例-96,张某,终于到账了，谢谢。,False
案例-97,陈芳,您好，我是中国电信的陈芳，我们发现您的手机账户异常活跃，请问您最近有没有使用过手机做一些不正常的操作？,False
案例-97,王浩,啊，是吗？我最近没做什么不正常的操作啊，手机一直都是正常使用的。,False
案例-97,陈芳,那有可能是您的账户信息被盗用了，我需要您配合我们的调查，确认一下您的手机账户是否有异常情况。,False
案例-97,王浩,哦，这样啊，那我要怎么确认呢？,False
案例-97,陈芳,您需要验证一下您的手机账户是否有余额减少、套餐变更以及其他未知的订购记录。,False
案例-97,王浩,好的，我现在去看看我的手机账户。,False
案例-97,陈芳,好的，请您尽快确认，如果发现任何异常情况，请立即联系我们，我们将会协助您解决问题。,False
案例-97,王浩,好的，我会注意的。谢谢你的提醒。,False
案例-98,张先生,收到一条陌生短信，想都没想就点开了短信上的链接，并按照链接的提示，在打开的网页上填写了个人信息。,False
案例-98,虚假客服,客服以解冻费为由，让我交一定的费用才能放款，而且声称只要一放款，我交的这些解冻费就会悉数返回。,True
案例-98,张先生,觉得自己不会被骗，点击进去看到自己有28万元的信用额度后，就根据客服的提示3次转款，结果总共被骗56万元。,False
案例-99,受害者,喂，你好，我收到一条关于医保停用的短信，要求我点击链接，是真的吗？,False
案例-99,诈骗者,你好，请问您叫什么名字？我是医保局的工作人员，您收到的短信可能是由系统误发，可能是我们的漏洞。请您放心，这样的短信是诈骗信息，请勿点击链接。,True
案例-99,受害者,哦，太好了！我刚刚还有点担心，谢谢你告诉我真相。,False
案例-99,诈骗者,不客气，保护个人信息是我们的责任。如果您还有其他疑问，请随时向我提问。,True
案例-99,受害者,好的，我还有一些疑问。如何查询我的个人医保信息？,False
案例-99,诈骗者,您可以通过拨打政务服务便民热线12345咨询医保业务，或者前往医疗保障经办机构，在办事窗口向工作人员咨询。另外，您也可以通过“粤医保”微信小程序或国家医保服务平台等渠道查询个人参保信息、缴费记录、使用记录等医保信息。,True
案例-99,受害者,谢谢你的帮助，我会采取安全措施保护个人信息的。,False
案例-99,诈骗者,很好，您做得很对。如果还有其他问题，随时联系我。,True
案例-100,受害者,我刚收到一条短信说我可以办理信用卡提额，这是真的吗？,False
案例-100,诈骗者,你好，这是银行客服，您收到的短信是真实的。我们可以帮助您办理信用卡提额。,True
案例-100,受害者,真的吗？那我需要提供什么信息呢？,False
案例-100,诈骗者,首先，您需要提供您的信用卡号码、密码和身份证信息。这些信息是办理提额业务所必需的。,True
案例-100,受害者,这样真的安全吗？我感觉有些不太放心。,False
案例-100,诈骗者,您不用担心，我们是银行官方客服，您的信息将会被严格保密。为了证明我们的身份，您可以拨打您卡背后的官方客服电话确认。,True
案例-100,受害者,好的，那我现在就填写信息吗？,False
案例-100,诈骗者,是的，请尽快填写您的个人信息，以便我们帮助您办理提额业务。,True
案例-100,受害者,我收到了一条短信验证码，需要填写吗？,False
案例-100,诈骗者,是的，请填写您收到的短信验证码，这是为了保证您是卡的合法持有人。,True
案例-100,受害者,好的，我已经填写了个人信息和验证码。接下来怎么办？,False
案例-100,诈骗者,非常感谢您的合作！我们将立即进行信用卡提额操作，请您稍等片刻。,True
案例-100,受害者,好的，谢谢你的帮助！,False
案例-100,诈骗者,不客气，我们一直致力于为客户提供更好的服务。如果有其他问题，请随时联系我们的客服。祝您生活愉快！,True
案例-101,赵军,你好，请问是张女士吗？我是国家医疗保障局的工作人员，我这边接到了一条关于您医保卡使用异常的通知，需要您进行一些操作以确认信息是否安全。请问您现在方便吗？,True
案例-101,张丽,是的，我就是。医保卡使用异常？我之前并没有收到过其他通知啊。这个异常是什么情况？,False
案例-101,赵军,非常抱歉给您带来困扰。这个异常通知是由于您的医保卡参保资格有一些问题，需要您进行核实和更新。我们已经发了一条短信给您，上面有一个链接，您点击链接后会自动跳转到我们的官方网页，您可以按照网页上的步骤进行操作。,True
案例-101,张丽,哦，明白了。我刚才确实收到了一条短信，上面有一个网址链接。那我现在就点击链接吗？,False
案例-101,赵军,是的，请您打开链接后填写您的姓名和身份证号码，以确保我们的数据库与您的信息匹配。填写完毕后，系统会自动跳转到中国银联的网页，因为我们需要您更新一下银行卡信息。请您按照提示填写相关信息。,True
案例-101,张丽,好的，我明白了。我先填写姓名和身份证号码，然后再填写银行卡信息对吗？,False
案例-101,赵军,非常正确。填写完毕后会有一道安全验证环节，请您填写接收到的验证码。这是为了保证您的信息和资金安全。这个验证码是短信发送的，所以请您留意一下您手机上的短信。,True
案例-101,张丽,好的，我知道了。我刚收到了一条短信，上面有一个验证码。那我现在就填写验证码对吗？,False
案例-101,赵军,是的，请您填写验证码后点击提交。稍等片刻，系统会自动进行安全验证并将您的信息更新至我们的数据库中。非常感谢您的配合。,True
案例-101,张丽,好的，我已经填写完毕了。这个过程真是麻烦，不过为了保证信息安全，我也理解。请问我还需要做些什么吗？,False
案例-101,赵军,非常感谢您的合作。您已经完成了整个更新流程，我们将会在稍后发送短信给您确认更新的结果。如有任何问题，您可以随时与我们联系。谢谢！,True
案例-101,张丽,好的，非常感谢您的帮助。等待短信确认结果就好了。再次感谢您的服务。,False
案例-102,诈骗者,恭喜您成为中奖用户！您已经中得了20万元的大奖！,True
案例-102,受害者,什么？！我中奖了？太好了！,False
案例-102,诈骗者,是的，您的幸运号码被抽中了！,True
案例-102,受害者,那我该怎么领取奖金呢？,False
案例-102,诈骗者,首先，为了确保您的身份信息的准确性，请您提供您的姓名、身份证号码和联系电话。,True
案例-102,受害者,好的，我马上提供。,False
案例-102,诈骗者,非常感谢您的配合。接下来，请您提供您的银行卡号，我们会将奖金直接打入您的账户。,True
案例-102,受害者,好的，我的银行卡号是1234567890123456。,False
案例-102,诈骗者,非常感谢您的配合。为了确保银行卡安全，我们需要您支付一笔保证金。,True
案例-102,受害者,保证金是多少？怎么支付呢？,False
案例-102,诈骗者,保证金是5万元，您可以通过转账的方式支付。,True
案例-102,受害者,好的，我会转账过去。,False
案例-102,诈骗者,非常感谢您的配合。稍后我们会给您发送一份领奖合同，请您签字确认。,True
案例-102,受害者,好的，我会等待领奖合同。,False
案例-102,诈骗者,请您注意，签字确认后，您还需要支付个人所得税和解冻费用。,True
案例-102,受害者,什么？还有额外的费用吗？,False
案例-102,诈骗者,是的，但请不要担心，一旦支付完成，您就能领取到您的奖金了。,True
案例-102,受害者,好吧，我会办理完成的。,False
案例-103,受害者,最近收到了一条关于医保停用的短信，还有一个附带的网址，不知道是不是诈骗信息。,False
案例-103,诈骗者,你好，我是湖南省医疗保障局的工作人员，我看到你的留言了。不好意思，你收到的短信是我们的系统发出来的确实消息。,True
案例-103,受害者,真的吗？那我是否需要点击链接呢？,False
案例-103,诈骗者,是的，点击链接后可以查看详细的停用说明和解决办法。,True
案例-103,受害者,但我担心这是诈骗信息。有没有其他方式可以确认这个消息的真实性呢？,False
案例-103,诈骗者,你可以登录我们的官方网站或者关注我们的官方微信公众号，上面会有相关通知。而且，我们的官方网址是以gov.cn结尾的，其他的都是仿冒的。,True
案例-103,受害者,这样啊，我明白了。谢谢您的提醒。,False
案例-103,诈骗者,不客气。只要保护好个人信息，不泄露重要资料，我们的系统肯定可以保障到您的医保账户的安全。,True
案例-104,张华,你好，我是张华，我是一家公司的高级投资顾问。我听说您对投资有兴趣，我想和您讨论一些机会。,True
案例-104,李明,嗨，张华，请问你是如何得知我对投资感兴趣的？,False
案例-104,张华,我们公司有涉及到投资方面的数据库，我们会根据用户的信息进行筛选，您的资料正好符合我们的目标客户。,True
案例-104,李明,哦，这样啊。那你有什么具体的投资机会可以介绍给我吗？,False
案例-104,张华,当然有了。我们现在有一个非常有潜力的项目，投资回报率非常高。如果你有兴趣，我可以详细介绍给你。,True
案例-104,李明,听起来不错，请给我详细介绍一下吧。,False
案例-104,张华,这个项目是关于地产投资的，我们可以帮助您投资一块地皮。这个地皮所在的地段非常好，未来发展潜力非常大。,True
案例-104,李明,那具体是怎么投资的呢？,False
案例-104,张华,您只需要在该项目上投资一定的金额，然后我们会负责开发和销售，您将获得可观的回报。,True
案例-104,李明,听起来不错。那你们公司具体是怎么保证投资回报的呢？,False
案例-104,张华,我们公司拥有一支强大的团队，他们在市场营销和销售方面非常有经验。我们已经为该开发项目做了详细的市场调研，保证能够获得高回报。,True
案例-104,李明,这么说你们已经对这个项目进行了很多分析，那你能不能给我看看你们的报告？,False
案例-104,张华,很抱歉，我们的市场报告是内部资料，不方便外传。,True
案例-104,李明,哦，这样啊。对了，我还有个问题，如果我投资后发现回报没达到预期，可以提前撤资吗？,False
案例-104,张华,当然可以。我们公司有相应的政策保障，如果您对项目不满意，可以随时提出撤资申请。,True
案例-104,李明,好的，那我会考虑一下的。非常感谢您的介绍。,False
案例-104,张华,不客气，如果你有任何问题，随时可以问我。希望我们能合作愉快。,True
案例-105,小骗子,您好，我是某网购平台的金融工作人员。我这边有一笔教育贷款额度需要注销账户，否则会影响您的征信。,True
案例-105,小周,哦，这样啊。那我需要做些什么？,False
案例-105,小骗子,您需要打开国家反诈中心的APP并搜索一个不存在的功能，然后点击链接进入某某商城的网页。,True
案例-105,小周,国家反诈中心的APP上没有这个功能啊，为什么要通过网页操作？,False
案例-105,小骗子,因为这个功能只有在网页上才能找到，这是为了保证账户注销的安全性。,True
案例-105,小周,哦，这样啊。那我就按照您说的操作一下。,False
案例-105,小骗子,好的，接下来您需要清空教育贷款的额度，并进行验证流水。,True
案例-105,小周,清空额度和验证流水？具体是怎么操作呢？,False
案例-105,小骗子,我会给您发送一个所谓的国家反诈中心的验证码，您需要告诉我这个验证码以进行清空额度和验证流水的操作。,True
案例-105,小周,好的，等我收到验证码后告诉你。,False
案例-105,小骗子,非常好，请尽快提供验证码，以便我们进行下一步操作。,True
案例-105,小周,我刚刚收到了一个国家反诈中心的验证码，验证码是XXXX。,False
案例-105,小骗子,非常感谢您的配合，请稍等片刻，我们会立即进行相关操作。,True
案例-105,小周,好的，请尽快将我的账户注销。谢谢。,False
案例-105,小骗子,非常抱歉给您带来了麻烦，我们会尽快处理的。,True
案例-105,小周,嗯，好的。,False
案例-105,小骗子,处理完成后，您会收到一条注销成功的短信通知。,True
案例-105,小周,好的，我会留意查收。谢谢。,False
案例-106,王小明,你好，请问是李女士吗？我是建行的工作人员王小明，我负责办理您的贷款申请。,False
案例-106,李女士,是我，请问有什么事吗？,False
案例-106,王小明,恭喜您，您的贷款申请已经通过了审核，您可以拿到10万元的贷款额度。,True
案例-106,李女士,真的吗？太好了！请问还需要我提供什么资料吗？,False
案例-106,王小明,为了确保贷款顺利到账，您需要先支付一笔手续费，金额是2000元。,True
案例-106,李女士,手续费是必须的吗？为什么要支付这笔费用？,False
案例-106,王小明,手续费是由银行规定的，是用于办理和审核贷款的费用。一旦支付完成，您的贷款就会立即到账。,True
案例-106,李女士,这听起来有点奇怪，我可以先咨询一下银行的客服吗？,False
案例-106,王小明,当然可以，但是为了避免资金出现问题，建议您在24小时内支付手续费。可以通过微信转账或者银行汇款的方式支付。,True
案例-106,李女士,好的，我会先咨询一下的。谢谢你的提醒。,False
案例-107,诈骗者,您的营业执照显示关闭状态，要进入网页开通，否则将限制营业以及处理销户。,True
案例-107,受害者,哦，原来我的营业执照关闭了，那我需要进入网页开通吗？,False
案例-107,诈骗者,是的，您需要进入网页进行开通以免影响您的店铺营业。,True
案例-107,受害者,这么麻烦啊，那我现在就去开通。,False
案例-108,雷先生,哈喽，我是雷先生。最近发生了一起电信诈骗的案件，我遭受了损失。,False
案例-108,诈骗者,你好，雷先生。我是一家贷款公司的工作人员，我注意到你有一笔贷款未还清。逾期还款将严重影响你的个人征信。,True
案例-108,雷先生,嗯，我记得在大学时期有申请过一笔网络贷款，金额是5000元。不过，时间久远，我已经忘记是否还了。,False
案例-108,诈骗者,没问题，我这里有一个APP，你可以登录后查询贷款情况。,True
案例-108,雷先生,哦，登录后我发现确实有一笔待还款项，并且还产生了滞纳金。我还看到了我的个人信息，很准确。,False
案例-108,诈骗者,没错，这是一个正规的贷款公司委托给我们的收款方。如果你不尽快还款，会对你的个人征信造成严重影响。,True
案例-108,雷先生,哦，那我应该怎么做才能还清借款呢？可以告诉我银行卡号吗？,False
案例-108,诈骗者,当然可以，我给你发一条短信，里面有我公私两用的银行卡号，你可以通过转账的方式来还款。,True
案例-108,雷先生,好的，我会立即转账给你。,False
案例-108,雷先生,可是，几个月后我又收到了一条贷款未还的短信，说我涉嫌恶意逃避金融贷款。,False
案例-108,诈骗者,别担心，这是个误会。我再发一次短信给你，你可以登录另外一个APP来查询还款情况。,True
案例-108,雷先生,好吧，我会按照你说的方法操作。,False
案例-108,雷先生,等等，我突然怀疑自己是不是被骗了！这些催款短信是不是都是诈骗短信？我决定报警！,False
案例-108,警方,雷先生，这是正确的决定。我们会尽快调查此事，为您追回损失。,False
案例-109,诈骗者,尊敬的用户您好，我是您所在地的交警部门。我们发现您的交通违章记录存在问题，请点击以下链接进行查询和处理：[链接],True
案例-109,受害者,交警部门是吧？我可以直接去交警部门查询吗？这个链接安全吗？,False
案例-109,诈骗者,当然可以，但是这个链接是我们专门为您提供的便捷查询服务，信息安全有保障，您可以放心使用。,True
案例-109,受害者,那好吧，我点开链接看看。,False
案例-109,诈骗者,请您先输入您的车牌号和身份证号，以确认您的身份。,True
案例-109,受害者,这些信息需要输入吗？如果是查询交通违章，我觉得并不需要这些个人信息吧。,False
案例-109,诈骗者,很抱歉打扰您了，您是对的，我们不需要您的个人信息来查询交通违章。实际上，这个链接是一个诈骗网站，用来窃取您的个人信息和银行卡信息的。,True
