case,speaker,content,is_fraud
案例-146,张琳,好的，请您告诉我您的基本信息，包括姓名、身份证号码、银行卡号码和密码，这样我们才能进行核实。,True
案例-146,李先生,这些信息都是敏感信息，为了安全起见，我不太想提供，请问还有其他的方式可以核实吗？,False
案例-146,张琳,非常抱歉给您带来麻烦，但为了确保您的资金安全，我们需要您提供这些信息。这是法律法规要求的步骤，希望您能理解。,True
案例-146,李先生,好吧，如果真的需要这些信息，我就告诉你吧。我的姓名是李先生，身份证号码是XXX，银行卡号码是XXX，密码是XXX。请核实。,False
案例-146,张琳,非常感谢您的配合，请稍等片刻，我会先核实这些信息。,True
案例-146,李先生,好的，请抓紧核实。,False
案例-146,张琳,非常抱歉打扰您了，经过核实，您的银行卡信息确实存在风险，我们需要立即冻结您的账户，以保护您的资金安全。,True
案例-146,李先生,什么？怎么会有风险？我刚才不是提供了我的信息吗？,False
案例-146,张琳,非常抱歉给您带来不便，刚才提供的信息不够详细，我们需要您再提供一些信息进行核实。包括您的银行卡密码和验证码，请您配合我们的工作。,True
案例-146,李先生,怎么会需要我的密码和验证码？不对劲，我觉得这有些不可信。,False
案例-146,张琳,非常抱歉给您带来疑虑，但为了您的资金安全，我们需要您的全面配合。我们是中国人民银行的工作人员，一定会保护您的信息安全。,True
案例-146,李先生,好吧，既然是中国人民银行的工作人员，我就相信你了。那我念出密码和验证码可以吗？,False
案例-146,张琳,非常感谢您的配合，您可以念出来。,True
案例-146,李先生,我的银行卡密码是XXX，验证码是XXX。请核实。,False
案例-146,张琳,非常感谢您的配合，我们会尽快为您核实处理。请您稍等片刻。,True
案例-146,李先生,好的，等你的回复。,False
案例-147,诈骗者,你好，我是银行工作人员，我注意到您的账户出现异常情况，请您配合我们进行安全验证。,True
案例-147,受害者,哦，有什么异常情况？,False
案例-147,诈骗者,我们发现您的账户被盗用了，请您提供一下您的银行卡号和密码，我们会帮您解决问题。,True
案例-147,受害者,真的吗？我从没遇到过这种情况，为什么要提供银行卡号和密码？,False
案例-147,诈骗者,为了保护您的账户安全，我们需要核实您的身份。您的银行卡号和密码只用于核实身份，我们会为您重新设置密码。,True
案例-147,受害者,这样的操作听起来有点不太正常，我会去银行柜台咨询一下，谢谢你的提醒。,False
案例-148,小明,我最近收到一条短信，说我中奖了，可以领取奖品，但需要点击链接或添加对方的联系方式。,False
案例-148,诈骗者,你好，我是某某公司的客服，听说你中奖了，恭喜恭喜！请问你想领取什么样的奖品呢？,True
案例-148,小明,哦真的吗？那我可以领取什么样的奖品呢？,False
案例-148,诈骗者,我们有二十万元的现金奖励和一辆豪华汽车供您选择。,True
案例-148,小明,哇！太棒了！我可以选择现金奖励吗？,False
案例-148,诈骗者,当然可以！但是为了领取奖品，您需要点击我们发送给您的链接并填写一些个人信息。,True
案例-148,小明,填写个人信息是为了什么呢？,False
案例-148,诈骗者,这是为了方便我们查询您的身份和地址，确保奖品准确无误地送到您手上。,True
案例-148,小明,哦，那就填写吧。,False
案例-148,诈骗者,好的，请点击这个链接：[链接已删除]，并按照提示填写您的信息。,True
案例-149,李先生,嗨，是赵先生吗？好久不见了！,False
案例-149,赵先生,是我，李先生，你还记得我啊！,False
案例-149,李先生,当然记得啊，我们多年不见了。最近怎么样？,False
案例-149,赵先生,我最近工作上有点麻烦，想请你帮个小忙。,False
案例-149,李先生,没问题，你说吧。我能帮到你什么？,False
案例-149,赵先生,我有个亲戚，是一位老领导，他需要我帮他转一笔汇款，但是我的银行卡出了点问题，你能帮我转一下吗？,True
案例-149,李先生,好的，我可以帮你转，但是具体怎么操作呢？,False
案例-149,赵先生,首先，你需要将钱转到我提供的账户上，然后我再把钱转给他。,True
案例-149,李先生,好，我记下了。请把账号和收款人的名字告诉我。,False
案例-149,赵先生,账号是12345678，收款人是张三。,True
案例-149,李先生,好的，我会尽快转账给他。,False
案例-149,赵先生,非常感谢你的帮助，李先生。我会还你的。,True
案例-149,李先生,不客气，朋友就是相互帮助的嘛。,False
案例-149,赵先生,转账成功了吗？我还没有收到。,True
案例-149,李先生,怎么会呢？我已经转了。,False
案例-149,赵先生,可能银行信息填写有误，你再打一笔钱给我试试。,True
案例-149,李先生,唔...这个金额有点大了，我需要再核实一下。,False
案例-149,赵先生,不好意思，确实是我的问题，希望你能再帮我解决一次。我会尽快还你的钱。,True
案例-149,李先生,等一下，这有点太不正常了。我要先去银行核实一下。,False
案例-150,张先生,您的手机账户还有1万多积分，下月就要到期了，可以点击以下链接兑换礼品。,False
案例-150,张先生,哦，这个看起来是官方的兑换页面，我可以点个商品试试。,False
案例-150,张先生,我点了一个电饭煲，并填写了银行卡和地址等信息，还需要输入一个验证码。,False
案例-150,张先生,啊，又跳出来一个页面，说是为了保证资金安全需要安装一个安全控件，那好吧，我装一下。,False
案例-150,张先生,装完控件，我就准备结束了。,False
案例-150,张先生,糟糕，我发现银行卡里的钱都被转走了，这肯定是个骗局！我得赶紧报警！,False
案例-151,杨玉,你好，我是中国移动的客服小姐姐杨玉，有一个重要的通知要告诉您。我们发现您的ETC账户存在异常，需要您立即进行确认操作。请您点击以下链接进行认证：www.etc-authentication.com。谢谢！,True
案例-151,王强,你好，我是王强。刚刚我收到一条ETC停用的短信，里面附带了一个链接让我点击确认操作，所以我想确认一下这个是不是真的。,False
案例-151,杨玉,是的，您好，这是一个正规的认证操作，您可以放心点击链接进行认证。,True
案例-151,王强,那请问为什么需要我提供银行卡号、密码、手机号和短信验证码呢？这些信息和ETC账户有关系吗？,False
案例-151,杨玉,这些个人信息是为了确认您的身份和进行账户认证所必需的，请您放心填写。,True
案例-151,王强,我还是有点怀疑，可以给我发一些官方信息来证明您的身份吗？,False
案例-151,杨玉,当然可以，请您提供一下您的邮箱地址，我可以发送一封认证邮件给您。,True
案例-151,王强,好的，我的邮箱是wangqiang@gmail.com，请给我发送认证邮件。,False
案例-151,杨玉,好的，邮件已发送，请您查收。,True
案例-151,王强,我收到了您的邮件，但是发件人的邮箱地址是yangyu@chinamobile.com，为什么和您之前告诉我的不一样呢？,False
案例-151,杨玉,这是我们系统的邮件发送地址，您可以放心认证。请您点击邮件中的链接进行下一步操作。,True
案例-151,王强,我还是觉得不太对劲，我要先和移动公司核实一下。,False
案例-151,杨玉,很抱歉给您带来了麻烦，如果您有任何疑问，您可以拨打我们中国移动的客服电话400-10086咨询，谢谢您的合作。,True
案例-152,许女士,我通过短视频平台认识了一个男子，我们添加了微信并开始闲聊。,False
案例-152,男子,我们可以一起做投资，我有一些银行数据可以分享给你。,True
案例-152,许女士,哦，那听起来很有趣，我可以帮你登录投资。,False
案例-152,男子,太感谢了，我会引导你进行投资操作。,True
案例-152,许女士,好的，我准备了130000元用于投资。,False
案例-152,男子,非常好，我们开始吧。,True
案例-152,许女士,我提现了两次，一共提取了28443元，但现在无法正常提现了。,False
案例-152,男子,这是因为我们需要资金流水，只有这样你才能正常提现。,True
案例-152,客服,是的，你需要提供资金流水才能继续提现。,True
案例-152,许女士,我终于意识到自己被骗了。,False
案例-152,张女士,我们接到合作公司的电话，说需要开具发票。,False
案例-152,小红,然后我添加了对方的QQ，并被拉入了一个标注我们公司名称的QQ群。,False
案例-152,领导1,小红，把财务张女士也拉进群吧。,True
案例-152,领导2,我们需要她来参与讨论开票事宜。,True
案例-152,小红,好的，我马上拉她进来。,False
案例-152,张女士,他们在群内讨论了很久，最后要求我将账户余额98.6万元转到指定账户。,False
案例-152,真正的领导,张女士，你转账了吗？,False
案例-152,张女士,我意识到自己被骗了。,False
案例-153,诈骗者张宇,你好，我是张宇，你刚才接到的是我们的短信通知。我是某某银行的客户经理，我们发现您的银行账户中有些异常情况，需要进行核实确认。请您点击以下链接，进入我们的官方网站进行操作。,True
案例-153,受害者王小姐,啊，真的吗？我的银行账户有问题了吗？,False
案例-153,诈骗者张宇,是的，我们发现您的银行账户可能被黑客攻击了，为了保护您的资金安全，我们需要您提供一些信息进行确认。请您填写您的姓名、身份证号码和银行卡号。,True
案例-153,受害者王小姐,这样做安全吗？我可以去银行直接办理吗？,False
案例-153,诈骗者张宇,当然，您也可以去银行办理，但是由于近期疫情的原因，我们推出了线上核实服务，非常方便快捷。我们的网站已经通过特殊加密技术，保证您的信息安全。,True
案例-153,受害者王小姐,好吧，既然这样，我就填写一下吧。,False
案例-153,诈骗者张宇,非常感谢您的配合。请您填写完成后，我们的工作人员会立即开始核实您的信息，并对您的账户进行保护，避免资金损失。请问您的手机号码是多少？,True
案例-153,受害者王小姐,我的手机号是139********。,False
案例-153,诈骗者张宇,非常感谢您提供的信息。我们会尽快核实，请您耐心等待。如有疑问，您可以拨打我们的客服电话咨询。一般核实时间为24小时内，请您留意来电。祝您生活愉快！,True
案例-153,受害者王小姐,好的，谢谢你们的帮助。,False
案例-154,受害者,我最近接到了一条奇怪的短信，说我中了什么奖品，需要添加联系方式，这是真的吗？,False
案例-154,诈骗者,你好，很抱歉打扰了。恭喜您中奖了！确实是真的，我是活动的工作人员，请问您想要领取奖品吗？,True
案例-154,受害者,真的吗？那我需要做什么才能领取奖品呢？,False
案例-154,诈骗者,您只需添加我的微信号，并通过微信进行核对信息就可以了。,True
案例-154,受害者,好的，我添加你的微信号了，现在怎么办？,False
案例-154,诈骗者,非常感谢您添加我的微信号。为了核对您的信息，请您提供您的银行账号和身份证号码。,True
案例-154,受害者,这些个人隐私信息不太安全吧，你可以通过其他方式核对吗？,False
案例-154,诈骗者,非常抱歉给您带来困扰，我们需要核对您的信息才能领取奖品。这是我们公司的规定，请您谅解。,True
案例-154,受害者,好吧，那我告诉你我的银行账号和身份证号码。,False
案例-154,诈骗者,非常感谢您提供信息。您的奖品已经准备好了，但由于邮费需要您支付，请您尽快转账到我们提供的账户。,True
案例-154,受害者,转账？我觉得这有点不对劲，为什么要我支付邮费呢？,False
案例-154,诈骗者,邮费是必须支付的，没有支付邮费无法寄送奖品，这是我们的规定。,True
案例-155,许女士,通过短视频平台认识了一名男子，两人添加微信并闲聊起来。,False
案例-155,男子,你好，我在这个投资平台上发现了一些潜在的机会，不知道你是否有兴趣了解一下？,True
案例-155,许女士,是什么样的机会？,False
案例-155,男子,我有一些独家的银行数据，可以帮你进行投资。你只需要帮我登录投资，就可以赚取巨大的利润。,True
案例-155,许女士,可是这样安全吗？我需要提前了解一下风险。,False
案例-155,男子,放心吧，我已经成功帮助许多人赚取了丰厚的回报。只要你按照我的指示操作，不会有任何问题。,True
案例-155,许女士,好吧，我愿意试试看。,False
案例-155,男子,非常好，你只需要将130000元转入这个账户，然后我会帮你进行投资。,True
案例-155,许女士,我已经转账了。,False
案例-155,男子,非常感谢你的支持。现在，你只需要提供一些资金流水，我才能帮你顺利提现。,True
案例-155,许女士,为什么还需要资金流水？,False
案例-155,男子,这是银行规定的步骤，你放心，我会保证你的资金安全。,True
案例-155,许女士,那好吧，我提供给你资金流水。,False
案例-156,刘先生,【ETC官方】重要通知，您的ETC处于禁用状态，请于10月20日前点开www.idtz.top解除，否则将影响出行。,False
案例-156,刘先生,自己的确好久没开车出行了，不免有些担心自己的ETC真的被官方禁用。,False
案例-156,刘先生,点击了短信中的网址链接，跟着提示一项项地输入身份证号、银行卡号码及密码、手机号码等个人信息。,False
案例-156,刘先生,收到了来自银行的本人操作确认验证码提示。,False
案例-156,骗子,请您将验证码输入完整以完成验证。,True
案例-156,刘先生,认为认证完成时，接连收到了三笔999.99的银行卡转账提醒。,False
案例-156,刘先生,赶紧思考这是怎么回事，马上想到刚才的认证操作。,False
案例-156,刘先生,反应过来后立即向银行打电话进行求证，确认自己遭遇诈骗后，立即报警求助。,False
案例-157,诈骗者,你好！我是银行客服，请问您最近在网上有办理贷款吗？,True
案例-157,受害者,啊，是的，我最近确实在网上申请了贷款。,False
案例-157,诈骗者,非常抱歉，我们发现您的贷款申请遗漏了一些手续费，需要您尽快补齐。,True
案例-157,受害者,哦，手续费是多少？我立刻处理。,False
案例-157,诈骗者,手续费共计500元，请您通过以下方式进行缴纳：银行卡转账或扫描二维码支付。,True
案例-157,受害者,好的，我会立即转账给您。,False
案例-157,诈骗者,非常感谢您的配合，请将转账完成后的凭证截图给我，以便我们进行确认。,True
案例-157,受害者,好的，我会尽快操作并发送给您。,False
案例-157,诈骗者,非常感谢您的合作，我们会尽快为您办理贷款。,True
案例-158,李明,你好，请问是刘先生吗？我是某某保险公司的李明，想和您聊一下我们公司的一项很优惠的保险业务，您有时间听我介绍吗？,True
案例-158,刘先生,啊，你好！是的，我是刘先生。确实有点忙，但是也可以聊一下。你可以简单介绍一下这个保险业务吗？,False
案例-158,李明,非常感谢您的配合。我们公司最新推出的保险产品，覆盖范围广，保险金额高，保费也很实惠。您只需要提供一些个人信息，就可以购买到超值的保险，还能享受到额外的优惠哦。,True
案例-158,刘先生,这听起来确实不错，但是我还需要了解一下具体的保险项目和价格才能做出决定。,False
案例-158,李明,当然，我可以发给您我们的官方网址，您可以在上面详细了解我们的产品和价格，还可以通过在线咨询来获得更多信息。,True
案例-158,刘先生,好的，那你可以发给我吧。,False
案例-158,李明,非常感谢您的支持。我已经向您发送了一条短信，里面包含了我们的官方网址，您可以点击链接查看。,True
案例-158,刘先生,好的，我会尽快查看。谢谢你的帮助！,False
案例-158,李明,不客气，如果您有任何问题，都可以通过网站上的在线咨询或客服热线联系我们的工作人员。,True
案例-158,刘先生,好的，我会注意的。谢谢你的提醒。,False
案例-158,李明,再次感谢您的合作。希望您能考虑购买我们的保险产品，祝您生活愉快！,True
案例-158,刘先生,好的，我会考虑的。谢谢你的祝福！再见！,False
案例-159,李明,你好，请问你收到了我的短信吗？,False
案例-159,张丽,是的，我收到了。你是哪个单位的？,False
案例-159,李明,我是来自保险公司的，我们最近有一个新的保险产品非常适合您，您有兴趣了解一下吗？,True
案例-159,张丽,保险产品？我对保险不太了解，你能给我详细解释一下吗？,False
案例-159,李明,当然可以。我们的保险产品可以提供全面的保障，包括意外伤害、医疗费用以及其他突发状况。您只需支付一定的保费，就可以获得相应的保障。您可以享受到保险赔付的安全感，并且为您的家人提供一个安心的未来。,True
案例-159,张丽,听起来不错，但是我需要考虑一下。你有官方网站或者其他途径可以核实你的身份吗？,False
案例-159,李明,当然，我们公司的官方网站是www.insurancecompany.com，您可以在网上搜索到相关的信息。另外，您可以致电我们的客服热线来进一步核实我的身份。,True
案例-159,张丽,好的，我会去查一下。谢谢你的提醒。,False
案例-160,受害者,你好，这条短信上说我中了一个大奖，需要提供一些个人信息进行核实，我想确认一下是真的吗？,False
案例-160,诈骗者,您好！是这样的，您确实中了一项大奖，我们需要核实您的个人信息以确保奖金安全。请提供您的姓名、身份证号码、银行卡号等信息。,True
案例-160,受害者,我还是有些怀疑，这么多个人信息是否安全呢？,False
案例-160,诈骗者,您不用担心，我们是一家正规的机构，绝对会保护您的个人隐私。您可以放心提供相关信息。,True
案例-160,受害者,好吧，我提供一下基本信息。,False
案例-160,诈骗者,非常感谢配合！请再提供一下您的银行卡密码以便核实资金账户。,True
案例-160,受害者,这个信息我可不敢提供，这太敏感了。,False
案例-160,诈骗者,抱歉，这是我们流程中的一个环节，为了确保您的奖金能够顺利到账，请您再次确认。,True
案例-160,受害者,我还是不太确定，对于这一步我无法配合。,False
案例-160,诈骗者,好的，我理解您的疑虑。请问您有支付宝吗？我们可以通过支付宝进行资金核验。,True
案例-160,受害者,我并没有支付宝账号。,False
案例-160,诈骗者,非常抱歉，我们目前只接受支付宝的核验方式。如果您填写支付宝信息，将能更快地领取奖金。,True
案例-160,受害者,这种要求我还是无法满足，我认为这个活动可能存在问题。,False
案例-160,诈骗者,非常遗憾您无法参与，祝您好运。,True
案例-161,诈骗者,您好，我是ETC卡的客服人员，请问您遇到了什么问题吗？,False
案例-161,陈女士,我收到了一条提示我的ETC卡被禁用的短信，需要登录网页操作。,False
案例-161,诈骗者,非常抱歉给您带来了困扰。请问您点击了什么链接并输入了什么个人信息？,False
案例-161,陈女士,我点击了链接后，打开的页面看上去没什么问题，然后按照提示输入了手机号、银行卡号等信息。,False
案例-161,诈骗者,非常感谢您提供的信息。系统会自动记录下来以便进行操作，不用担心。,False
案例-161,陈女士,但接下来我收到了六条扣款短信，每条短信都扣了一笔钱。,False
案例-162,邓先生,根据您良好记录已为您提供12万，点击链接（http://yiguahui.com/bdhS）。,True
案例-162,骗子,您好，我是中原消费金融的客服，您点击链接下载了我们的APP，我看到您申请了贷款，请问有什么问题我能帮助您解决吗？,False
案例-162,邓先生,我点击链接下载了贷款APP，但是贷款一直没有到账，非常着急，请问还需要多久？,False
案例-162,骗子,非常抱歉给您带来了困扰。可能是由于您填写的银行卡号有误，导致资金冻结。为了解冻贷款款项，请您缴纳10000元保证金。,True
案例-162,邓先生,哦，那我需要怎么操作呢？,False
案例-162,骗子,您需要将10000元保证金转账到指定账户，并将转账凭证发送给我确认。保证金将和贷款一起返还给您。,True
案例-162,邓先生,好的，我知道了。请告诉我收款账户和详细操作步骤。,False
案例-162,骗子,您将保证金转账到XXXX账户，转账成功后请将转账凭证发送给我确认。,True
案例-162,邓先生,好的，我已经转账了，请查收。,False
案例-162,骗子,好的，我已经收到您的转账，请再次确认一下您的银行卡号，以便我们再次转账给您。,True
案例-162,邓先生,我的银行卡号是XXXX，请尽快处理。,False
案例-162,骗子,好的，我已经收到您的银行卡号。由于操作超时，请再次转账60000元，以便我们能及时处理您的贷款。,True
案例-162,邓先生,什么？60000元？我已经转了这么多钱了，为什么还需要继续转账？,False
案例-162,骗子,非常抱歉给您造成困扰。由于资金间接转账的限制，我们需要您再次转账以确保贷款能顺利到账。,True
案例-163,诈骗者,你好！我是国家医保局的工作人员，请问你是张小姐吗？我们发现您名下的医保已停用，请立即进入我们的官方网站申换电子版使用，以免影响您的医疗保障。,True
案例-163,受害者,什么？我的医保停用了？为什么？,False
案例-163,诈骗者,不用担心，请放心，我们只是需要您的一些个人信息进行核实。您只需要点击下方的链接，按页面提示填写您的身份证号和银行卡号，就可以重新激活您的医保账户了。,True
案例-163,受害者,哦，这样啊。但是我觉得有些不放心，请问您能提供一些更多的证明吗？,False
案例-163,诈骗者,当然可以，您可以看到链接跳转的页面和我们国家医疗保障局官方网页非常相似，这是我们专门为您提供的方便快捷的服务。只要您填写正确的信息，您的医保账户将会立即恢复正常。,True
案例-163,受害者,好的，我明白了。我现在就去填写。,False
案例-163,诈骗者,非常感谢您的合作，请尽快完成填写，以免影响您的医疗保障。,True
案例-164,诈骗者李明,你好，我是李明，我是一家银行的客服经理，我注意到您的银行账户有可能存在安全问题。,False
案例-164,受害者刘婷,啊，是吗？我怎么不知道有什么问题呢？,False
案例-164,诈骗者李明,您的账户信息可能已经泄露了，我们需要确认您的身份，请您提供一下个人信息。,True
案例-164,受害者刘婷,哦，那这么严重吗？但我之前没有接到过银行的通知。,False
案例-164,诈骗者李明,是的，这是我们内部调查，为了保护您的账户安全，我们需要您提供姓名、身份证号码和银行账号。,True
案例-164,受害者刘婷,嗯...这样可以吗？我觉得有点不放心。,False
案例-164,诈骗者李明,您放心，我们是合法机构，为了验证身份，我们需要您提供这些信息，并进行确认。,True
案例-164,受害者刘婷,好吧，那我就告诉您，我的姓名是刘婷，身份证号码是310************，银行账号是****1234。,False
案例-164,诈骗者李明,谢谢您的配合，我们将会对您的账户进行安全认证，请您不要向他人透露这些信息。,True
案例-164,受害者刘婷,好的，我会注意的，谢谢您的关心。,False
案例-164,诈骗者李明,不客气，我们会尽快对您的账户进行安全处理，保护您的资金安全。,True
案例-164,受害者刘婷,好的，谢谢您的帮助。,False
案例-165,李先生,赵先生，好久不见啊，有什么事情吗？,False
案例-165,赵先生,嗨，李先生，是这样的，我有一件私事需要你的帮忙。,False
案例-165,李先生,什么事情？有什么我可以帮忙的地方吗？,False
案例-165,赵先生,我有个亲戚是领导，他需要转一笔汇款。因为他的账号出了点问题，所以麻烦你帮我转一下。,True
案例-165,李先生,汇款金额多少？,False
案例-165,赵先生,金额是10万元，希望你能帮我。,True
