标题,标题链接,首页缩略封面图,首页缩略文段,发布者,文章正文内容,图片链接
天桥岭森林公安破获系列诈骗案，揭开婚恋“杀猪盘”背后的骗局,https://so.toutiao.com/search/jump?url=http%3A%2F%2Fwww.toutiao.com%2Fa7299981640967701027%2F%3Fchannel%3D%26source%3Dnews&aid=4916&jtoken=e5cb68446a79ba5d6b844e3a2da048e7994223a984796ea057d0c9ab56470ef08798811d98a46d09184b74d160049ebc75e3e0bb0547e998db300d85159e3ff9,https://p3-sign.toutiaoimg.com/tos-cn-i-6w9my0ksvp/5dbae741dd83472896137a9ca1be3f5e~tplv-26tn0yjwph-cspd-v1:450:294.jpg?_iz=102390&from=search&x-expires=1708387200&x-signature=Yx%2BhrMWi%2FOUVFPRkBC8rAWFYA5g%3D,"累计冻结被骗资金7.9万元、追缴被骗款2万元,扣押涉案手机3部、电脑2台,抓获网逃2名、采取刑事强制措施4人,破获关联案件3起。 轻信甜言蜜语,一女子投...",吉报调查,"吉林省公安厅森林公安局天桥岭森林公安分局在开展破案攻坚会战中，始终对电信诈骗违法犯罪行为保持高压态势，历时一个月，辗转黑龙江省、上海市、重庆市，成功破获系列诈骗案，冻结帐户3个，累计冻结被骗资金7.9万元、追缴被骗款2万元，扣押涉案手机3部、电脑2台，抓获网逃2名、采取刑事强制措施4人，破获关联案件3起。

轻信甜言蜜语，一女子投资被骗

10月6日，天桥岭镇居民刘某报警称，9月初，其在一个相亲网站上填写了个人信息，9月17日，一个名叫李某洋的人通过短信与其交流，并以自己在部队不方便使用微信为由，让其下载了“手伴”聊天软件，在聊天过程中，对方以投资股票理财能赚钱的名义，让其三次转账33万元。之后发现联系不上对方，并且投资理财的网站无法登陆，才知被骗。基于案情重大，分局党委立即召开侦查部署会，相继制定断卡、断流、打击黑灰产侦查工作方案，通过国家反诈大数据研判，立即锁定一级卡主电诈账户，犯罪嫌疑人为黑龙江省大庆人李某晶。

侦查员连夜对接当地市局反诈部门，为确保涉案电子数据信息完整，侦查员采取传统工作方法，对电信诈骗账户开户、使用人李某晶进行了调查，确定活动轨迹。采取以车找人的方式，将犯罪嫌疑人李某晶抓获归案。

深挖线索，被害人变成嫌疑人

案发后，民警对案件进行科学研判，从银行账号、聊天软件等线索入手，深挖扩线，经过大量工作，发现诈骗分子经网络相亲选择多位目标对象后，以情感煽情为饵，先期诱惑对方协助其打点理财至深入诱导对方投资理财，对有经济实力者、即引诱投资成为培养被骗的目标“猪仔”；对没有经济实力者，即利用其合法的身份和账户，在其因“情”而主动自愿协助理财的情况下，对选定的""猪仔”投资款进行转账、取现完成诈骗，并以现金汇款的方式购买数字货币，成为诈骗分子洗钱的积极帮凶。

诈骗分子这种“骗”“洗”均由相亲对象间完成的新型连环犯罪模式，不仅犯罪隐蔽性强、更严重违背了社会公德，对被骗者及帮凶均造成了多重伤害，社会危害性极大。上海人赵某某就是其中之一，10月22日，犯罪嫌疑人赵某某在上海市被抓获归案，其由一名相亲被骗者真实地演变成了一名犯罪嫌疑人。8月28日，赵某某因网络相亲，进行数字货帀交易被骗巨额财产后，为尽快“挽回”损失，便更新因被骗而学来的数字货币的经营模式，以身试法，采取更加隐蔽的洗钱方式—利用第三方平台收支U币款，从中牟利，为诈骗赃款进行数字货币洗钱，转账资金累计近300万元、现已核实被骗款23万元。

循线追踪，再添战果

随着侦查信息的不断更新和深入，诈骗分子利用网络相亲对象和与数字货币交易的黑灰产U商相勾结，连环完成诈骗资金的多层洗钱，最终实现U转币的犯罪闭环结构愈显清晰。分局党委要求跨省侦查员循迹追踪，务必打掉黑灰产U商。10月13日，在黑龙江省开展工作的侦查员并案侦查，与云南省文山县公安局建立协同作战机制，针对重庆市疑似U商洗钱的高某某、杨某某展开研判，两名犯罪嫌疑人相继在重庆市落网。

落网后，犯罪嫌疑人因早有防范、并已毁灭证据百般狡辩，侦查员在支离破碎的电子数据信息中，检索出犯罪嫌疑人百密一疏而遗留下来的涉案信息，最终通过客观证据认定犯罪嫌疑人高某某、杨某某的犯罪事实：该二人分别于9月至10月期间，为了牟取利益，明知他人所汇之款会是违法所得，仍采取非实名账号、更换账号、场外交易、删除信息及“话术”等规避调查的方式，进行高卖低买数字货币交易，致使多名电信诈骗被害人的被骗款转入其银行账户内，掩饰、隐瞒了被骗款的性质及去向，严重影响了司法机关查明犯罪事实的正常活动。针对二人涉案主要情形，犯罪嫌疑人高某某、杨某某均被采取强制措施，由两地警方分别押解归案，核实被骗资金累计27万元。

11月9日，犯罪嫌疑人杨某某由重庆市被押解至天桥岭森林公安分局，案件正在进一步侦办中。

吉林日报社出品

作者：延长才 程启昌 刘博文 吉林日报全媒体记者 吴茗

策划：韩雪洁

执行主编：于悦

编辑：吴茗",https://p3-sign.toutiaoimg.com/tos-cn-i-axegupay5k/0eb734aea515436b8e6f12abd6d55f03~noop.image?_iz=58558&from=article.pc_detail&lk3s=953192f4&x-expires=1700278693&x-signature=u7IMGppSHufcOsyOasS2lDKW2PA%3D
新型“杀猪盘”出现，不少人被骗,https://so.toutiao.com/search/jump?url=http%3A%2F%2Fwww.toutiao.com%2Fa7299052274776031756%2F%3Fchannel%3D%26source%3Dnews&aid=4916&jtoken=e5cb68446a79ba5d6b844e3a2da048e721391fcccd5a7ac5be4aa8c5d6ff2a733740892c3e3caca445a1b343ff643e7b58bbaeacc4c2161bbce30b917dde5a17,https://p3-sign.toutiaoimg.com/tos-cn-i-6w9my0ksvp/a93431a3f62044bebc3b5579de144b6d~tplv-26tn0yjwph-cspd-v1:450:294.jpg?_iz=102390&from=search&x-expires=1708387200&x-signature=jqZIVXYwUC7WCtGCCLhZAvG%2F1E8%3D,大多数受害者认为这是专门针对网络诈骗团伙而设计的骗局。 受害人在中鑫黄金APP购买的黄金 黄金低于市场价值 29岁的安徽女孩吴丹也算是中鑫黄金App的...,无双奶酪f1P,"本文素材来自网络。如有不准确或违规内容，请联系我们删除。




在玩金的同时，数百名年轻人被骗：有人增加了信用卡，有的家庭负​​债过百万。

大河报·于视频记者刘永恒

2023年10月23日晚，深圳清湖派出所的电话连续响起，数百个报警电话从全国各地打来。报警的人身份不同、口音不同，但都说着同样的话：他们在网上购买的黄金还没有送达，催收机构也失去了联系。他们被欺骗了。

失踪的公司是深圳市中鑫城投资有限公司。中新投资（简称中新投资），注册地址位于深圳市龙华区。 9月份以来，该公司一直在应用内限量销售黄金，价格比市场价格低20元左右。

这款名为中鑫黄金的应用程序主要销售金银珠宝产品，已导致数百名“买家”蒙受巨大损失。大多数受害者认为这是专门针对网络诈骗团伙而设计的骗局。

受害人在中鑫黄金APP购买的黄金

黄金低于市场价值

29岁的安徽女孩吴丹也算是中鑫黄金App的忠实用户。他从9月17日开始通过该应用程序购买黄金，一直持续到10月19日。

起初他只买了10克。货到了，他去金店查看货品，发现确实是金子。我把它卖了，得到了将近200块钱。当货物到达时，接下来的 20 克被释放。这次我拿到了400元。因为他在安徽四线城市做保险公司，所以比较容易拿到。从此，吴丹一发不可收拾。

第一个月，限制他通过转售赚钱的能力是销售和购买的限制：销售只在晚上 10:00 和 8:00 开放。一天的货量只有100、200个。拿单是个技术活，慢的话可能拿不到。 ；第二个限制是每个账户每天最多可以下两个订单。

从去年开始涉足网络游戏的吴丹非常​​清楚，这种促销可能不会持续太久。在抢购期间，他发现通过参加预售，他可以下几个订单。 10月18日和19日，吴丹和华北拿出四张信用卡，又借了几十万，并请表兄弟帮忙购买。加上姐姐的8000多元，她总共花了334071元购买了760克黄金。

等黄金到了，卖掉，他至少能赚到12000元。但这一次，吴丹失算了。

10月23日，中鑫黄金App的主动客服变成了自动回复。最初发布折扣信息的人没有回复该消息，他创建的微信群也在当天下午解散。让吴丹害怕的是，他掏出的760克黄金至今无人认领，也没有人愿意尝试归还。当天晚些时候，一名淘金者引诱他加入联络小组：每个人的情况都一样。有人定期加入联络小组。这些人来自全国各地，有着同一个品牌——“想买东西的人”。

深圳警方将此案称为“10.23诈骗案”。

10月23日，有人查到了中鑫投资法定代表人范某某的电话号码。一名年轻男子联系了范某某，半夜看到了她，拍了视频发在群里：两人出现在一张照片中。范某某用带有四川口音的普通话对着镜头许诺：“我们也在，我理解大家的心情，这两天我一定会为你们承担。”年轻人拿出手机，对着镜头补充道：“我今天看到了自己，他们说明天就给我们发货。”

案发当晚，视频截图中，涉事众鑫投资公司法人范某某承诺与受害人解决问题。

那些放贷并拿钱的人

购买了640克黄金的徐克看到这段视频，轻轻叹了口气。

他可以算是一个半职业的“骗子”。 “只要有钱，一个月就能赚一万元。”

这次，他花了近30万元购买黄金。如果拿不到这个金杯，他不仅要花光所有的积蓄，还要负债数十万。

7月24日下午，仍未有人送出黄金。徐克开始给范某某打电话，直到第六通电话才接通。当时范某某刚刚下飞机。他说他刚到深圳，准备去工厂。两个半小时后，范某某的电话无人接听。

晚上，徐克一到工厂就得知警方已将范某某带走询问。

一段警方前往嫌疑人商户调查的视频很快就在微信群中发布。视频中，中信投资公司几个人正在工作，办公区周围散落着成堆的空箱子。

看到视频的所有人都无法抑制愤怒。当天，微信交流群里有人设置了纸牌来计算黄金的总价。参与接龙活动的有103人，来自全国20多个省市，共购买黄金19120克。按购买时每克440元的单价计算，涉案金额超过800万。

全职在家四年的周岩，因为从未入群而错过了这次接龙活动。 24日，经与几名同样购买黄金的“丈夫”协商后，五人连夜前往深圳报案。群里，周艳购物次数最多，消费金额约46万元，动用了全部资产，并使用了一张价值超过30万元的信用卡。

10月25日上午，吴丹抵达清湖派出所。当天早上，就有三十、四十人前来报案。

上午11点，吴丹收到立案通知。上面只有两行字：10.23诈骗案，我局认为符合立案条件，已立案侦查。它内容丰富。他用铅笔在空白处清楚地写下了自己的债务：吴丹（个人）241669元，表弟（人）83585元，姐姐（人）8817元。

一些没有去深圳的受害者要求群里的人报案。

下午，吴丹帮联系人提交了报告。 “家人给三个孩子买了88万元，出事后，他情绪大变，有自杀倾向，家人不敢放过他。”我来深圳报案是因为怕出事。我现在不敢丢下他一个人，因为他妈妈24小时看着他。”

在清湖派出所，吴丹和周岩都对那天的父子印象深刻：一个50多岁的男人，与年轻人的一群人格格不入。此案涉案父子俩涉案金额达180万余元。 “他们把房子都卖了。”周延说。

事实上，受害人借钱偷钱的现象屡见不鲜，有的家庭涉案金额超过百万元。

11月2日17时，受害人发起的通讯群已有306人。她们有着不同的身份，有母亲、有学生、有上班族、有自由职业者。几乎所有人都是年轻人。

一个复杂的骗局

事件发生后，受害人在调查过程中遭遇先令：今年3月和4月有不少人成为攻击目标。

微信上一个叫晶晶的人也出现在广东珠海李青夫妇和吴丹的好友名单中。晶晶今年5月就加了吴丹好友。在此之前，他们参加了一个性咨询小组。

称为通知的组位于在线购物链的顶部，通常由卖家完成。在分析了各个电商平台的需求活跃度，找到了如何低价购买商品后，他会写一篇教程，一起举报到网上群里，让找货的人可以自由判断，或者抓捕。货物与否。本课程是“非正式报告”。

网上报道群里，经常有“收藏家”，互相帮助成为朋友，谈论利润，比较其他报道。几次分享信息后，吴丹将安静视为自己的玩伴。

7月2日，安靖给吴丹发来黄金，“有一辆专车，利润300元，你要晚上7点进车吗？”购物圈中的“自主汽车”是指除了热门电商平台和各大品牌官方渠道之外的小范围区域。吴丹并不理解这种“专车”。但李青夫妇追了上来，接了单，货到了，查货了，卖了，还小赚了一笔。

9月11日，李青的妻子再次阅读了安静发来的黄金提示后，毫不犹豫地通过苹果商店下载了中鑫黄金APP，开始购买黄金。昨天事发前，两人还下了单拿金。

大多数受害者都有与吴丹、李青相同的经历。事实上，三月初就有人和这个孩子成为了朋友。 10月23日，护理人员完全失去联系。“骗局的作案者对卖货非常熟悉，为我们准备了很长时间，几乎就像一盘杀猪一样。”李峰在评判大河日报记者·鱼视频《看见》时说道。

李峰经营着一个在线举报小组，并开设了一家销售电子产品的网上商店。这次，他不仅成为诈骗受害者，还在群里发布有关中鑫黄金的提示，导致不少人上当受骗。

抢走黄金的受害者微信支付单

失窃物品追回工作正在进行中

案发后，受害人在通讯群中查明了该骗局的主要实施者。

此前，在受害者收到的通知中，低价出售的商品大部分是在汇联优品商城小程序中销售。

该小程序的开发公司是深圳市汇联优品网络科技有限公司，也是中鑫金App的开发公司。法人叫卢，同时也是中信投资公司的监事。

毫无疑问，卢某和上述范某是这起诈骗案的核心人物。

10月24日，范某某被带到派出所询问，但始终没有找到吕某某。当晚，在通讯群中，一名受害人拿走了卢某的电话号码和微信账号，希望能帮助警方找到卢某。

徐克是执行官。他冒充范某某尝试添加微信账号。他认为吕某某并不知道范某某已被警方控制。好友请求于25日上午获得批准。徐克称自己被警方通缉，并告诉陆某一个计划。

陆这样的人，并没有半点怀疑。他只是说：“我被你骗了，一分钱都没拿到，现在还怪我。”他还指责徐克冒充范，“成都办事处的人呢？你让我这么做的时候不是说很有信心的吗？”

不过，徐克并不知道陆的具体位置，更不知道所谓的“成都总部”的位置。他整理了聊天记录，将谜题交给了警方。

10月29日，10.23诈骗案官方与受害人协调处理：该案3人被羁押，1人被网络起诉。三个追赃组赴福建等地调查。

11 月 1 日，官员告诉一名受害者，可用资金不多，其他地方的逮捕仍在等待中，目前还没有逮捕任何人。

11月2日，清湖派出所一名工作人员告诉大河日报·雨视频《看见》，警方还在收集统计遇难者信息，“因为有数百人，统计需要很长时间。”清湖派出所还启动10.23工程专项呼吁，引导受害人向警方发送相关信息。

记者注意到，11月2日17时，中鑫金App仍可在苹果商店下载。

再过几天就是吴丹信用卡的还款日了。

吴丹告诉记者：“我还有一辆小车，准备卖掉，我会问一下价格，如果不够的话，我会贷款支付。”我目前正在找一份兼职工作，如果找不到，我就去送外卖。 ”

此前，吴丹打算辞掉工作，去大城市做销售工作，但被姐姐阻止了。 “他害怕因为钱，再次伤害我。”

目前，深圳警方正在调查这起诈骗案。据受害人猜测，这起案件可能要等警方办完案后才能知晓。

温馨提示：如何避免网络诈骗？

首先，我们要记住，天上不会掉馅饼，不要相信网友所说的“稳赚不赔”、“价低物高”之类的投资。

其次，在投资高回报之前，请核实对方的身份，问问自己为什么他们会给你这么高的回报。这些高回报的背后往往是更大的骗局。

再次强调，投资有风险，理财需谨慎！请认准银行、合格保险公司等官方渠道，不要相信外国人推销的投资应用。

最后，如果您不小心被骗或遇到可疑情况，请保护证据并立即拨打110或当地派出所咨询。

（应受访者要求，文中吴丹、李青、周岩、徐克等均为化名）

来源：大河日报·喻视频编辑：刘慧杰




免责声明：以上内容及信息均来自网络。本文作者无意针对或提及任何国家、政治制度、组织、部落或个人。相关数据和理论研究均基于网上资料。以上内容并不意味着本文作者接受法律法规、文章的观点和行为并对其相关信息的真实性负责。本文作者对上述或相关事项产生的问题不承担任何责任，也不承担任何直接或间接的法律责任。




若文章内容含有作品、版权图片、侵权、谣言或其他问题，请联系我们删除。最后，如果你对本次活动还有什么其他的想法，欢迎在评论区留言讨论！",https://p3-sign.toutiaoimg.com/tos-cn-i-axegupay5k/87f628bd12104de098d8b9ac8f890405~noop.image?_iz=58558&from=article.pc_detail&lk3s=953192f4&x-expires=1700278697&x-signature=Pr5MXfI1%2FLOBLh5x4DPPq1nMeT0%3D
