标题,标题链接,首页缩略封面图,首页缩略文段,发布者,文章正文内容,图片链接
【央视关注】“杀猪盘”骗走34万!宿迁一名受害人亲自阐述被骗全过程,https://so.toutiao.com/search/jump?url=http%3A%2F%2Fwww.toutiao.com%2Fa6952445592949817894%2F%3Fchannel%3D%26source%3Dnews&aid=4916&jtoken=e5cb68446a79ba5d6b844e3a2da048e7dea00ec864baf7ceb84f4e5788a9d4f855458ffe37d3ee367f68f4186c565d0f9f7070824841886ad5bbde282b66b808,http://p9-tt.byteimg.com/img/pgc-image/12c38c17dcdd48c5bf8f0f86d1186970~tplv-26tn0yjwph-cspd-v1:276:184.jpeg,"什么是“杀猪盘”?杀猪盘是指诈骗分子利用网络交友,诱导受害人投资赌博的一种电信诈骗方式。“杀猪盘”是诈骗团伙自己起的名字,是指放长线“养猪”诈...",江苏警方,"什么是“杀猪盘”？

杀猪盘是指诈骗分子利用网络交友，诱导受害人投资赌博的一种电信诈骗方式。“杀猪盘”是诈骗团伙自己起的名字，是指放长线“养猪”诈骗，养得越久，诈骗得越狠。

前不久，家住泗阳县的朱女士就遭遇到了这样的骗局，34万的积蓄被诈骗分子一卷而空。

很多人总认为电信诈骗离自己很遥远

“我又不傻，骗子怎么可能骗到我？”

而抱有这类思想的人最容易被骗！




请一定耐心看完！




2020年11月1日，家住泗阳的朱女士微信收到一条好友申请，本着交友的目的朱女士便同意了好友申请，从此一步步进入了诈骗分子为她精心设计的骗局！




对方一开始只是和朱女士闲聊增进感情，聊了几天之后就开始吹嘘他叔叔是国内某大型互联网公司高管，暗示朱女士有内幕消息，可以带着朱女士赚点零花钱。紧接着对方就把所谓还在“推广阶段”的APP“某某宝”二维码发给了朱女士，并要求朱女士识别二维码下载，声称因软件还未上市，所以利息高，等上市了就没这福利了。

起初，朱女士也是不相信的，骗子就说可以先投100元试试水。




“这100元投进去了，感觉还不错，100元一天的时间赚了5元多。”




这时候诈骗分子就开始蛊惑朱女士加大投资金额。因为起初的投资看到了“实实在在”的“回报”，朱女士就听信了诈骗分子的话，第二次投了1000元。




这笔1000元一天就让朱女士赚了60多元，此时的朱女士提现成功后，就觉得这事儿还挺靠谱的！在尝到了甜头之后，朱女士就加大了投资金额，这次一下子就投了5万元，原本朱女士想当天就提现的，可是被回绝了......




接下来诈骗分子就开始“飙戏”了，如果想要提现全部金额就必须再追加投资15万元！

此时的朱女士因急切地想要提现，再加上被骗子洗脑成功，相信这是大公司旗下的正规平台不会出问题，就不得不继续投资15万元。




本以为第二天就可以如愿地提现，连本带利的那种，谁知道诈骗分子还是说不可以提现！要求继续投资！并声称提现需要排队，或者缴纳插队费5万元！




朱女士终于感觉到不对劲了，来到派出所报警求助。接警后民警迅速开展案件侦查，通过研判分析，最终将嫌疑人抓获归案，并成功追回5万元现金，返还给朱女士。

下面我们一起来复盘！

受害人心理分析：

01

贪念

贪图高额回报，其实这只是“天上掉馅饼”的另外一种形式。再说，这么高的回报，“专家”们为什么要告诉你？

02

无知

对于新的投资理财概念一知半解，甚至不了解，只是听风就是雨。骗子开始会施以小利，抓大放小，让你无法自拔。

03

轻信

轻信网上的说辞，没有经过任何核实就草率汇款投资。

04

纠结

当受害人在虚假平台充值后，平台上会显示相应数额，但是不管你如何操作，都无法提现。如执意提现，将落入骗子设置的更大陷阱，难以自拔。

诈骗套路分析：

利用受害人想要投资赚钱的心理

很多受害人想要挣快钱，骗子通过利用受害人想要投资赚钱的心理，诱导受害人在虚假平台进行投资。

先以获取小额盈利加以诱惑

一旦开始投资，骗子会在投资平台里先让受害人盈利并且能提现出来，等完全取得受害人信任后会不断诱导受害人加大投资，再当受害人进行提现时，就会以账户资金显示异常、系统出错等原因诱使受害人继续充值或者双倍、多倍充值，直到平台登录不进去。

为什么无法提现？

一旦受害人投入大量资金投入后，平台就以各种理由拖延提现，诱骗受害人继续追加投资，此时受害者不继续投就直接亏，直到受害人无钱可投或意识到受骗，此时平台就会出现无法提现或者提现成功但资金未到账，直至平台无法登录等情况。

警方提醒

当遇到一些所谓的“投资大师”“网络好友”，以“高收益、内部消息、系统漏洞”等理由，指引你参与投资时，切忌盲目相信，务必再三核实对方身份和平台真伪，如遇诈骗，请第一时间拨打110向公安机关求助！

反诈的路还很长

需要你我共同参与

请务必转发给您的亲人、朋友、同事和其他周边的人看到

警民携手 全民反诈

有朝一日

定能终结诈骗！",https://p3-sign.toutiaoimg.com/pgc-image/0930b386a19942bb993c30c17441b81b~noop.image?_iz=58558&from=article.pc_detail&lk3s=953192f4&x-expires=1700279151&x-signature=CkpO1%2FJyBtx2hcFb06w9wppjss8%3D
“杀猪盘”骗局!教训惨痛…警方带你戳穿诈骗套路,https://so.toutiao.com/search/jump?url=http%3A%2F%2Fwww.toutiao.com%2Fa6755686920568701452%2F%3Fchannel%3D%26source%3Dnews&aid=4916&jtoken=e5cb68446a79ba5d6b844e3a2da048e793af740a47e2a70b6c5178c1eb63a558f60a472f69155214fdc5c1de03be7d24782dade5f70a641253e2fc144dbc621d,http://p1-tt.byteimg.com/img/pgc-image/RXIggMOJDfNSN0~tplv-26tn0yjwph-cspd-v1:276:184.jpeg,"后来我才知道被骗了。”胡晓遭遇的是“杀猪盘”诈骗的雏形。当事人在证券公司投资了一些股票和基金,犯罪嫌疑人先窃取当事人的信息,然后冒充的证券公...",海报新闻,"泰安小伙儿小顾大学毕业后，

在泰安开了一家餐厅，

餐厅不大却也红红火火。

但让他没想到，

如今的他却开始了

每天睁眼就得还钱的日子！

而且每个月要还好几万，

到底发生了什么？

投资46万获利82万

发财不是梦？

小顾说，这一切的变化是从一个短信开始的。“我接到一个短信说，白天吃你家的东西挺好吃的，想了解一下订餐。”

为了以后订餐方便，小顾就跟这位叫“星空”的顾客加了好友。从这个女孩的朋友圈里，小顾发现她是帮别人投资的，不仅她的客户赚钱，她自己每天也是几千几万的进账，这太让小顾动心了。

在“星空”的指导下，小顾在手机也下载软件，注册帐户，就开始投资了。“星空”说，这个平台是炒外汇用的，有漏洞，每人只能玩一次。即然只能玩一次，那就多投点，小顾一下子就往平台的帐户里打进了8万，“星空”没有骗小顾，在平台老师的指导下，第二天小顾就挣了9万。第三天，小顾的银行卡里竟然达到了72万。而这个时候，小顾才投了16万。

当小顾的盈利达到82万多元的时候，他觉得自己挣得够多了，想赶紧提现，可是这钱还是提不出来了啊？总说银行卡的信息不对，这怎么可能呢？小顾赶紧联系“星空”，“星空”说想提钱，要修改银行卡信息，操作费16万。总之，小顾一共往平台上投资了46万，而无论是投的钱还是赢利的钱就是取不出来。

都说当局者迷，小顾这个时候才意识到自己被骗了，可是等他再联系“星空”时，发现自己已被对方拉黑，而那个投资平台也再也登录不上去了，钱没影了。小顾赶紧去报了案，民警告诉小顾，他遭遇了“杀猪盘”骗局。

小顾说，46万多元有十几万是自己的存款，工作好多年，辛苦攒下的钱。还有30多万，都是网络借贷，信用卡套现的渠道来获得的，每天光手续费就好几百快钱，每个月还要还12万元。

啥叫“杀猪盘”？

其实“杀猪盘”骗局早就存在，而且近年来在电信诈骗的各种骗局中，比重也在逐渐增多。

杀猪盘是我们原来网络交友的诈骗手段演变出来的一种精准的诈骗手法，在网络交友的前提下骗取当事人的信任，进而让当事人投资网络赌博进行诈骗当事人的一种诈骗方法和手段。

可能有的小伙伴是头一次听说

“杀猪盘”这个词！

但上当受骗的人，

可不止小顾一人啊！

“杀猪盘”再出江湖

“温柔陷阱”让你人财两空

胡晓是个上班族，平时也炒股。今年年初，胡晓接到一个电话，电话那头的人自称是炒股平台的客服经理。“他说我投资多，可以给我提送到VIP服务，我想还有这么样的好事儿，他就给我拉到了一个微信群里。他说，这个群里面有老师指导，还给我推荐了一个投资平台，叫顶峰外汇投资管理平台。”

按照客服经理的说法，这个投资平台可以24小时操作，投资1万，能当100万本金使用。观察了一段时间后，胡晓就往这个平台投资了1.2万，在平台上就直接变成了120万。随后又根据QQ群里老师的指导，投资了一支股票。“就想多赚一些，投了一笔大的，70多万。那个平台就交易不了了，群里也没人说话了，我的钱也提不出来了，那个群我还被踢出来了，后来我才知道被骗了。”

胡晓遭遇的是“杀猪盘”诈骗的雏形。当事人在证券公司投资了一些股票和基金，犯罪嫌疑人先窃取当事人的信息，然后冒充的证券公司的客服人员对当事人进行回访，同时要求他们加入一些股票交流群，然后冒充财经专家对当事人进行诈骗。

同样受骗的还有沈阳的小林。小林在交友软件上认识了一个女孩子，这个女孩子善解人意，对从未谋面的小林关怀备至，两人很快确定了恋爱关系。随后，这个女孩子给小林推荐了一款软件。“她告诉我说，投1万块钱，几天之后就可以返回来3万，之后我就照着她指示去做了。”

1万投进去，第二天，小林在软件里的帐户里就进了2万，可是当小林想把3万块钱一起提出来时，女孩子却告诉小林帐号被冻结了。“必须让我充值10万元才可以提出来，充完VIP之后，系统有异常。就一直引导我继续充值，最后我觉得这个事情不对，然后就报警了，一共投了50多万元。”

这种以情感入手进行诈骗的骗局，正是所谓的“杀猪盘”骗局。

“杀猪盘”分四步

内心强大防套路

2019年，“杀猪盘”已经成为全国受骗金额最大的诈骗类型，无数人被骗后痛不欲生、负债累累，甚至自杀。而由于嫌疑人基本都在东南亚等地，警方侦办面临重重困难，唯一避免被骗的办法就是及时识别骗局。

“杀猪盘”骗局关键词

婚恋、投资软件、赌博软件、漏洞

“杀猪盘”骗局其实是有迹可寻的，也就是说，嫌疑人在实施诈骗时是有步骤的。

第一步 取得被害人信任

犯罪嫌疑人在一些交友软件上添加好友，和对方聊天，处男女朋友，经过长期的网聊取得彼此信任，之后对方会声称熟悉一些赌博网站或者投资平台，并了解这些平台或者网站有漏洞，可以投小钱挣大钱，可以在家躺着赚钱。在这交流的过程中，被害人很快对嫌疑人产生信任。

第二步 怂恿被害人投资

犯罪嫌疑人要求当事人前期投入一些小金额的资金，前期在数据上看平台上可能会体现出盈利的状态，这个时候对方就会要求当事人进行大额的资金的投入。

这种骗局之所以叫“杀猪盘”，是因为之前建立信任的这个过程，犯罪嫌疑人叫做“养猪”的过程。而之后就是要“杀猪”了。

第三步 怂恿被害人大量投入

要求当事人把自己所有的资产或者房产抵押变现，甚至进行贷款，一旦骗光所有的钱，更有甚者，还会要求当事人去进行一些网络的贷款追加赌注。

第四步 被害人无法提现

其实当被害人在投资的过程中，很多被害人是想把帐户里的钱提现的，可是嫌疑人就编造会种种原因让被害人无法提现，而当嫌疑人确定被害人再没有向嫌疑人提供的平台帐户打入资金的能力后，犯罪嫌疑人就会彻底消失了。所有的被害人都不知道，其实所谓的平台也好，客服人员也罢，都是犯罪嫌疑人提前设计好的，平台更是假的。为了完成这一整套骗局，犯罪团伙，分工明确。

警方提醒

1、提高警惕小心防范，不要让犯罪嫌疑人钻了感情的空子。2、对于那些只存在于虚拟聊天软件中的人，不管是谁，只要对方说到关于“跨国”“博彩软件”“投资平台”“系统漏洞”等关键词，那就要提高警惕。

3、挣钱是假，利用软件控制后台，操控“中奖”概率，进行诈骗才是真。",https://p3-sign.toutiaoimg.com/pgc-image/RXIggMOJDfNSN0~noop.image?_iz=58558&from=article.pc_detail&lk3s=953192f4&x-expires=1700279154&x-signature=YUbrMbc9h7NLEBVEx5NSJM1MHCU%3D
「MG动画」“杀猪盘”诈骗套路大起底，速看,https://so.toutiao.com/search/jump?url=http%3A%2F%2Fwww.toutiao.com%2Fa6924508740116808205%2F%3Fchannel%3D%26source%3Dnews&aid=4916&jtoken=e5cb68446a79ba5d6b844e3a2da048e7874f1c53d34272c36ad62457c2335a26120b2c59b36d84ff24189296e8f7cf89a95d1a298a5d0fd7671a05c1fedd1dcb,,"以诈骗为最终目的的“杀猪盘”诈骗 什么是杀猪盘? “杀猪盘”是骗子业内的行话 近年来,电信网络诈骗逐渐兴起, 杀猪盘属于交友类诈骗中的“精准诈骗”...",新华网,"一晃眼

春节近在眼前

“杀猪过年”是一种过年的标签

但接下来

我们要说的

不是杀年猪

而是以恋爱为幌子

以诈骗为最终目的的“杀猪盘”诈骗

什么是杀猪盘？

“杀猪盘”是骗子业内的行话

近年来，电信网络诈骗逐渐兴起，

杀猪盘属于交友类诈骗中的“精准诈骗”

在“杀猪盘”中

交友工具是“猪槽”

聊天话术是“饲料”

恋爱交往像“养猪”

最终实施诈骗就是“杀猪”

杀猪盘流程大起底

先“找猪”，

他们包装自己

通过婚恋交友网站与你结识；

再“养猪”，

平日里的嘘寒问暖，装脆弱秀实力，

都是想取得你信任的把戏；

又“喂猪”，

这时候对方怂恿你购买

他们自己开发的虚假股票等金融产品，

让你小赚一笔；

最后“杀猪”，

小赚一笔的你觉得好开心，

于是对方让你大量投入，

最后对方得手失联。

杀猪盘后面是谁？

资料组：

写剧本，挖掘人性，都是他们的擅长

话务组：

跟你聊天的就是这群人，

打造完美人设的还是这群人，

抠脚大汉依然是这群人

技术组：

建网站，算概率，这群人为你造梦

洗钱组：

从你这骗来的钱，他们清洗漂白，装进自己的口袋

杀猪盘话术大揭底

在用手机赚外快，

先跟着我玩玩吧，

保证你赚钱；

先借点钱给我，

赚了马上还你；

我这高频彩中奖率特别高；

贷款很容易，马上就能翻身；

我不能和你视频，我还没做好准备；

请考虑下我们和父母的未来。

民警提醒

永远不知道网络那端的是谁

所以交友也好、投资也好

都要提高警惕，

不要被甜言蜜语、金钱蒙蔽了双眼！

不转账，擦亮眼，绷根弦，防诈骗，入心间！

如果遇到此类诈骗，请第一时间拨打110报警！",
逾千名女子网恋“高富帅”被骗3000万，警方揭秘“杀猪盘”诈骗内幕,https://so.toutiao.com/search/jump?url=http%3A%2F%2Fwww.toutiao.com%2Fa6721869968360620556%2F%3Fchannel%3D%26source%3Dnews&aid=4916&jtoken=e5cb68446a79ba5d6b844e3a2da048e7af38d3878071e998f00b3c6c048e6618d62992131a2eab31f9657e9a318caa0d1c64f0477ed9ed7a6c7fb1d7c4d5545c,http://p1-tt.byteimg.com/img/pgc-image/RYKSyImCMmjArm~tplv-26tn0yjwph-cspd-v1:276:184.jpeg,"从而成功诈骗受害人钱财,该作案手法俗称“杀猪盘”。7月26日,渝中区检察院以涉嫌诈骗罪首批批准逮捕了15名犯罪嫌疑人。离异女被骗得倾家荡产“我谈恋...",中国网,"警方押解犯罪嫌疑人回渝。

“重庆组抓捕成功”、“湖北组抓捕成功”……仅仅20多分钟，分布在全国各地的7个抓捕组行动结束，嫌疑人悉数落网。这是一起境外特大跨境系列网络诈骗案，截至案件破获时，该案涉及受害人1500余名，涉案金额高达3000余万元。

去年11月以来，渝中警方先后接到多起用知名社交软件和婚恋网站冒充“高富帅”对离异女性实施诈骗的案件。嫌疑人以恋爱的名义与受害人交往，博得对方好感后，才告诉对方自己平时在博彩网站上购买彩票，有内幕可以一起投注，待受害人投入大量资金后，嫌疑人会突然消失，从而成功诈骗受害人钱财，该作案手法俗称“杀猪盘”。7月26日，渝中区检察院以涉嫌诈骗罪首批批准逮捕了15名犯罪嫌疑人。

离异女被骗得倾家荡产

“我谈恋爱被骗了20万元，除了向朋友借钱，还在几个小额贷款平台贷了款，现正在卖房子还债呢……”今年初，陈娟（化名）向渝中警方报警，哭诉自己的遭遇。

陈娟告诉民警，她有过一段短暂的婚史，因为性格不合离婚了。看着身边姐妹出双入对，恩爱甜蜜，自己也想尽快交个男朋友。去年11月底，她在某交友平台上认识了陌生男子张某。张某了解到陈娟的情况后，对她发起了爱情攻势，殊不知，一场骗局正在等着她。

百人诈骗团伙浮出水面

通过前期侦查，专案组分赴四川宜宾、广安、重庆南川、湖北、福建等地开展集中统一抓捕行动。经过仔细摸排和严密布控蹲守，6月20日上午9点，7个抓捕组异地同时行动，成功抓获刘某、范某、杨某某、胡某某等骨干成员和多名业务员41人。

骨干成员和业务员落网后，该诈骗团伙的组织架构和运作模式全部呈现在专案民警眼前，从而揭开了“高富帅”暖男的真面目和“杀猪盘”式诈骗的内幕。

聘请心理学博士培训骗人话术

在与受害人发展进入恋爱阶段后，诱骗受害人至其平台投注，同时发送一些在其APP赚钱的截图给受害人，说是自己平时赌赢的，最终目的是诱骗受害人到公司所谓的博彩网站上下注。后由业务员指导受害人在该网站充值下注，前期小额下注让客户小赚，诱导受害人加大投注，如果没钱了，业务员会出主意说可以向各种小贷平台借款投注，至客户再也无钱下注时，利用高赔率和黑球及编造理由拒绝提现、关闭APP等方式让客户充值的钱全部化为乌有，而业务员则按比例对客户亏损的金额提成。据犯罪嫌疑人范某供述，受害人参与赌博的平台受公司控制，前期业务员诱骗到受害人感情后，再实施诈骗。受害人输掉的所有钱都进入了公司，而非平台，至此“杀猪”过程全部结束。

犯罪嫌疑人何某交代，自己在朋友的推荐下进入“众森共赢”，到公司后先培训半个月，老员工教在电脑上进行博彩购买的详细操作，随后配发一台专用手机和笔记本电脑，上面装有交友软件，要求从网上下载帅哥照片后包装成开公司的“高富帅”成功单身人士，同时自己又丧偶，至今未找，为的就是博得同情。随后以恋爱的名义聊天，待感情基础升温后，诱骗受害人进行网络赌博，实施诈骗。诈骗团伙为了确保骗到受害人钱的概率，公司还聘请心理学博士硕士进行话术培训，并形成话术本，与受害人聊天时可以在复制粘贴的基础上进行发挥。

受害女性的年龄大多在30-45岁之间，被骗的最大一笔钱款为300多万元，最少一笔也有1万多元。受害人为了挽回本钱，投入了所有积蓄，借遍了所有亲戚朋友，有的还在小额度贷款平台进行贷款，最后不惜卖车卖房。在感情骗子的利诱下，她们越陷越深，醒悟时才发现被骗，此时已无回天之力。

据了解，该团伙公司有严格的纪律规定，不能私自外出，为防止业务员私自离开，进入公司后个人手机和护照等证件全部上交，防止其诈骗行为被公安机关侦查发现。

如何防范“杀猪盘”诈骗？ 涉及钱财，谨慎再谨慎

民警介绍，此类诈骗手法是犯罪嫌疑人利用受害人心理需求，通过包装“高富帅”和“真心相爱”等技巧骗得事主信任，随后以赌博的名义实施“杀猪盘”诈骗。

渝中警方提醒，尽管诈骗分子的诈骗方式、手段多种多样，但是套路都是一致的：博取信任、以利诱之。在婚恋网站物色恋爱对象时一定要多方核实，争取多见面沟通了解，也可以让亲人朋友帮忙把关参考，不要沉浸在虚拟世界中谈情说爱，避免被骗色骗财。如果对方提出让你打款、转款，凡涉及钱财支出的情况，一定要谨慎再谨慎。只要树立良好的防诈骗意识，提高警惕、保持清醒，遇到可疑的诈骗分子迅速报警，诈骗分子终将无计可施、无处可逃。

关于中美贸易战，这些消息都是假的！搜“中国网”抖音号（787874450），看你想看",https://p26-sign.toutiaoimg.com/pgc-image/RYKSyImCMmjArm~noop.image?_iz=58558&from=article.pc_detail&lk3s=953192f4&x-expires=1700279160&x-signature=V8gcv4bUFTEoVHFH0GIpqJ7nm%2Fg%3D
“杀猪盘”诈骗，披着网恋外衣的陷阱,https://so.toutiao.com/search/jump?url=http%3A%2F%2Fwww.toutiao.com%2Fa6907510272328630797%2F%3Fchannel%3D%26source%3Dnews&aid=4916&jtoken=e5cb68446a79ba5d6b844e3a2da048e7fbe3aa6f58609c595cd19ed748981a6d568ee5b3ea5bc5081c1cbe0df74454a2518a49c5c5df1c5d6292a89d45004bd7,http://p1-tt.byteimg.com/img/pgc-image/Rrg6p356Gd1mYJ~tplv-26tn0yjwph-cspd-v1:276:184.jpeg,"防骗知多D “杀猪盘”,一个披着网恋外衣的诈骗陷阱,让不少向往真爱的单身男女栽了跟斗。骗子关怀备至,扮演“完美恋人”接近事主,取得信任后诱骗其到...",光明网,"【“杀猪盘”诈骗，披着网恋外衣的陷阱】防骗知多D “杀猪盘”，一个披着网恋外衣的诈骗陷阱，让不少向往真爱的单身男女栽了跟斗。骗子关怀备至，扮演“完美恋人”接近事主，取得信任后诱骗其到虚假投资平台投入资金。事主一旦上当，往往面临巨大的经济损失和心理创伤。近日，广州天河警方接报一起以“杀猪盘—虚假投资理财”手法实施诈骗的案件，女事主阿云（化名）被骗走24万多元。警方提醒：网络交友需谨慎，涉及金钱莫轻信。广州警方通报

来源： 广州公安",https://p3-sign.toutiaoimg.com/pgc-image/SJVbDkkJClZvsr~noop.image?_iz=58558&from=article.pc_detail&lk3s=953192f4&x-expires=1700279163&x-signature=pF25d35unNH2RWTNEbmjRn82tOM%3D
