标题,标题链接,首页缩略封面图,首页缩略文段,发布者,文章正文内容,图片链接
老师、医生这种在编的首选!境外回流人员亲述“杀猪盘”诈骗过程→,https://so.toutiao.com/search/jump?url=http%3A%2F%2Fwww.toutiao.com%2Fa7269201432233050676%2F%3Fchannel%3D%26source%3Dnews&aid=4916&jtoken=e5cb68446a79ba5d6b844e3a2da048e7d0ed47a499ba516e433946a38d83418133063e64ba0722821bdd1c1d530969b0a426c87175477d2f74eabba1f1d25988,https://p3-sign.toutiaoimg.com/tos-cn-i-tjoges91tu/438baded65807904f611295787c09180~tplv-26tn0yjwph-cspd-v1:450:294.jpg?_iz=102390&from=search&x-expires=1708387200&x-signature=I1UwPaXqNDiRxhHbSHh%2FunVr37I%3D,"谁知竟然落入诈骗公司圈套,成为诈骗公司罪犯的帮凶,每天要做的便是找寻“杀猪盘”诈骗的受害目标。来听听胡某亲述的诈骗过程↓境外诈骗回流人员:“杀...",光明网,"近年来，跨境诈骗和网络赌博犯罪现象严重。随着我国境内打击力度的加大，大批违法犯罪团伙窝点开始向境外转移。犯罪集团头目和骨干躲在境外，打着高薪招聘的幌子，诱骗招募涉世未深的年轻人赴境外从事诈骗活动或网络赌博犯罪，带来极大危害。

这些不法分子是如何

利用高薪招聘诱惑境内人员出境的？

到了境外又有何遭遇？

如何有效打击跨境赌诈集团犯罪？

……

一起看

↓↓↓

假冒招募者用境外高薪工作诱惑

团伙分工明确组织偷渡

近日，广西防城港边境管理支队，历时一年捣毁了一个特大组织偷渡团伙。2022年8月，防城港边境管理支队通过边境预警设备发现有可疑人员在边境线附近活动，并当场抓获6名偷渡人员。经突击审讯，民警又在周边区域抓获了3名组织运送者和11名偷渡人员，两伙偷渡人员都自称是受“境外高薪工作”诱惑，在“蛇头”安排下企图偷渡出境。

在随后的深入调查中，民警又抓获了“蛇头”陈某及负责组织运送的司机5人、偷渡者23人。以“陈某”为首的团伙落网后，专案组继续紧盯重要线索，发现“陈某”的背后还有5个分工明确的组织偷渡犯罪团伙，涉及境内和境外。

专案组民警介绍，这些团伙有专门成员假冒招募者，在国内各网络社交平台发布所谓的“高薪招聘”信息，吸引他人与其联系，一旦有人上钩，又有其他成员遥控这些人偷渡。

广西边检总站防城港边境管理支队民警：这6个团伙在作案时，彼此间用电话、微信等作为联络工具，他们根据境外“蛇头”的指示，就像长跑接力一样，采取分段、分批、绕关避卡等方式运送偷渡客，以逃避警方打击。

鉴于后面5个团伙涉案人员多、涉及地域广、组织链条长等因素，该系列团伙案被升级为国家移民管理局督导案件，并与福建省公安机关紧密合作，历经6个月缜密侦查，先后开展10次收网行动，抓获组织运送者42人，查获偷渡人员103人，查扣涉案车辆23辆，捣毁中转窝点7个，打掉组织偷渡犯罪团伙6个，全链条斩断一个横跨内陆边境的组织偷渡通道，有力震慑了跨境违法犯罪活动。

今年2月开始，广西东兴市人民法院陆续对6个团伙的涉案人员进行一审宣判，截至目前，被告人陈某等32人因犯组织、运送他人偷越国（边）境罪，被判处有期徒刑1年到3年9个月不等，并处不等罚金，36人因犯偷越国（边）境罪，被判处有期徒刑7个月到11个月不等，并处罚金。另有60人被公安机关处以行政处罚。

境外回流人员亲述诈骗过程：

最好是找有编制人员

被高薪诱骗偷渡出境，然而境外的高薪生活真的那么美好吗？2020年，胡某被一条“打字工作月薪1万元”的广告吸引，随后与对方联系进入缅北。谁知竟然落入诈骗公司圈套，成为诈骗公司罪犯的帮凶，每天要做的便是找寻“杀猪盘”诈骗的受害目标。

来听听胡某亲述的诈骗过程↓

境外诈骗回流人员：“杀猪盘”盯上30岁左右离异的或者单身的，有一定经济能力的，最好是找那种公职人员有编制的，比如说教师、律师、医生，因为这些人征信比较好，即使没有一定的存款，也能贷款。通过各种社交软件、相亲网站，公司给我们出资源给我们出号，给我们包装成一个成功人士。受害人如果想调查我们，是可以在网上查到的。

国际间协作不断加强

有效打击跨境犯罪

这些被骗至境外的年轻人，被迫实施犯罪行为，自身也受到了伤害。跨境打击电信网络诈骗以及网络赌博犯罪目前仍有诸多困难与阻力，专家认为，维护我国公民合法权益，加强国际间的司法协助，是有效打击跨境犯罪的重要举措。

中国社会科学院国际合作局副局长廖凡：真正想要对这个案件，能够有效参与进去，能够去保护我国公民在海外的这种合法权益的话，那么都需要跟行为地的政府也好，警方也好，要有一个合作。通过这种合作，去行使我们的管辖权也好，去参与到这个案件的侦破过程中也好，这个都是非常必要的。

而随着国际间的协作不断加强，即便犯罪团伙身处境外，也将受到更有效的打击。

北京师范大学法学院教授彭新林：我们刑法中，刑事管辖有一个重要的原则叫做属人管辖。如果最高刑是三年以下的话，是可以不予追究。但是我们中国刑法对于这些中国公民在境外受到伤害的这种行为，是可以适用的。虽然犯罪分子他在境外，我们暂时无法对他采取一些相应的强制措施，但是只要他一旦入境中国境内，我们就马上可以对他采取相应的立案侦查措施。同时即使他在境外，我们也可以通过加强国际执法司法合作的方式，来对他们追究刑事责任。

转自央视新闻

来源： 央广网",https://p3-sign.toutiaoimg.com/tos-cn-i-tjoges91tu/438baded65807904f611295787c09180~noop.image?_iz=58558&from=article.pc_detail&lk3s=953192f4&x-expires=1700279370&x-signature=0c0SCeWNWbAPKmmjRyu7B4vRa0s%3D
“新型杀猪盘”，已有房东被骗近500万!,https://so.toutiao.com/search/jump?url=http%3A%2F%2Fwww.toutiao.com%2Fa7276331945745990204%2F%3Fchannel%3D%26source%3Dnews&aid=4916&jtoken=e5cb68446a79ba5d6b844e3a2da048e75d6b3938456ac6fe2aab4910c957074614c6a6b6f435b79c6ca163a6121d92cedd7a02a4d93a2de3b5bbf0be044193dd,https://p26-sign.toutiaoimg.com/tos-cn-i-tjoges91tu/ed24180fa5ffd7743742cc251718b3b5~tplv-26tn0yjwph-cspd-v1:450:294.jpg?_iz=102390&from=search&x-expires=1708387200&x-signature=nhfXjOYk9K4F6508rCAjEiaOJCQ%3D,新型杀猪盘骗局主要对房东、民宿老板有较大“杀伤力”房东在网上发布信息后骗子冒充租客进行联系待与房东逐步建立信任后开始慢慢诱导房东投资房东不...,光明网,"“杀猪盘”这种骗局

你一定不陌生

但是

以租房为由头的“新型杀猪盘”

你了解吗？

新型杀猪盘骗局主要对

房东、民宿老板

有较大“杀伤力”

房东在网上发布信息后

骗子冒充租客进行联系

待与房东逐步建立信任后

开始慢慢诱导房东投资

房东不知是计，于是被骗

林女士家住山西太原市

计划将一套闲置住房出租

便在多个租房平台上发布了房源信息

然而，前来咨询的租客

都因价格、租期、要求等方面

不合林女士的心意

直到半个月后

「完美租客」终于出现了

这个租客很另类

一上来没有问房子的情况

而是先发来自己的身份证件获取信任

随后在聊天中

逐步树立起这样的形象：

工作体面——证券公司

8岁女儿——懂事听话

租期问题——三年起步

房租问题——不讨价还价

林女士很高兴遇到这么好的租客

就等签合同收租金了

经过一段时间的接触

林女士和“租客”之间熟悉起来

除了聊一些日常生活中的事情

“租客”告诉了林女士

一些“了不得的东西”：

他发现了证券交易的漏洞

在特定时间进行特殊操作

就能稳定升值

过了几天

“租客”突然发了一条着急的消息

大概意思是他今天有些事

无法操作证券交易系统

想请林女士给他帮忙

之后便发来链接和账号密码

林女士想着操作也不难

就用对方的账号密码操作了一遍

结果短短十几分钟

就赚了好几万元

这下林女士按捺不住了

主动询问对方是如何做到的

她开始跟这位“租客”一起投资

在不到一个月的时间里

向“租客”转账50余次

金额高达504万元

直到这位“租客”将其拉黑

林女士才意识到自己被骗

尽管期间成功提现过几次

但依然损失了490万元

01

骗子通过租房软件或二手交易平台精准选取目标，与房东互加为好友后，以租房为由，在交谈中包装自己“完美租客”身份，提供伪造身份证件和照片获取房东信任。

02

骗子和房东聊天，透露出自己投资有门，见房东感兴趣或者放松警惕时，趁机把假投资网站信息透露给房东，甚至主动提出让房东帮助自己操盘来吸引房东，通过骗子之间的协作，诱导房东“一起赚钱”。

03

骗子通过操作配合让房东先小赚一笔，等房东加大投资后，骗子就会卷钱消失，把人拉黑。

1.凡是标榜“内幕消息”“稳定高回报”的网络投资理财都是诈骗!

2.不要轻信非正规渠道推荐的投资理财。

3.相关网络平台应该树立全民反诈、全社会反诈的理念，加强对平台用户的防骗提醒。

4.如遇可疑情况请拨反诈专线96110进行咨询。一旦被骗，及时拨打110报警。

来源： 江苏警方",https://p3-sign.toutiaoimg.com/tos-cn-i-axegupay5k/0f796865037943d1b06300df39295417~noop.image?_iz=58558&from=article.pc_detail&lk3s=953192f4&x-expires=1700279373&x-signature=uSb4pxRcvfF5%2BpBmaB6EfUixg94%3D
境外回流人员亲述“杀猪盘”诈骗过程，受害目标多找这类人,https://so.toutiao.com/search/jump?url=http%3A%2F%2Fwww.toutiao.com%2Fa7269015897535382077%2F%3Fchannel%3D%26source%3Dnews&aid=4916&jtoken=e5cb68446a79ba5d6b844e3a2da048e723f718cb9f4f99f9cdf75290b70cc4b33a7f10ec9b3bf11bd678775e335227ee09e7833fc6b168fa3d9bfd34a0deb25c,https://p26-sign.toutiaoimg.com/tos-cn-i-tjoges91tu/55c9dffdc3bff514327eada743524768~tplv-26tn0yjwph-cspd-v1:450:294.jpg?_iz=102390&from=search&x-expires=1708387200&x-signature=SGZaeiecWTylpdc5m%2B%2BcorMDMcw%3D,"谁知竟然落入诈骗公司圈套,成为诈骗公司罪犯的帮凶,每天要做的便是找寻“杀猪盘”诈骗的受害目标。来听听胡某亲述的诈骗过程↓境外诈骗回流人员:“杀...",光明网,"近年来，跨境诈骗和网络赌博犯罪现象严重。随着我国境内打击力度的加大，大批违法犯罪团伙窝点开始向境外转移。犯罪集团头目和骨干躲在境外，打着高薪招聘的幌子，诱骗招募涉世未深的年轻人赴境外从事诈骗活动或网络赌博犯罪，带来极大危害。这些不法分子是如何利用高薪招聘诱惑境内人员出境的？到了境外又有何遭遇？如何有效打击跨境赌诈集团犯罪？

广西：跨境偷渡团伙落网 成功斩断一条偷渡通道

近日，广西防城港边境管理支队，历时一年捣毁了一个特大组织偷渡团伙案件。2022年8月，防城港边境管理支队通过边境预警设备发现有可疑人员在边境线附近活动，并当场抓获6名偷渡人员。经突击审讯，民警又在周边区域抓获了3名组织运送者和11名偷渡人员，两伙偷渡人员都自称是受“境外高薪工作”诱惑，在“蛇头”安排下企图偷渡出境。

在随后的深入调查中，民警又抓获了“蛇头”陈某及负责组织运送的司机5人、偷渡者23人。以“陈某”为首的团伙落网后，专案组继续紧盯重要线索，发现“陈某”的背后还有5个分工明确的组织偷渡犯罪团伙，涉及境内和境外。

境外高薪工作诱惑 团伙分工明确

专案组民警介绍，这些团伙有专门成员假冒招募者，在国内各网络社交平台发布所谓的“高薪招聘”信息，吸引他人与其联系，一旦有人上钩，又有其他成员遥控这些人偷渡。

广西边检总站防城港边境管理支队民警：这6个团伙在作案时，彼此间用电话、微信等作为联络工具，他们根据境外“蛇头”的指示，就像长跑接力一样，采取分段、分批、绕关避卡等方式运送偷渡客，以逃避警方打击。

鉴于后面5个团伙涉案人员多、涉及地域广、组织链条长等因素，该系列团伙案被升级为国家移民管理局督导案件，并与福建省公安机关紧密合作，历经6个月缜密侦查，先后开展10次收网行动，抓获组织运送者42人，查获偷渡人员103人，查扣涉案车辆23辆，捣毁中转窝点7个，打掉组织偷渡犯罪团伙6个，全链条斩断一个横跨内陆边境的组织偷渡通道，有力震慑了跨境违法犯罪活动。

今年2月开始，广西东兴市人民法院陆续对6个团伙的涉案人员进行一审宣判，截至目前，被告人陈某等32人因犯组织、运送他人偷越国（边）境罪，被判处有期徒刑1年到3年9个月不等，并处不等罚金，36人因犯偷越国（边）境罪，被判处有期徒刑7个月到11个月不等，并处罚金。另有60人被公安机关处以行政处罚。

境外诈骗回流人员落网 亲述诈骗过程

被高薪诱骗偷渡出镜，然而境外的高薪生活真的那么美好吗？2020年，胡某被一条“打字工作月薪1万元”的广告吸引，随后与对方联系进入缅北。谁知竟然落入诈骗公司圈套，成为诈骗公司罪犯的帮凶，每天要做的便是找寻“杀猪盘”诈骗的受害目标。来听听胡某亲述的诈骗过程↓

境外诈骗回流人员：“杀猪盘”盯上30岁左右离异的或者单身的，有一定经济能力的，最好是找那种公职人员有编制的，比如说教师、律师、医生，因为这些人征信比较好，即使没有一定的存款，也能贷款。通过各种社交软件、相亲网站，公司给我们出资源给我们出号，给我们包装成一个成功人士。受害人如果想调查我们，是可以在网上查到的。

国际间协作不断加强 有效打击跨境犯罪

这些被骗至境外的年轻人，被迫实施犯罪行为，自身也受到了伤害。跨境打击电信网络诈骗以及网络赌博犯罪目前仍有诸多困难与阻力，专家认为，维护我国公民合法权益，加强国际间的司法协助，是有效打击跨境犯罪的重要举措。

中国社会科学院国际合作局副局长 廖凡：真正想要对这个案件，能够有效参与进去，能够去保护我国公民在海外的这种合法权益的话，那么都需要跟行为地的政府也好，警方也好，要有一个合作。通过这种合作，去行使我们的管辖权也好，去参与到这个案件的侦破过程中也好，这个都是非常必要的。

而随着国际间的协作不断加强，即便犯罪团伙身处境外，也将受到更有效的打击。

北京师范大学法学院教授 彭新林：我们刑法中，刑事管辖有一个重要的原则叫做属人管辖。如果最高刑是三年以下的话，是可以不予追究。但是我们中国刑法对于这些中国公民在境外受到伤害的这种行为，是可以适用的。虽然犯罪分子他在境外，我们暂时无法对他采取一些相应的强制措施，但是只要他一旦入境中国境内，我们就马上可以对他采取相应的立案侦查措施。同时即使他在境外，我们也可以通过加强国际执法司法合作的方式，来对他们追究刑事责任。

来源： 央视新闻客户端",https://p3-sign.toutiaoimg.com/tos-cn-i-tjoges91tu/55c9dffdc3bff514327eada743524768~noop.image?_iz=58558&from=article.pc_detail&lk3s=953192f4&x-expires=1700279375&x-signature=gEulZ%2FrPlhu3A873ceXKbkw1xyc%3D
“杀猪盘”首选有编制的教师、律师和医生?境外回流人员亲述诈骗活动全过程→,https://so.toutiao.com/search/jump?url=http%3A%2F%2Fwww.toutiao.com%2Fa7269241630970970643%2F%3Fchannel%3D%26source%3Dnews&aid=4916&jtoken=e5cb68446a79ba5d6b844e3a2da048e7057e71a271ef486ff3339fc0db02722660e023e340c394fcfae320cc253865b73f3a63cd040d18b6eba496b8eeb904db,https://p3-sign.toutiaoimg.com/tos-cn-i-tjoges91tu/438baded65807904f611295787c09180~tplv-26tn0yjwph-cspd-v1:450:294.jpg?_iz=102390&from=search&x-expires=1708387200&x-signature=I1UwPaXqNDiRxhHbSHh%2FunVr37I%3D,"谁知竟然落入诈骗公司圈套,成为诈骗公司罪犯的帮凶,每天要做的便是找寻“杀猪盘”诈骗的受害目标。来听听胡某亲述的诈骗过程↓境外诈骗回流人员:“杀...",光明网,"近年来，跨境诈骗和网络赌博犯罪现象严重。随着我国境内打击力度的加大，大批违法犯罪团伙窝点开始向境外转移。犯罪集团头目和骨干躲在境外，打着高薪招聘的幌子，诱骗招募涉世未深的年轻人赴境外从事诈骗活动或网络赌博犯罪，带来极大危害。

这些不法分子是如何

利用高薪招聘诱惑境内人员出境的？

到了境外又有何遭遇？

如何有效打击跨境赌诈集团犯罪？

……

一起看

↓↓↓

假冒招募者用境外高薪工作诱惑

团伙分工明确组织偷渡

近日，广西防城港边境管理支队，历时一年捣毁了一个特大组织偷渡团伙。2022年8月，防城港边境管理支队通过边境预警设备发现有可疑人员在边境线附近活动，并当场抓获6名偷渡人员。经突击审讯，民警又在周边区域抓获了3名组织运送者和11名偷渡人员，两伙偷渡人员都自称是受“境外高薪工作”诱惑，在“蛇头”安排下企图偷渡出境。

在随后的深入调查中，民警又抓获了“蛇头”陈某及负责组织运送的司机5人、偷渡者23人。以“陈某”为首的团伙落网后，专案组继续紧盯重要线索，发现“陈某”的背后还有5个分工明确的组织偷渡犯罪团伙，涉及境内和境外。

专案组民警介绍，这些团伙有专门成员假冒招募者，在国内各网络社交平台发布所谓的“高薪招聘”信息，吸引他人与其联系，一旦有人上钩，又有其他成员遥控这些人偷渡。

广西边检总站防城港边境管理支队民警：这6个团伙在作案时，彼此间用电话、微信等作为联络工具，他们根据境外“蛇头”的指示，就像长跑接力一样，采取分段、分批、绕关避卡等方式运送偷渡客，以逃避警方打击。

鉴于后面5个团伙涉案人员多、涉及地域广、组织链条长等因素，该系列团伙案被升级为国家移民管理局督导案件，并与福建省公安机关紧密合作，历经6个月缜密侦查，先后开展10次收网行动，抓获组织运送者42人，查获偷渡人员103人，查扣涉案车辆23辆，捣毁中转窝点7个，打掉组织偷渡犯罪团伙6个，全链条斩断一个横跨内陆边境的组织偷渡通道，有力震慑了跨境违法犯罪活动。

今年2月开始，广西东兴市人民法院陆续对6个团伙的涉案人员进行一审宣判，截至目前，被告人陈某等32人因犯组织、运送他人偷越国（边）境罪，被判处有期徒刑1年到3年9个月不等，并处不等罚金，36人因犯偷越国（边）境罪，被判处有期徒刑7个月到11个月不等，并处罚金。另有60人被公安机关处以行政处罚。

境外回流人员亲述诈骗过程：

最好是找有编制人员

被高薪诱骗偷渡出境，然而境外的高薪生活真的那么美好吗？2020年，胡某被一条“打字工作月薪1万元”的广告吸引，随后与对方联系进入缅北。谁知竟然落入诈骗公司圈套，成为诈骗公司罪犯的帮凶，每天要做的便是找寻“杀猪盘”诈骗的受害目标。

来听听胡某亲述的诈骗过程↓

境外诈骗回流人员：“杀猪盘”盯上30岁左右离异的或者单身的，有一定经济能力的，最好是找那种公职人员有编制的，比如说教师、律师、医生，因为这些人征信比较好，即使没有一定的存款，也能贷款。通过各种社交软件、相亲网站，公司给我们出资源给我们出号，给我们包装成一个成功人士。受害人如果想调查我们，是可以在网上查到的。

国际间协作不断加强

有效打击跨境犯罪

这些被骗至境外的年轻人，被迫实施犯罪行为，自身也受到了伤害。跨境打击电信网络诈骗以及网络赌博犯罪目前仍有诸多困难与阻力，专家认为，维护我国公民合法权益，加强国际间的司法协助，是有效打击跨境犯罪的重要举措。

中国社会科学院国际合作局副局长廖凡：真正想要对这个案件，能够有效参与进去，能够去保护我国公民在海外的这种合法权益的话，那么都需要跟行为地的政府也好，警方也好，要有一个合作。通过这种合作，去行使我们的管辖权也好，去参与到这个案件的侦破过程中也好，这个都是非常必要的。

而随着国际间的协作不断加强，即便犯罪团伙身处境外，也将受到更有效的打击。

北京师范大学法学院教授彭新林：我们刑法中，刑事管辖有一个重要的原则叫做属人管辖。如果最高刑是三年以下的话，是可以不予追究。但是我们中国刑法对于这些中国公民在境外受到伤害的这种行为，是可以适用的。虽然犯罪分子他在境外，我们暂时无法对他采取一些相应的强制措施，但是只要他一旦入境中国境内，我们就马上可以对他采取相应的立案侦查措施。同时即使他在境外，我们也可以通过加强国际执法司法合作的方式，来对他们追究刑事责任。

转自 |央视新闻

来源： 南宁晚报",https://p3-sign.toutiaoimg.com/tos-cn-i-tjoges91tu/438baded65807904f611295787c09180~noop.image?_iz=58558&from=article.pc_detail&lk3s=953192f4&x-expires=1700279377&x-signature=Wk%2B7Y%2BO46TwQjOSIJJRd%2Fr6%2BGlg%3D
